bebop hunter	It s the 9th album please
PUBG BIZZLE	Do love the band but I ’ m just not seeing the variety in sound these day It ’ s like how many time can you churn out the same song Not hating I ’ m a massive fan but for a band that ha evolved so much they are certainly stuck in a rut at the minute just releasing the same song over and over bleh 12 0 0 12 0 12 10 0 and repeat for 3 album Again just my opinion obviously still going to see them when they are in my town just a bit gutted with the latest release from them
André Hosken	MDS QUE BANDA
Sideness	We re gon na fight hard in the pit
Donlyn Staz Kuroneko	Your wife a soon a you open the front door
Sam Jardine	Liking this better than the last two
Nikoleta Fellner	BEST BAND EVER ❤️
juan atmaja	D E E P 🔥
Tomáš Kampf	Awesome 31 1 Prague I m waiting 4 U guy 😉
Callan Paterson	What No BLEGH
Petros Laloukiotis	Can we take a moment and appreciate how violent intense the way he growled Are these our new messiah sounded Like holy hell where are these vocal coming from
Memphis 13	Awesome ❤️🖤
xyLooo	Naysayer V2
Detestor 420	This is a fucking crusher
Shivs	That little melody in the background during the chorus is so fucking beautiful Josh you re a god
Михаил Маслов	To my mind song is pretty good but guitar part is too easy for architect s song
Tommy Raviglione	fucking slap
Benjamin Müllner	When you rent a studio for a week and have to record a music video every single day
Nazrin Brubaker	This and Royal Beggars are totally awesome but I hope there more song like Hereafter in the album I hope they dont turn into a full on EMO Metalcore band
Bushcraft Buddha	We used to run with the wolf meaning we were in a perfect symbiosis with nature and our surroundings Now we re running behind technology which ha become our new god Technology measure and quantifies u so we become predictable and replaceable But you can tcompute measure or quantify what come from the heart welcome to the time of modern misery
g h o s t k i d s	It it just me or do some part sound like AMMIH specifically the all the anchor in the ocean part Either way it such a good song 👊👌
Siturba	Prepare yür anüs für new albüm
Virtual PradaZ	Architects AND While She Sleeps new song on the same day Today is a good day
Olivier Seyler	I m just banging my head a hard a I can Well done guy Well done 🤘🏻👌🏻
Joel Puente	Deje de escuchar Metalcore desde Sempiternal BMTH porque la escena cada vez se esta volviendo un poco gay Pero este album de Architecs va muy bien y los temas uno mejor que el otro son el mejor exponente al dia de hoy
David van Vuuren	Brilliant
Ένη Φλού	❤
Austin Kuhlenschmidt	I can only imagine the hate for this but As much a I like architect this is lacking like the other song released already They ’ re still better than 95 of artist out there but without Tom they simply aren ’ t impressive a before It ’ s like there ’ s just something missing to it and unfortunately I don ’ t think AOGHAU will be topped
Mike Hunt	Tom would be so proud of you guy like honestly you really are keeping his legacy alive 3
Cole13517	Bleghtastic 10 10
Terry Bowman	i swear that i extremely love Architects to the core Architects is fucking pure art
dynatwenty	i love you
Ashish Pisharodi Drums	nolly
Craig Simmonds	This band just keep on delivering 10 10 what a tune
OuttraZd	Heavycore
Samy	My body is ready
HCROCK	Seven billion hungry ghost
Ramadhan Sudaryanto	This is insane🔥
Johannes Sch	It s crazy since Lost Together they never changed their sound but at the same time they re constantly getting better
linchpyn	Hearing a new Architects song is like when you get together with a good old friend after a long time The first 15 30 min are rare but then you get realized everything is a cool a always
Sinan Uluc	I can listen to this all day
Aldi Satriahidayat	3 20 these color dont run vibe
Léna Oliveros	Holy hell All our god have NOT abandoned u because A R C H I T E C T S still here … Awesome 🖤
Charlie Stackhouse	Sam ’ s vocal are fucking savage on this one Especially on their own at the start Jheez
Tu Gfa	2 05
Andre Anna	❤️❤️❤️
Фореигн Дицк	Someone show me where the BLEGH is at I can t find it
violet goodman	Stop screaming at me Can this guy only do high
Khal Lamar	Santos demonios qué himno el que sacaron estos cabrones 🤘
Trankvillin t6 Shirokovskih	Это не Джордж Миллер расходимся
Joe McPhail	Def one of my favorite band and not just out of whats left of metal either Thanks guy keep it up rip tom
syanachannn 95	I don t like hard music I want Architect keep make song like royal beggar one
João Vitor Mesquita	This music fit right into the reality of Brazil I feel thrilled listening to this song
tak jest	Incredible Those sound from momento mori corissing over
DaveyCrockett5000	I wasn t ready for that Love it
Kabz	fuck i don t remember the last time i wa this keen for an album to drop
Anibal Zuniga	Gees this band is coming out hard and im loving it can not wait for the album to come out
Jamie Lawrence	This is ok Reminds me a bit of Daybreaker but also feel like a bit of a standard Architects song structure I think Hereafter is a much better track this might work really well sandwiched in the middle of an album though
Johnny Rakete	Holyhell wa ein Brett🔥🖤
Iron Moon	This will most likely be the metalcore album of the year
NinjaCloud	Sam is a beast vocalist he can scream like that with an arrow in his heart Goddamn
Bartosz M	First Architects then WSS 3
JimboShreds	Anyone notice the Momento Mori vibe at the end though Goosebumps
Soyer	So heavy and angry Love it very much
Mandi Hernandez	I ’ m so in love with them Now and then there amazing beautiful 🖤🖤🖤🖤
tofol cano	Damn why is Gus Johnson so angry
Amy	I haven t been this hyped for an album in year
Cj Cribbs	Holy Hell each new release is just better than the previous this is easy choice for album of the year
sirtagada	I think a few people just misclicked on the thumb down button instead of thumb up
TheTallTom	I am in love with everything this band ha ever done
Cameron Little	I think if I wa a caveman I would have run the fuck away from the wolf but this song may have helped me get along with them p s Ali taking a picture of Dan passed out in a pool of blood wa fucking hilarious
Giorgos Abso	I expected a nice ol BLEGH after the second Modern Misery 10 10 still
Siddhartha who?	Hell is empty all the devil are here singing u the lord ’ s prayer Damn true Vatican City cough cough
Jonathan Jimenez	Nice
Remember Me	JARED
Jason Bentley	I used to be an adventurer like you then I took an arrow in the chest
berk ayaz	Çıldırıyorum
Ádám Völgyesi	Hey look a new Architects song without a blegh
Hitwood Melodic Death Metal 2018	1 46 the magic happens But I wa wondering why there are no BLEAGH s at 3 19 It would have been perfect btw New Architects and new While She Sleeps in the same day With this constance they release all the album song before the release day of the album will come
Mr VossoRox	No bleagh no party
dante	WE USED TO RUN WITH THE WOLVES
Acoustic Showcase	I may be wrong but I think we have a BLEAGH Guinness Record Here 00 33 LOL
Ruben Muller	Holy shit
Work For it	Why are they so good 😍 I cant wait to see you again in Poland
Dom O'Brien	Why is there no fucking LOVE button on YouTube
britney arkin	Royal beggar is my fav new single That one go hard af But i have mad respect for anything these mofos release 🙌🏻🖤
Handian Hutabarat	This breakdown could make a tsunami
Cappelletti Benjamin	I am so ready for the new album Can t wait
GlarhzillaFox	Fucking magesitc These guy know how to write emotional banger
Chrono S	Architects Silent Planet Ice Nine Kills Holy trinity of current metalcore ❤
Sam Dobson-O'Neal	Naaaaaaa Not Natural at all How can a band just keep getting 20 time better everytime You fucking champion
Logan Riley	God I love this band Brilliant
Lil Pump	💕💕
Andrey Vasilenko	Respect from Russia guys🤘🏻 You are the best 🔥🔥🔥
Bartłomiej Kotlarczyk	this could be the end of the world thank you Architects
AceOfHearts	Wheres youtubes love react my god I cant beleive you guy keep upping your game no matter the adversity you face Fucking killing it x
Artūrs Virsis	This got me waking up this morning better than any coffee Such an adrenaline coming from their song
Tyrone Loney-Wright	Awesome 👌🤘
Yudho Stwn	Nice halloween costume sam
Chelt scene Uk	❤
Marcus Quidenus	There will be a lot of hater but for me their new song are a little bit to slow and kinda sluggish I like their new music too but not a much a their older song
Peter Baker	Is it just me or if you listen to the chord underneath the mid section it sound a lot like Memento Mori
Imran Sahir	Architects and While She Sleeps are two of the greatest band in business right now WSS is a bit underrated but they ll get there I can t wait for this album
Michael Pfund	Hearing memento mori reference in the chorus 🤔 absolute banger 💥
Aeour	Sounds like they re about to release yet another masterpiece
Jesse Stewart	They can do no wrong dying to hear this album
ilikeittight	Awesome song but no blegh prayforblegh
Craig Kasiske	I let my parakeet listen to this song now it s a dragon
Gleb S	пацаны второй видос подряд блюют дайте им уже угля кто нить жалко же
attila Kaszonyi	Ohh🖤🖤🤘
Al ჻ 。	IM GETTING DAYBREAKER VIBES
NEIL SAEL	75 and counting disliked this because this ha no BLEGHS
JD Carfield	Damn man I wa one of those guy yelling SYLOSIS in these thread on YouTube and IG and now I m ashamed Although Sylosis will always be my all time favorite this band is the best thing out right now Each song they ve released off this album is special I can t wait to hear the whole thing
Dwayne Voisey	Gave it the thumb up before it started because these guy are beast
Alexander Walker	7 2 Will listen again
Дедушка Колхоз	Not bad
настя белова	все новые песни одинаковые какие то
Jack of all Trades	Sick
a_silent_songbird	Awesome song aside Sam look like he s been hitting the gym
Crispy Calzonie	Fucking banger
Proton Rus	Who is from 2018 Who is from 2019 Who is from 2020 Who is from 2021 Who is from 2022 Who is from 2023 Who is from 2024 Who is from 2025 Who is from 2026 Who is from 2027 For the future
Tom	Love the story that they tell with there music music videoclips
Mr X	JUST A PARASITE KILLING A TOAST
Дмитрий Пунин	Be careful and prepare to consequence This song just divided my head by zero after this my head divided by zero everything around in act of epic headbang
Adam Miškove	bitch this is quite heavy for architect
Mitch Shipard	You guy are awesome Come to Toronto please
Danjah	wow
Dariø GR	ΑΝΑΤΡΙΧΙΑΣΑ
CardboardWallet	this wa kinda weak though tbh
Jason Gore	That bass that synth that voice that drum that guitar
Alex Malandiy	No blegh no life
The CrazY Bass Man	new year came early for me Architects and WSS with Anti Social
Bishal Bhattacharya	Am i the only one hearing a bit of memento mori in the chorus
Callum Mason	Damn how do you always seem to capture my own feeling a I form them hail to woden and the wolf
Dmitry Timofeyev	Preach it Sam
zack Jones	really suck
Harrison Edwards	Cum in my as this is incredible
Laura Franke	i need friend who listen to this kind of music badly
nisa noire	sam s vocal are just amazing
DELUXSONGAMING	My dick is so fucking hard to this video
Jerred Robinette	Youre the only band I know that make me cry with everyone sing you have released Why do I connect with these song so much Idk it hurt but I love it at the same time
Muhammad Faris	hidup melayu
Yam !	Great Song Progress is real
stoenchu122	Heavy song and meaningful lyric Architects still sticking to their root
EpicArianas	Architects are the only band left in a stale genre that is continually pumping out amazing music Keeps my faith in hardcore alive 🖤🖤
Randy Evan	No bleagh
D Hansdah	first 30 sec in the video goosebump already
hum an	Let get this album to number 1 boiis and gurls show them that metalcore is still alive and well
LostinOC	YAAAS QUEEN SLAY
DRAGTR0N	i wa just looking for something to enjoy my cigarette to and oh boy
allseeingowl 1220	Who else expected a blegh in that beginning breakdown Lol
Michael Chikviladze	I m bit disappointed there wa no BLEGH
Nick Johnson	I think it ’ s the weakest of the single so far It ’ s a good song I don ’ t have a problem with it at all Did Tom write all the technical guitar part in LF LT The riff were super sick AOGHAU ha slow but heavy hitting riff a doe HH so far I prefer LTLF but I also love these
Josh Torre	Best metalcore vocalist of the year
just1goon	wow just wow it 6 45 atm in germany im waiting to go to school but im so flashed by these guy cant wait to see them live in february here in germany
Jesus H	goddamn this will be my favorite architect album for sure insanely good
Mia Vegan	there s not enough water in the world to wash the blood from our hand this ha so much history and meaning behind it wow
Alex La-Chiusa	No blegh to be found Not good 0 10 Just fucking with you Song rule
For 20	This is my favorite of the 3 most recent release but they never disapoint
Ben Hamdorf	The breakdown on this album are incredible
Сатана Печет Блины	Sometimes I feel sorry for Sam s vocal cord
Anjelo Baruelo	SIIIIIIIICK bleugh
Renzo Bse	En un mundo donde BMTH me decepcionó por primera vez Architects y The Amity Affliction lanzan los mejores nuevos álbumes
Fischkimme	Can ’ t get rid of the feeling that royal beggar and modern misery sound very similar But still 9 10 Bleghs
Jesus Christ	I ‘ d go to the grave for you a second time tbh Love you 🖤
Johannes Life	AHHHH D 🎃🔥❤️
Super Sweatt	That replay button lookin real sexy right now
Pitra Agung	Holy Hell should be Album of The Year without exception
Marcos Cortes	AWESOME
Faris Haiqal	Fuckinh harddddd
Srinivas Pepalla	Like and watch
limonad666	Amazing king is back
eyeshalfclosed	Is it just me hearing a little bit of Memento Mori in the chord progression here O
andreasy 73	Damn sound and feel so good in my ear
Emperor Gontier	Holy hell Will be an epic album
Jannis	Fact is I love architect and their style They ’ re good musician and they know how to bring out bad as song another fact is since Unbeliever the style never changed and every song sound just like the one that got played before
Erik Jason	Every time Architects is releasing another single song is always definitely a masterpiece They are heading in the right direction in this upcoming album
Так Блэд	ебать как же ахуенно
Ian Dalton	Jfc Josh Middleton brought some Sylosis sauce on this one
Kaelen Brix	damn architect are indeed the GOATs of metalcore
Jimmy Klasson	Sweden love u guy keep it up 🤘
mohd shahrizan Ramli	Architects just save my life sound a bit cheesy but you guy just did that beyond that perhaps
David Ll	This is perfection
Toby K.	Jesus Christ my left year wa not ready for that beautiful brutal low end 2 second in and I m already hype
Dániel Deák	Sick af
Dark Incision	I pre ordered AND ITS FUCKING SIGNED Can t wait to get it guy x
Tommy The Krunk	I don t like how sam say modern misery so much also the structure of the song is jarring which is not made better by a unimaginative and uncreative breakdown I mean it s the same riff from the intro speaking of which is played TWICE tom is gone and sadly it starting to show
Kyle	Is there light at the end of the tunnel guy
Noah Stoddard	With these lyric this had the potential to be really great song but the synchronization between the instrumentals and the vocal were off
Mikey V	Loved it buttttttt where s the BLEGHHH that I look forward to
William Moffatt	I used to be a metal singer like you Until I took an arrow to the heart
George Veras	Lindo demais
Tania Castro	Ok I m dead this song amazing
Aldo PrasetyA	http www youtube com watch v hLGS5YGy5k
jose kruzpe	The chorus have the same tone of the song memento mori
Payish Deen	we all know that Josh have his own signature guitar with Sylosis by ESP but with Architects he still use late Tom s guitar signature such a good friend ❤️
Street Drummer	Yess Loving those drum
Robbie Jones	I ’ ve always been a sucker for clean guitar This song is the dope
Christopher Robin	Holy FUCK Words don ’ t do this masterpiece any justice The day will never come where the Architects disappoint me
Cole Vick	Doing every thing in your power not to destroy your ear ability to process the album to come a a full piece is so hard to with every track these Gods put out not to put every track on repeat until your ear bleed But you can t do that Fuck it Ill rent more ear This track is too damn good
Richie Arriola	3 30 killed me
Huy Yang	Wow everything they ve released so far this year ha been amazing
Ricardo A	The only band with society is shit lyric that I can t cringe to Fantastic song
Aylê Roqueiro	AMAZING I LOVED IT 3 3 3 \m
zean freak	Who like this fucking song at the first hearing indonesia
Adam C/ FIRINGSQUADraf	Now i have to buy a new headset bc 110 volume just blew these bitch but worth it
Jhon K	I discovered Architects by accident and I m glad it happened
Windson Elric	Are these our new Messiah Cos the savior ha a gun to my head There s a curious fact about this lyric Brazil where I m from elected a fascist piece of shit a the president today and his name is Messias Messiah in Portuguese
Jedidiah Bertram	4 track released so far All 4 fucking brilliant
Toms Alcore	1 03 cool
Malkit Singh	We Used To Run With The Wolves You re Right Sam We Are So Lost Now
Brent Growe	Awe man so good So So So good
nicolas santana	Don t worry he just use the Amaterasu what good fucking song dude
Owen C	Can t wait for Holy Hell to drop This is yet another sick song fuck yes \m
Alejandro Maldonado	Está disquera no me gusta por que tiene más banda alternativas pero por ellos e que estoy suscrito al canal
Tide Apparel	This is going to be deadset the biggest album of the year and probably next year and most likely the year after that
Brady Hargett	ESP HORIZON with cockstock Nice
Apis Boh	Goosebump
Clay Drummond	Album of the year LET ’ S GO
Sumit Aich	Nice work
Waldenor Neto	Comecei a ouvir essa banda faz pouco tempo e já é a minha segunda favorita Simplesmente maravilhosa a músicas do cara
Joe Smo	Goddamn those high harmony
Seize IMmUnITy	Great work guy keep up the badass work ❤
Mike Lemasney	The Goat 👌🏻
Serj McCoDZombi	💪😏👍
Janny Doesnt Know	METALCORE G O A T🔥
Missy Sarge	Oh hellz yes
Enrique Rojo	Esto está de puta madre 🤘
Jake Young	SO FUCKING GOOD Album of the year for sure
Edan Corner-Evans	Takes me back to GWTW love this so much Keen for the new album
Ángel González	57 Dislike Fuck that fucking people l
Solaire Of Astora	Holy hell this made me tear up
Avik Das	Thank you Architects You have kept me alive for so long You are the band that gave me one last hope when i wa about to quit
just browsing	79k in 5 hour that s an Architect song for you 😍
UziNineMillomeetah	I didn t think I could like an album more than Gods but it look like Architects have hit a home run and topped it All these single have been killer Can t wait for the release
R W T	This might be the only album this year that could potentially rival Ice Nine Kills
Brianna Schiraldi	Obsessed 😍
rastamann20	MODERN BLEGHSERY
I Took Your Pizza	I M READY FOR IT I M READY
Jeahn Dütra	Thats amazing
Collin Pizzo	they sound good but i wish they d experiment with more sound we ve heard the same sound a lot from them
Chris Bullock	THIS this lady in gentleman is how you properly transition a heavy verse with a clean chorus Again Architects never fails to impress
Jaén G	You guy have definitely improved so much this is just an eargasmic piece of art that transcends music Sublime
Sam Jones	🖤
Jack Baldwin	Architects proving to be better then amity ’ s new album i never thought I ’ d ever say there ’ s a better band then amity but architect stay consistent with their genre and they make wicked music well done guy
Sergio Pineda	another one Hell yeah
Nikita Dream	Отличная работа вы на высоте как и ожидалось Спасибо за ваши клипы и песни вы помогаете идти дальше P S Жду ваших концертов
Gabriel Martins	Duuuude Mind blown Epic
Trool u	If you need my soul just to keep getting the message out you can fucking take it
samuel sanchez	Bruh this is extremely hard 🔥🔥🔥🔥
Nina st	The hell must be empty Cause all the devil are here Damn man
William Karyadi Johan	INDONESIA BLEAUGHHH MANA SUARA NYAA
Дмитрий Сальников	Как всегда душевно
Monasster	band of the year and album of the year EASILY
Raimy Winter	Yuuuush
Brandon Maciel	dat bass be heavy
Klebert Oliveira	Excelente banda
DOPING OFFICIAL	How can someone not to love Architects 🤘
Javier Chevory	I thought he wa Shaun from Shaun of The Dead
Jon Costello	Holy Hell is an understatement
victowz	Does anyone heard the click sound at 2 20
Rodrigo Colina.	NICE 3 Venezuela
AaronLanegan	what language is this
Gerardo Aguilar	Wow♥
ian roca	Epitaph they re so many great band on the record 🤘
Cassper 302	Song is unreal Just wow
Stoneman180190	Parkway Drive we ’ ve got the metal album of the year Architects hold my beer
MAS PAYID	in reff like all love is lost
diemonos 28	This song to me is the spiritual successor of Nihilist from AOGHAU even in how it sound and a the other comment have pointed out really doe feel like it can fit in that album But so do the other single from the album so far I also tried combining both album artwork just to see if they somehow fit and holy hell do they fit fucking perfectly http pb twimg com medium DqpA3fAUwAAcocn format jpg name medium I swear this song is like a harmony part to Nihilist More chillingly is how the lyrical theme really mirror each other woooh I shake
Sinister818 Soul	I m getting dreamy vibe from this
Yeni sopiyan	Cool 😎💞💗💗💗💗
Denny FrogUgly	📂Documents └📁Music └📁Architects └📁 Bad Songs └⚠️ This folder is empty
Murder Mitten	Estos Ctm tienen q puro venir a Chile wn
Miguel	I will not live like a slave Architects giving me strength to make these small group of word become real in my life 3
Who Died Wolf	YES DAN HIT THAT FUCKING CHINA DUDE
Iqbal nugraha	heavyer than my problem life
Allove islost	ALL LOVE IS LOST PART 2
sawtoothscream 1	Sounds like royal beggar in many part Really really hoping they let Josh open up a little more Seems like a waste to have a guy that can play the fuck out of the guitar and not have him rip a massive solo at some point at least
Hendro Supriyanto	Damn Is there any band better than Architects in these metalcore scene right now
Fernando Mora Ortiz	No mames que hermosa canción
Andrew Mazza	Fucking brilliant gentleman
Joe	Architects is the shit
Giovanni Lopez	Sam Carter look a lot like that Pointdexter guy from Daredevil season 3
anderson silva	Oh
Leonardo Farias	More of the same Nothing new over here It s cool and all but they keep using the same formula over and over again In my opinion it s starting to get tired
benjamin farkas	Nice Piece from Hungary 👌
Jhoel Torres	When this song is available in spotify
Jonathan Topping	HOLY HELL is really shaping up to be a modern masterpiece Is it November 9 yet
MSI First Comment	É a NOVA ERA
Moisés Ruiz	Que bien están haciendo la cosas alv YA LOS QUIERO EN MEXICO
AGamersDeath	MOTHER OF GOD There wasn t even a bleh in this song it is still a banger Forget Bring Me The Horizon Architects will take over from now on
Ho Sway	need more bleghs
Michael Romero	3 hour ago holy Shit bruh
Jordi I	I found architect a month ago oh boy I have to say the best metal core band
Marc Von Luigi Argosino	OMG damn Architects digging out the sorrow from the grave and building up the hope of making damn good music everytime they release a track
Joel Lee	Architects never disappoints
luiz 2713	Im just fucking ready to Holy Hell
Luis Valentin	I absolutely love how the bass brings back Memeto Mori s chorus line Clearly demonstrates not only continuity to the genre but also to Tom s memory and writing niche I love this band
Enol Iskandar	Beautiful
Dream Sphere	I really love this band and their new album but I can ’ t help thinking what this album could have sounded like this if Tom wa still around Maybe better maybe worse RIP Tom Searle Forever in our heart
Empyr	In the Blegh we trust
Snelkookpan420	Truly magnificent
ferna2294	I pissed myself
Zach Fish	Some of the best vocal I ve ever heard
Blash	ÉÉÉ BOLSONAROO PRESIDENTE DO BRASIL
gbs666	
Artur Sereb	Awesome
jck 1794	that harmonized screaming sweet jesus
Tracy Marten	Urghhh Gave me lady wood 😂😂😍
PP PSCH	I love this band❤️❤️❤️
Rahul SV	Tom is proud of you guys❤️
AZKYoutube	I just lost one of my close friend to bone cancer earlier this week Architects releasing new music is helping to ease the pain Thank you for making such perfect music 💓
kingdeathbat	1 45 I am fully erect
Clee Blatt	I cant but I want to marry this band Just because I know it would never disappoint yet always bring in something new to fall in love with ❤
Migz - Kun	Holy Hell more like Holy Fuck I ’ m ready for the album to come to my hand
leonardo giacalone	the better one welcome back guy
siim605	There ’ s not enough water in the world to wash the blood from our hand
Dyl With It	TYLER IS A BITCH LIKE IF YOU AGREE
Lift And Let Live	Damn I can ’ t wait til this album come out
Coco Loco	I guess we re getting a music for all of Holy Hell I am in favour of this
akometiyal	Make BLEGH great again
Jessie Garcia	Banger after banger Great job mate Looking forward to the new record
