bebop hunter	It s the 9th album please
Brittany Kauenhowen	Album of the year for sure November 9th can ’ t come soon enough
Brandon Remigio	Man this hit hard
YASH SINGH	Hell must be empty all the devil are here Ferdinand William Shakespeare s The Tempest Damn architect this is a goddamn masterpiece
adi survivorfan	wa waiting for the blegh tho but still this track is a killer
riyadh fahrudin	HOLYhell SHIT
Ernesto Dorado	Joder
Millin Albuquerque	i lov u Architects 3
Parkway Driver	Architects and While she sleep new song today Day gold
Hugo Leonardo	I ve already heard this song 20 time in a row Hahaha
AJluckyB	New Architects New While she sleep what a good time to be alive
Ben Murphy	99 100 could use a BLEGH or two
Sonic The Hedgement	I swear Macklemore ha gotten heavier since Thrift Shop Good on ya mate
Petar Jenjić	BANGER
Aaron Jimenez Galindo	Son grande
Gabriel Campos	\m
Kio esiel	Medern BLEGHsery
Mother Ovum	some of the base line sound so close to Momento Mori I am incredibly stoked for this album
Rob Brown	They are pushing hard for that album of the year but they have given u 3 track And they have destroyed the competition
Oli Hayes	PUTANG INAAAAAAA
Mark Esmond	i LOVE this song but this video feel weird and rushed
Rebecca Wojtaszek	It is impossible for this band to write and perform a bad song all of their work is pure gold and straight from the heart
T-Rev 2020	Great song Just missing a blegh
Ying Golg	Woah major chill rn This is amazing
JOKE485	We planted a seed
Oksana Kladkevich Okspiration	Guys you are awesome Привет из России
Dark Drake	Bury tomorrow architect and a I lay dying in the same year is the best
Bradley Gavel	Oh my god please come nov 9th
therockstar barber	Only band now still going strong still worth listening too Awesome song
Derrick Andrews	I see new Architects I click
telesed	Это просто шикарно
sirpiccolo	Kanye can go suck it with his best rock song comment
Brett Johnson	I ’ ll always love Architects but they are starting to become Gideon That band that make good music but almost every song sound the exact same and it get old after 20 song
Umberto Giordano	BLEAGH
Artorias of the Boreal valley	Architects is like a fine wine with time they just keep getting better and better
Daniel Mcfeeters	the goose bump
Selbatrose	here before 100k view
Саня Вася	now they gon na bleed every video
Jieo Lin hao	That we re all puppet with a lifetime debt
Shamil Men	Came here before 1k comment
Steve Walker	Is it Nov 9th yet
CT Cape	Powerful video and word Amazing
Jordan Quirion	Architects and Dance Gavin Dance in a battle for Album Of The Year
andres torres machuca	Hermosa cancion nunca decepciona Architects
Antonio 224	Wow that ’ s heavy bro🤘🏼
Andrés Montiel	OMAIGAD YES My ear are eyaculating this song is an orgasm Can t wait to see them at Milan 🤘
Josep Puigcerver	My neck is ready for the new album HolyFuckingHell
BerriBare	One of the few good metalcore band alive
ThatBlindGuy247	Holy Hell is definitely gon na top AOGHAU at this rate 😍
Stavros Sideris	that s nasty 3
I Hate Long Usernames	I am fully erect
Hutch	Awesome song I think that s the normal 3 single for every album right 1 Royal Beggars 2 Hereafter 3 Modern Misery i have to listen to it more ALBUM OF THE FUCKING YEAR
Odes gr	COME TO ATHENS
jacob minnish	Why doe every song start with that synth smh nice breakdown though
Jakub Brabec	The best part 0 00 4 12
MioNami	This one doesn t do it for me for some reason
Noah Lee	33 people ran with the frog instead of the wolf smh
CIRCUMSTANCES	New Architects New like
Michael valdez	Hell must be empty All the devil are here Damn I actually got goosebump from this
GoneBananaz	You guy NEVER disappoint
Tyler Rodriguez	I miss sylosis so much but at least architect doesn t disappoint
Mentos Mint	MAKE BLEEEGGHHHHHHH GREAT AGAIN ❤️
octabw	archi fo0kin techts
Ej Hull	I ve never been so hype for a album release like I am for HOLY HELL
TheMetalMAN1987	ALBUM OF THE YEAR 🤘😝
Francisco Gumaro Abundio Valdes	is more than incredible and I want the disc to come out
V Ch	The best from album so far This beast is killing I can t wait for album not anymore Love you Architects
Bill S.	love it
Spencer Whiteout	The breakdown is the same a the opening riff Not a big fan of that
Jay Myburgh	Error 404 Blegh not found
Matt Loyd	If you didn ’ t get chill by 3 20 you need to see your therapist
Mehmed Çetinkol	Amazing
Dillon	This new album is already turning up pretty meh compared to the last The lyrical content is not that interesting and the music is all copy paste the same sound over and over again
Ossi	This Album is gon na be so great Really proud to be a Architects fan You guy have suffered through a terrible situation and actually managed to make something great of it Much Love for you lad
Unlim Core	Zaebis ’
Joko Curioso	Three single in and still it s this good This band is something
Luis !	Excelente Architects como siempre manteniendo su forma
Vit0or	There ’ s not enough water in the world to wash the blood from our hand
Tasos Tsoulfaidis	Best fucking metalcore band The more album they release the better they become Phenomenal
Pedro Gomes	No word needed 😍
WoodVisuals	Already calling album of the year
Max James	Not sure if it ’ ll just be guitarist who notice this but I swear the last part of the song ha Memento Moris chord or at least very similar one
Vince Sawyer	Omg it fucking huge Nice to see that amazing growing up of the band Every fucking single of this album that drop seems like a cry from the heart Of course Architects are biggest band today surrounded by these genre these riff and drum and the clip story amazing work Thank you for much for making me emotion like that 3 P S Sam is a fking monster Great vocal these different extreme vocal and mixing clean and just using clean between em goddamn wtf great charisma great actor play Look forward to next work
Praetorian Foil	royal beggar still the best so far
Joshua Shine	God damn
Periphery Riffery	Wait I m at work
We Are Triumphant	These guy let loose everything and I ’ m fine with it
kurtisbray	❤️
LEONARDO OLIVEIRA	Muito top amei amo sua banda mano fodaaaaaaa de mais
Murilo Rocha	For god s fuckin sake come to Brasil
LEAVING EARTH	они создают
Marwan Mostafa	Wow 👏🏻👏🏻👏🏻
zdan only	thank god they keep heavy unlike bmth
Sebastian Sikora	When i ll stop cry when you hit something new from 5 year and intensively from month You are incredible Thank you
Saiful siv	What a good music Love it greeting from MALAYSIA ARCHITECTSFANS R I P TOM
f0rzeew0w	Песня хорошая но ожидал чего то нового от них ибо я все это уже слышал в предыдущем альбоме Даже грустно как то
Juxued	Another one💙🔥
Micah Crewson	I wa waiting for what I would call a copyrighted blah when the drop hit but it never came disappointed a bit
1984marmo	Not the best
Pedro Rosado	You guy are just outstanding one song better than the other
FrancuzAD	I can feel a strong Hollow Crown taste in it That mean BUSINESS
masterhew	Andrew Baena is going to rock this i cant wait
Will Blair	🤘🤘🤘✊🤘🤘🤘
francisco gomez	Fucking amazing
Sr. Imperial	SALUDOS ARCHITECTS DESDE🇨🇴🇨🇴🇨🇴🇨🇴
hands on fire	This one is gud ✌️
NoAh JoSePh	New architect or my wife s baby delivery Sorry honey
Blond Panda	Melody from memento mori at the end there
Pod Qap	IN
atextmessage	Got damn
Scott	Yaaaaaaaaaaawn
HybridBros	Another amazing song cant get enough can not wait for this albumn so in love thankyou guy
InfiniteR4iN	It took me 12 year to realize that I like hard music 6 year more to realize that music can be so much more than something you listen to That wa when I found Architects I started to really getting into band not only this one reading backstorys interview lyric Search for thing I could learn from song I fell into a hole because of bullying anxiety and shit like that I bought All our god have abandoned u And it fucking saved my life Short moment of bliss 3 to 5 minute each made me rethink many thing Listening to the album over and over again kept dragging me out of my personal hell At the next Architects show I visited I cried my soul out All the emotion The ability to actually let them out triggered by simple word sung by a normal person September 18 I fell into another hole Broken heart more anxiety the fear of losing my job Then Hereafter wa released Holy Hell wa announced And I just couldn t stop smiling Probably one of the biggest smile in my entire life For me this band is more than just music They made me understand what music mean to me They kept me alive They brought light into my darkest day And the sad thing is I will never be able to thank them in person for doing more for me then most people on this planet So I will write it down here Thank you Architects for giving me the strength to fight my depression For saving my life twice And for making the fucking best music I could listen to I look forward to your show in munich next year ❤ So this wa my story Short version but still longer than i thought it would be And Thank you to everyone who made the effort to read this
CodyEntities	How is it possible for a band to have this many amazing single back to back to back Massively impressed
Lil Rawr	oh my fookin gawd 🔥🔥🔥🔥🤘
scartitty	So fucking sick they can t be stopped
Devin Jones	fuckyeahmotherfuckers
Saha Sok?	Modern Miserblegh thebleghbegin
ian blunthand	W O W
Its Aodhan	2 20 Ali captioned “ lmao me af ”
icanmakeeverythingilovedie	This is the weakest of the single and it is still downright fucking beautiful This is going to be AOTY by a longshot I regret not getting into this band earlier so much good material that I missed for so long
simone c	i m a big fan of architect but this song it like a bonus track of Lost forever lost togheter Same idea same vocal line an ambient already listened but im hopeful for the rest of holy hell P
rocknroller 418	Smashes like button before even clicking on the video
Haunted Knight	This album will be their best Bet
Zaiful Nizam	Before mil
Tony Kravitz	A masterpiece after another These guy talent ha no end
Eduard Mandrake	My fucking God this is amazing
dirtydirtybiker	Fuck that s immense 😍👏
Flavien Jonville	finally my favorite OG death vocal
Raul Garcia	Thats it whateverthe cost i must have Holy Hell 3 Architects thank you for the art that you make lml
Jalon Swinton	Bro they never be letting u down god damn
Luisifer	Can t wait for November 9th
Máximo Esequiel Montoya	Nothing to argue about best band around the world doesnt matter what are u lookin for Architects will always give u more than u expect
Odinox	Damn I guess I been sleeping on this band 8O
flyingmanforfun	Mehh not digging this one Hereafter and Royal beggar just seems to flow better lyrically if thats even a word
FreakG26	1 45 another new dimension for Sam
Sebastian Manjarrez Serna	I don t wan na live like a slave anymore Great song guy
Alex Steverson	I ve never clicked on something so fast Architects are the GOAT Liked then watched because I know it will be an amazing song
Luke Thomas	What doe he mean when he say Don ’ t be fooled by Maya the king are all thief
NAS4	Siete mil millones de fantasmas hambrientos
Joe Oxspring	Shit thump
Joshua Mast	Did anyone else feel like this had a slight nod to WCAR and Kyle I m not even sure why I thought this just have it
Adrian Ruizvisfocri	Modern Bleghery
angreband DRAGON	chelsea grin old architect
Piotr Jegliński	How about all song with video
Gimme Dopamine	I like it more than Royal Beggars but not a much a Hereafter However make no mistake I love every song they have released so far We used to run with the wolf I interpret that a Mankind having strayed so far from our true nature It s hard to judge a song from one listen First impression is I love it Will listen many more time Can t wait to listen to the full album from start to finish over and over
Izz Jackson	anyone know when this will be released on spotify
Влад Тучков	вокал посадил песня одна на другую похожа дожили lost the vocal the song look like one another we have lived
Max	One of their best song to date
Guillaume Chevreux	Absolutely mental What an amazing song See you in Paris D
Gilbert Liu	Tom is gon na be very very very proud
Juan Felipe	You made it again guy Amazing I m so excited with this album
Thras Stefanidis	MASTERPIECE
TheMikael009	10 10 Very rare I rate song that high but this ha reaaaalllyyy impressed me Can t wait until 9 November 🤘
Luca Hart	oh MAN
Playmaker	BEST BAND
ッOmar	Vamos Que vengas la demás \ v
Martin Duscha	Love it
Coockieboy3 Coockieboy03	Here we go with the best album of 2018 probably of 2019 too
Logan Welty	Chills
Thomiii	what a song dude 3 thx architect
Eikichi Onizuka	BLEGH
Mallow Marsh	OMGOMG
Ghost Iris	Another banger Holy hell
greenlight04	Hm dont like that beginning
TheBooperDooper	Really expected a BLEGH around 3 19 tbh kinda miss one in this track Don t get me wrong tho they still absolutely killed it 😛🤘🖤
Sevi Metal	gosh these guy go beyond the simple concept of music
BassMinor	Is it on Apple Music yet
Thomas Saavedra	BLEGH
Travis Turner	Wow these guy can not be stopped
Omar López	Definitivamente esta banda cambió mi vida por completo con cada video y letra de alguna u otra manera me siento tan identificado con ellos sending love and supporting from MEXICO 🇲🇽 you all guy are amazing
Abysso	I liked before i listened 🤘
George Jowett	There ’ s part of lost forever and all our god all over this absolutely brilliant
3mal3 ist3	Holy hell will be the album of the year 2018
Donovan Pujols	this is already AOTY for me
Diego Renato Patow Guzman	La putamadreeeeeeeee qué buena canción Muy buena voz me encanta
Ramon Gonzalez	Architects the band that never disappoints
Matt Petry	Love this but no blegh I ’ m shocked
Kiener Daniel	Im so hyped to see you guy next year and for the album coming on my birthday no better birthday present D
Giggs	I ve got pre cum
Rodrigo Abanto Sanchez	Good music 👍🎶🎵🎶🎵
Angela Gonzalez	❤🤘💀🔥
Ironjoshhart	I wa sad when i couldn t preorder on amazon yet
Whatever	4 out of 4 can t wait till 9th O
Jared Israel	I m really surprised that this wonderful band did not become generic like many that were also my favorite Architects is still leading the list of band that still make good metalcore Love Architects ♡
Tenshin Daw	I ’ m here
Aloys	Woow again every song better and better
Король Царь	Как всегда норм
Stephen Archuleta	Getting some serious Daybreaker vibe on those riff and it is NICE GUYS
Luke Masterton	I couldn ’ t watch the video because i wa cumming so hard my glass fell off
Tesseract Tesseract	A step closer to the 9th of November
Ben Reaper	0 18 and 3 18 Potential blegh part
Andres Cruz	But when will they drop the North American tour date 🤔
Alex Tirado	We miss your lyric and melidies Tom we miss you
Carlos Miguel	Oh my God AMAZING VOCALS
MAD Roman	Fucking awesome I m in love with this guy Fucking raging and fuming with personal trouble and song like this help put thing into perspective at least to breathe a bit easier Qué pasa España alguien por ahí escuchando musica de puta Madre Hala Celta
Matt V	I won ’ t go to the grave
Dan Golden	Wow
ALESTI	Damn I m loving this band
Comrade Kitty	Architects is AnPrim
Zachary Stevens Music	The mixing is sooo on point with this album
MDLION06	Wonderful song
David K	This is insanely good
doomeduser86	Siiiiick
Benøund	Great one
Bud McClain	Fuck yeah Excellent song
Joey Leeuwen	every single is good like EVERY SINGLE ON OFF THEM
danthegreat	I love how the intro soumded like gone with the wind thisbshit go hard
Vheissu	The first time in history I have seen a band release a track before Nik Nocturnal release the cover ha Where you at Nik
Ishaan Mehta	too much screaming
Patrick Arthur	When you press play then have to change your pant immediately Gave my pant modern misery for sure
ShaunTrack	Aquí tiene su apisonadora gracias
FollowDrunKin	Fourth song that is out basically this is already an AOTY
Bfmv Tuck	Just Architects just Perfect
ZenRacker	Instant click
brent maes	Dude holy shit how can you be so perfect Getting my Architects tattoo next week D
Akira Saavedra	I just heard this band for the first time when they released Doomsday and I ’ ve never been more excited for an album in my entire life
Cam Kornacki	Hell yeah ÷
valou78460	Error 404 Bleghhh not found
dragoezcurra	Good video I m shure most people can identify on it at some point in their life But can the music stand up on it own I m not saying it a bad song this is the type of song that you need to listen a few time then drop it for a week and then you ll like it It is not a beautifull peace a it is Hereafter and Royal Beggars The intro guitar riff is a bit lazy sound more like a bridge than a intro I wa waiting for the metalcore cliche UHHHHHHH BLAGH tbh Anyhow a week from now I will enjoy this song and I ll regret my comment on it but this is my first thought
Abelina Salvatore	That warmed my heart what a masterpiece 😭😍
RaVeN7131	fucking hell this album is gon na be killer
InsomniZach	Architects is really out there making metalcore great again
Louis Gibbins	I can really feel Tom in that lead guitar
Shinuzui	Royal Bleghgars Bleghafter Modern Bleghery
J C	I love it If I have one criticism it s that in their previous song their lyric had so many meaning and were my favourite part of listening to their music Now the lyric are a little all over the place And where wa the blegh in this song That s Sam s trade mark that we all love So excited for the new album
Muhamad Ryan Efendi	404 blegh not found
蕭偉峻	Someone please make this song into that black baby with earphone listening with max volume while cry meme
Luis Nava	Holy shit I m 1 fucking hour late
ProgRocksHardly	I m a simple man I see Architects I click and like
Kareem Majeens	Holy Hell I m ready for this album
Cristian Ferreyra	Holy Ghost Shit is SO GOOD And f ck the marketing guy BTW This campaign of releasing one Single at the time till ’ Nov 9th is f cking Killing me I wan na here it all already
Ruud	3 36 Holy shit the entire song is amazing but that is even more goosebump I have never bought an album I think this will be the first one and a very good one a well
Joshua Winters	We used to run with the wolf
Dexkill	Masterpiece
Jens Schendzielorz	THIS IS FUCKING AWESOME ART
Mike Byers	This album is going to be a masterpiece
Wahid Ai	i see architect i press boob
Tyler Tuinstra	This album is going to be fucking nut
The Dank Meme Metalhead	Ok this is modern epic 1 like 1 modern epic
Lucio Derin	This is nothing but pure art pure emotion Thank you Architects❤
名前が思いつかない	あー好き
Thunder in my eyes	OHH MY GOODNESS IT IS SO FUCKING AWESOME
Cody Corey	Please sir may I have another
Michael Angelo Urgelles	where s the blegh
Emma	YESSS LOVE THIS
Fabian Schäche	See ya in Berlin next year it going to be dope
Enix Almeida	Mano do céu Nunca decepciona 3
FantaFuture92	album Mix is a 10 10
Skeptics Analysis	Can someone tell me what the song is about
Daniel Amaral	AMAZING Greetings from Brazil
Cydraech	Why did this song have to end
Guille Nattkemper	Holy fuck
Stefan Guedes	My god 😭😭😭😍😍😍perfect 🖤🖤🤘🤘🤘🤘😭😭
Josh Hobgood	Hoooowwww
Dengle Chen	What a perfect song Holy Hell gon na be incredible Can t wait for my third Architect concert omg
Silvan Blaha	Everyone who dislike this video ha to be a Rapper
Robert Vojsovic	This emotion 🤘good work guys😝🤟🤘
Jordan Butler	13 people never ran with the wolf
Max Syn	We don t deserve Architects
Dayton 6	Architects didn ’ t have to flex like that but they did anyways they really did
Julius Caesar	This is so uninspired
Dillon Wheaton	Architects Forever
Cody Mckinley	Man this hit home This is what my soul scream every day I love you guy
Josney	Bolsonaro eleito e música nova do architect o dia ta ótimo kk
Dramatik	Great track but in my opinion Hereafter and Royal Beggers were better
Richard Lohmann	I think Architects just don t even know how to write a bad or even decent song They only deliver masterpiece 3
Chris	love it D
Gryllus	3
OTP WARWÎCK	Emotion and melody is just insane Love you D
NovoX99 13	All love is lost 2 0
Elliot Simpson	Fit for an autopsy is that you
Syn Mariano	HOLY FUCK
Anton Kuzkin	OMG fuck dude it s AWESOME i love you so much it will be perfect album thank you for your hard work
Ángela Montiel	W O W 👏
L1suS	а мне нравится
IHunK 02	I Love this band
The Metal Tris	Absolutely brilliant stuff guy Loving the new track and you killed it on BBC Radio 1 too Top lad Can t wait for HolyHell
Evel Kwanzaa	What a mesaage Love this Song 3
Chris Popp	Do we hear some crowdpleaser stuff here I mean it´s excellent but
Игорь Мезенцев	Вы перкрасны
Jan Lukas Weiershausen	Unbelievable I feel shocked 😱
Babbedeggel	I m so hyped for the new album
Joshua Miller	Absolutely love this band Come to Philadelphia
With The Wolves	Thanks for shouting u out lad Loving the new music
Mauricio Souza	What a fuck ’ n song
Taylor Klock	Damn thats a big as hotbox No wonder he couldn t tell he had an arrow in him after
Anna Rainbow	Another masterpiece
ZestyButtSizzle	Did it again you guy never disappoint
kostas konstantakis	Kinda le dynamic than the previous 3 vids but I really like the linking between this and Royal Beggars visually at least
Aaron J. Burke Music	Chord progression in the We used to run with the wolf section is Memento Mori
DeathHoriz0n	Cada nueva canción supera a la anterior ya no puedo esperar a que salga el nuevo disco Gracias Architects por darle música a mí vida ❤️
Ledmaster	AOTY for sure Sounds dope and it s the truth in these bar also
Anthony Caldwell	Imo not a good and strong a Royal Beggars Still good though
Shroomer	Album of the fucking year 👌💯🤭
riera.	Not saying that I m not enjoying these last 2 single by any mean but I hope that there s more track with complex and aggressive riff like in All Gods Have Abandoned Us
Raceforfirst gaming	Oh my day
Elle Grace	🤘🤘🤘🤘💜
Just Fun Stuff	UK 💙 The best
Jordan Spence	They keep on topping themselves Unreal band In their own league
Information_Desk	My heart
levi valentine	This doe the memory of Tom good love you guy
brian west	Absolutely favorite band of 2018 this album is gon na be sick
Renemy 92	Great 👍
Scott Taylor	Major eargasms BLEGH
Rito	Never left pornhub so fast
Arkham Inmate 777	Best Architects so ever Maybe Its def one of my favorite already tho
Skull Thuggery	I really fucking love the crossover theme with the Royal Beggars video
xjimdim	🤘 SEVEN BILLION HUNGRY GHOSTS
Justin Tromba	THE BEST BAND ON EARTH IS BACK AGAIN I NEED NOVEMBER 9th NOW
Baptiste de Schrevel	1 45 had me like oh O
Olly Dropped Dead	Yeh nah yeh fucking good m8
Drew Vantrease	This is incredible Architects never fails
Cristian Lopez	We used to run with the wolf
Br1ck	It make get some tear
dei	they never disappoint
Batterie64	HOW THE FUCK IS EVERY SONG FUCKING PERFECT WHAT
Seals Artistry	the beginning remind me nihilist
AcaciaTreeTV	Killin it like always🤘🏽
CIA	Finally the occial after the mirror P
Simon Tryhardt	Nice
Andrew Allen	omg yes
yessi Soto	Shit this is good😍❤
W h A t	so fucking good
Josemgb23	Each song is better than the previous fuck yes
Daniel Peacher	Yet another belter from Architects 😊
Marius.	Holy
wohli218	Another epic song by Architects The lyric scream melodic part surpass any other metalcore band by far I can t wait I want the album NOW
Lasher LIS	the best metalcore band of all time 🤟🏾🤟🏾🤟🏾🤟🏾🔥🔥🔥🔥
HexaNerva	The true modern misery is the wait till november 9th
Eder Campos	Very nice
Alex B	Another single for their new album BLEGH
Topikk BEATZ	death is an open door
Omar	Me like
Omar Yáñez Zavala	This music is a good thing
Moshcore 501	Gives me some Hollow Crown vibe
BS Fabrication	Just a parasite killing it host
GOLIATHUS	Holy fuckin Hell pure fire lovin it 🔥
Paescl H	Killing it again You guy are fucking legend
Architects XIII	Not a single bad single yet heh get it Not surprised though Never found a bad song from you guy off any album Just one of the many reason you guy will forever be my favorite band
cursdx	this kick
Ricky Smart	Just yes yes yes a nd more yes ma dude This is so perfect and so beautiful Its só heavy yet so melodic I love the chorus and the lyric used in this song and the one from the other single This album is going to be só good My heart wa beating so hard while listening to this
Роман Бакалдин	hey Sam cross on your neck if so i m happy
DizzyD322	They are KILLING it on this new album Sticking to their hardcore style not giving a F about selling out staying true to u fan unlike some others clear throat BMTH Loyal to you for life Architects bring the pain Bluugghhahh 🤘🤘
Andrew Taylor	I broke my neck still headbanging
Imagine D.	1 44 1 47 💜
CoolJay14745	So hyped for this album 😍
zayton	Love your raspy void
David Šmehlík	Very strong message in this song
Power Team	I liked the song so much Does anyone know the meaning behind the lyric
Architects Drive	The ONLY band that progress while keeping their loyal fanbase and making music that ROCKS Keep it up boy
Dante B.	I will go to a cave on this song I shall feed
dead SNORLAX	Wow just amazing
As Above So Below	180 Hell is empty
Josh Grimm	That wa intense
Afterlife	Im so hyped for this album 🔥
Stacy Paige	PLEASE FOR THE LOVE OF ALL THAT IS HOLY DO A US TOUR FOR THIS UPCOMING ALBUM You guy are by far my favorite band and i would do anything for the chance to see you live in person P S if you are going to give me my one and only desire then make it a poi t to go to indiana indianapolis
