House Flipping Guide	The First time I heard about Real Estate wa by a Carlton Sheets Infomercial about 20 year ago
A to Z Bhai	yaaa it s really awesome Nice
Danny Hernandez	he buy view comment but not enough like
Real First - Real Estate Crowdfunding	Good informative video
Brad Cowen	strategy for real estate investor http www facebook com investmentsabroad
David Lindahl Scam Tips for Realestate	How to avoid real estate scam and get high profit http www facebook com davelindahlrementor david lindahl david lindahl scam dave lindahl dave lindahl scam
Carlos A. Barreno	Spanish
Finlay Brewer - Brook Green	It s true Real eastate brings what all people need in this world a place to live
Jim Kelley	The beauty of real estate is that it offer a necessary piece of every person a place to live
Science Weekly	Hold up are you a millionaire because don t just go giving fact out
Norman Reidus	Thanks for the tip Bill We appreciate you taking the time to give u such beneficial insight
Porsche 911 Turbo	F cking subscribing right now
Johno Bourgeais	Wow you sound like bug bunny so cool
Team Innovation	A career in the real estate industry can be very rewarding however you need to persevere and work hard to attain success
IZMCreditServices.net	Buy Seasoned Primary Tradelines Seasoned AU Accounts Have GREAT CREDIT Primary Tradelines are 2yrs 6yrs old Auto Loan Tradeline from 600 Seasoned Authorized User from 600 Credit Profile No 250 Auto Loan Tradeline Limits 7 500 25 000 Jewelry Furniture Tradelines Limits 1 000 26 000 Tradelines post on File in 21 45 Days Need a CREDIT PROFILE NUMBER GET IT HERE ADD TRADELINES TO NEW CREDIT PROFILE NUMBER or Social Security Number GET CREDIT CARDS IN 30 DAYS VISIT Izm Credit Services
Barbra Bradley	Informative video with some very good point I started to buy Commercial Real Estate Best decision I ever made Learn The secret to success from my mentor click here u com Commercial Real Estate Cash Flow 10001 php
Connor Lexington	Hey guy you guy should try Firepa com if you want to make money online I am making over 3 000 per month Visit FIREPA COM and start making money now FIREPA COM Is paying me and my wife 10 000 Month
Kevin Hudoba	Nice
Alem A	Hello Bill I just discovered you and love your work I just subscribed too I look foward to your lesson If you dont mind me asking how many property do you own and what state Thanks
MARK TULLY	When L S Shoen wa thrown out of his company uhaul by his rogue child he used the comparatively small amount of money they gave him to buy a string of property He must have figured the property we re just like uhaul trailer in that a long a you made the needed repair they would produce income theoretically forever That is what Mr Fitzpatrick is saying to me
Sergio Tejeda	Where can i get an Action Principles book Signed
kevin race	hey Bill would it be a posiblity to be your mentor i want to watch what you do instead of just watching these video i would give you 15 of my earnings if you teach me hand on I want success i believe you can get me that point
sharpasaneraser	paid cg
SydneyPropertyBuyersAgent	Heres a tip to help you save ten of thousand of dollar in real estate negotiating view on channel tip
Hamilton Elliot	seriously
REIWealthMag	Hello Thanks for sharing this We wonder if you d like to be a contributor to the REAL ESTATE INVESTING WEALTH MAGAZINE available on the iPad We do need more real estate expert like you on board
Kyle Has Kicks	Thanks a lot I follow your vids investing in stock I just made 17 million
Joseph Colombo	ok how do i make money on line thanks joe
vyppahsanchez	well I guess this guy ha found a way to become rich
neowhyneo	kqfpvdr well I took the hard route and spent every dollar i had to learn how to make money online but hard work pay off because i now have an awesome mentor and making enough to quit my job lucky you don t have to go through my pain you can get it here bit ly OMYNpV rznlf
ansul singh	new millionaire is in LINE
Invest Brazil	Fantastic video and some very valid point for real estate investor
iiSinzxx	Great I have subscribed
Silo Yukon	Subbing a we speak
phuongcei	WOah
Thông Tin Công Nghệ	im amazed by how much effort u put into this vid
WaltCott	Nice Job forget those hater
Sven Rotner	mag ich
Ishay Kerner	OMG i really love this video
Doan Thanh Tuan	XD thumb up
Tiendat Nguyen	Good vid
thai phong Tran	like in the video very good
karimakdul	Jealous p This is a really good vid
Quach Thanh	Wow nice suicide lol
Wealthy .Clark	Thank you Ive got a debt of favour at you i dunno i spelled it correctly but im from Singapore
Karaoke  Housto.	nice channel you got
Mao Le	That video wa bloody amazing
Teo Sike	Awesme I loved it
anh mai	FullHD please
doug wilson	i put this video on myspace
Gam Nguyen	really brilliant idea genius subscribing
maschi1337	nice great jop
Andy MK	so how do i get ritch
Adam Brooks	Nothing can be a great a being your student
James Rockwell	For a little amount of 20 USD I got a copy of the Action Principles Its worth
Donald Jones	Bill You are a great speaker
Donna Williams	I watched all 5 video of these tip from Action Principles and learned a lot of new thing
David Pereira	I am new to Real Estate business and watching your video are of great help
Geneva Ellwood	I hope these tip will help me to gain success in real estate
Jerry Smith	Every word from you make sense
Judy Pippin	Thank you for this great video You always boost up my motivation
Marvin Rundell	I can t wait a long time for other tip Please send them soon
Dawn Lemus	People spent a lot of money for getting Real Estate coaching I think that is just a waste of time Going through such video will save a lot of time and money
John Souza	This is the 2nd video I am watching on this channel and I love the way you say the thing Great speaker Indeed
AFatMushroom	That video is super
itsgarylee	Super gemacht
JungKnawledge	Too many people are looking for get rich quick idea I like your get rich slow approach to real estate
WhoRU	I have been thinking about investing in real estate for some time I guess when many people are complaining about real estate this must be the best time to get going
Social Media Nuke	Looking forward to watching your real estate series thanks for taking the time to teach
kytoptu	EXORCIST BABY AT THE BEGINNING
Earl pek	Please keep these video coming good stuff
obryan sam	Damn good video thanks
Robert Sapp	you have some talent
pauling sew	I m from Toronto and real estate is very expensive here but I guess there are good reason for that
Pranav nair	I had been thinking that I should have invested in real estate twenty year ago but I guess it s never too late and I don t want to regret doing nothing in another twenty year
MrSachinns	You are absolutely right real estate is the best investment
