Philip DeFranco	Hi Its 4am Im too tired to think of a good top comment so ummm if you didn t see the Monday PDS be sure to catch up after watching your bonus morning video ok love you bye http www youtube com watch v n wW1pH3 ZY
Mario D	Hey Philip Im a fan of your show and i wanted to bring to your attention something that happened in Greece A few day ago document where released in the Greek parliament that proved that the greek government wa bribing neighboring country medium company so that they would only report and have debate show that painted the Greek government and Greece a a whole in a positive light regardless of the fact This come at a time when Greece is having important diplomatic talk with 2 of it neighbor Albania and Macedonia regarding the sea border with Albania in witch the wish to have an extra 12 mile of sea in the direction of the Albanian sea border with Macedonia the wish that Macedonia would change it name form Former Yugoslav Republic of Macedonia to the republic of Northern Macedonia I thought this would be interesting considering the party in the country aforementioned are under accusation of corruption and in some case treason
Charsept	7 10 Americans have a prescription If that s true that s really shocking to me
Caleb Crow	Anything to disrupt the Pharmaceutical Insurance company racket The reason they are able to keep price so high is that the consumer doesn t see the whole cost Thus this system develops in which you have to have health insurance to afford medical bill because the price are so inflated
shutupjonnie	I ’ m not a big fan of the president but I like this move No matter what the motive behind this could be an educated consumer is a responsible consumer This could be a great move to increase demand for lower cost drug alternative which could lead to lower cost prescription overall Hopefully this help people afford life saving medication and reduce price gouging
The Steadfast Duelist	0 59 These are so fun to binge watch Drug side effect are such a joke
MsAliceVamp	This is a really interesting topic for me because I am studying to be a pharmacy technician I just started my course a couple week ago but I know that this couple really shake thing up What I do know in the pharmacy when a person come in with a prescription unless it is expressly written my the doctor to be a brand name or you refuse to have the therapeutic equivalent generic you will get the generic which is cheaper for you Although not all drug have a generic So if the drug company have to place their price on their ad they could sly and put the price for one pill not one month supply The likely won t include the name of a generic possible because another drug company make it And of course they don t know how much each person s insurance will cover from their price There could also be discount at your pharmacy or online program like GoodRX which can be helpful if you are paying out of pocket Overall I think it could help lower price and start people taking with their doctor about why this medication is this really the right one Are there alternative But in the case of company that don t yet have generic or are the only one making that particular drug i e the incident with the price hike on HIV med and epi pen the company were the one of few if not the only one making these drug therefore people had to buy it in order to keep themselves from dying we might not see much of a change Great video Phil I am going to bring this up to my teacher to get her opinion too Thanks
Ricardo Elejalde	I ’ m a liberal and I know most that share that title have trouble admitting this but I think this is a good thing from the trump administration and ha some potential to help the people out I just don ’ t think out of the list of option they had it wa the option with the most power to change price of prescription It seems like a step in the right direction though
duo1666	It will likely lead to lower price if you increase the actual competition and remove these stupid fucking patent holder for drug Give the people who create the product some benefit of doing so but dont allow them to fucking monopolize an entire treatment
Tyler Saunders	If only America had a system where if the larger business paid a certain amount didn ’ t get large tax cut average people didn ’ t have to pay so much for proscription and cutout certain program that ACTUALLY waste money Where everyone ha the basic healthcare and you could pay for extra insurance from insurance company so you could keep them around But it ’ s America most politician don ’ t actually care about you and it ’ s easy to trick the common person
Michael Vanhaverbeke	Not the best solution it s more than any other administration ha done in at least 30 year
BigHeadClan	Doubt there will be any change to drug price but if it work then sweet you guy down South pay waaay to much for your prescription
Jaizensama Sosek’e	Why not just make health care a right
Nito 🔥	This is a good move but there those who will say why are prescription drug so expensive in the first place I think people especially Americans take for granted just how difficult expensive it is to design manufacture drug for consumer use Some people would say it should be free or low cost but in reality you can ’ t have your cake eat it too Albeit some pharmaceutical company really jack up price in order to maximize profit for themselves Mylan the Epipen come to mind but a solid majority need to recoup fund in order to move on to developing the next form of treatment Again I think this is good move that give a bit more transparency to consumer but I also think that consumer are shortsighted in their scope of how pharmaceutical work
truMalma	Finally someone trying to tackle this massive problem This is more idea for solution that I have heard in a lifetime when it come to big pharma
scohspot	Drug company have no legit medical reason to advertise prescription drug to consumer in the first place They are trying to get customer to request the drug knowing that patient are scared and a doctor is likely to cave to their request Financially speaking there is no reason for drug company to lower price even if requiring advertise the price All they ’ d need to do is add a line saying “ some insurance policy cover up to XX of the price of this drug check with your insurance to see what your price will be ” And most customer would write off the price to insurance If we banned advertising to customer that will immediately cut out unnecessary spending by drug company Next we should look into how generic drug are treated by patent holder Third switch to single payer healthcare so there is a customer who can actually negotiate against the drug company and win
Ethan Pegouske	The editing in this video wa pretty good however I think you might want to simplify it a bit This just sound like any disembodied voice speaking over some fancy editing Maybe try to show your face a little bit more like the regular video
Thromnabular	Why is Trump literally the best President ever
Stu H	Yes yes and yes I say a big yes to the cost on all ad not just TV Big Pharma can swallow their own pill
Furrnox	I m suprised yet not surprised I m surprised the Trump administration is doing anything at all but yet not suprised since Trump have to garner some popularity point with everyone except Republicans so it s a good move for him it s also kind of a non action approach because it won t force the pharma company to do much yet Trump can say he battled the pharma company in speech etc
Matt Katch	I don t think this will be super effective in getting company to lower price but at the same time I like the idea a a first measure to making American medicine more transparent and affordable
Vincent Ianniello	This feel like a trojan horse and by that I mean that it look good but isn t at all On paper I can see how this read well to Republicans a it not really directly infringing on company bottom line but it is increasing competition I actually agree with the Pharma company that adding the price to the commercial is pretty much useless As it is Insurance company barter for better price so that affect how much you the watcher of the commercial would end up paying for it and that fact render the listed price essentially useless unless you don t have any insurance and pay for drug entirely on your own A far better idea to increase competition and decrease price would be to disallow advertising on medium for pharma company 10 minute of watching those commercial will tell you why they are predatory and removing them would mean that it on your doctor to inform you about different medication or on the consumer to do their own research and talk to their doctor about option The bad side of that would be that if the government did nothing else after disallowing ad then Pharma company would likely pump all that ad money into salesperson and bombard doctor to prescribe their drug instead of others so that would need to be addressed in some way but even with that potential I still think it much better to just stop Pharma from being able to advertise on medium just like we did with Smoking company decade ago Ultimately this just seems like the Trump administration trying to have their cake keeping the promise to deal with pharma to their base while eating it to maintaining the profit margin of Pharma company
Zuny Caballero	Loved this video thank you sir
Raquel Rusu	IF this actually passed Trump would actually be like truly a epic president I can t believe he actually want to follow up on supporting average american I m scared that i m getting my hope up again after Obama
Beemer	I think when it come to these ad you are seeing on TV the reason they are making so much money is because consumer are telling their doctor they want the drug rather than asking whether or not it s the right choice for them While most doctor would tell you that it s not the right medication I can imagine there are a ton of people telling their doctor that they experience the symptom and the medication look the best for them so in order to stop arguing with the patient the doctor simply prescribes the drug for them It s one of my biggest pet peeve when someone go into the doctor s office to tell them what prescription they need Instead the assumption should be that the doctor who went to school for 8 year to help you with the exact reason why you re visiting them a a job probably know better than you do about what medication you should take With this law it would change the discussion from I know what I need and it s this medication I saw on TV to I know I want this medication on TV but it s really expensive That would allow the doctor to more easily suggest a different medication that could cost le The unfortunate reality of the situation is that people care more about their money than their own well being If they go to the doctor without considering the cost of the medication they want will be then they re more likely to fight the doctor for it because who doesn t want to live the lavish lifestyle presented on TV If they are looking for knowledge when they enter because they can t really afford the medication they saw on TV the doctor can then a lot easier persuade you into buying the kind of medicine that would not only better fit your symptom but would also be cheaper This could help a ton when it come to the medication reducing their price because they wouldn t be making a much from the commercial and in an effort to keep advertising their medicine but making it affordable to the average person they d lower it to something actually reasonable I am largely in favor of this law because at the bare minimum it force prescription medicine commercial to be even more informative I think it s dumb we have them in the first place because I don t think any doctor outside of the United States and New Zealand get people who come in to tell them what medicine they want and instead they actually listen to their doctor TL DR Medicines on TV are cool and people will TELL their doctor to prescribe it to them If the price show then they ll inquire a to what is cheaper rather than simply telling the doctor what they think they need I am in favor of the law because people are stupid and commercial for prescription med are dangerous
TheAlaskinKumquat224	Wo0oP Philip
Gikua Ook	I took half of a prescribed ibuprofen and half of an anxiety pill Hydroxyzine this morning and I threw up Remember to eat enough with your pill
Thorski	Pharmaceutical company should not be able to have commercial to begin with If something is potentially deadly to consume say fx Seroquel Not so long ago there wa a company who made Seroquel the company had not tested their product resulting in a lot of people getting worse even leading to suicide If you are worried now you should probably check online what people say about that drug you re described Wouldn t hurt
reallunacy	I find the argent used by the pharmaceutical company that the price may not reflect what you actually pay is a bit silly The more insurance company pay for drug across the market requires them to increase the rate of all of their plan so they continue to make a profit You a a consumer should be very concerned what the full price of a drug is regardless of whether that cost is coming out of your pocket or someone else s
Awesomesauce	This is a good video info wise but I think the editing is kinda bad The transition text animation etc just seem kinda bad I prefer something a little cleaner imo
snerp	
Joe Jackson	The point is YOU SHOULD NOT NEED INSURANCE TO AFFORD YOUR MEDICATIONS Damn drug company are ripping people off in the USA like you can not believe This shit isnt a huge of an issue overseas
Fatal Foxtrot	something something broken clock
Jordan Young	So for hundred of thousand of year human have survived with out chemical being shoved in our body What worry me the most is how quick we are to take pill than solve our problem I know every case is different and some people should be on prescription drug But if 70 of the population relies on drug and their body become reliant on these drug then 70 of your citizen have a drug problem I don t think putting a price on the tv is a step in the right direction It just tell you how much you ll have to pay for your next fix
Spencer Haynes	I think this is the first time i m happy trump did something
GruesomeToucan	I never thought I d say this but I m with Trump on this one lol
Charles Fish	While showing the price is good and all the price of prescription in the US compared to other country is insane This is hardly that great of a move It s piecemeal at best and a show of good intention that have no teeth Also another reason to have universal healthcare like other modern country
Place holder name is place holder	1 08 coma or death these may become permanent
James Cogswell	I despise Trump on most issue but this is a very good policy plan Credit where credit ’ s due
BtkSabora	the price that is listed need to be the direct cost of manufacture not the inflated price for profit they need to be required to give u access to the audit a well so we can see what the money is they are receiving over cost especially if there is no generic alternative
EXcentricSAM	what doe this change they are only using these rule for TV ad but if they are on social medium they are not required to i wonder where most Americans get their information from hmmmm it seems that the president and his cabinet are proposing a lot of bill that they seem to think are popular and some that are at least trying to do good right before mid term what happens if they don t win there is a good possibility this is gon na be a weapon for the potus to use during midterm
Alitza Vazquez	Easy solution Put the price of the drug assuming that the person watching the commercial ha no health insurance and put in a notation that the price can very dependent upon your insurance I remember at one point when I wa really sick and my medication ended up costing me over 1000 a month but because of my health insurance I only paid 5 buck
The Boy Icarus	I think that this is a great move Increases in transparency for an industry that involves 70 of the American population Not a Trumpie and I am very critical of him and his administration a good bit of the time but I like this move and agree with it wholeheartedly
Morgan Daniels	Love the vid Phil Keep them coming As for the subject we should ban all pharmaceutical advertising ad And I am in advertising It is inappropriate Medical recommendation should always come from your doctor Let them market to the doctor
Curtis Andersen	Keep up the good work Loving the morning show
Gamer McGameface	Commercials for drug exactly like this are also on Canadian airwave
Ken Baik	They need to do this with hospital cost for operation Not everyone work for a big company or government There are still people who pay for private insurance and have to pay almost everything out of pocket
Someone	coma low blood pressure death and ligma
Melo	This seems like a step in the right direction but to be honest I don t think it doe all that much What would really make a difference is price comparing or seeing the cost of different drug If I see an ad for a drug and think maybe I should take that and then see it s expensive I m just going to change my mind and probably wont even consider that there are generic option Also if they are so worried about the fact that the price varies by insurance then the ad can just say that Next to the price it can say something like This price may change based on your insurance See our website for further detail They can direct to a website and still list the price
Dana Vixen	Why disclose this stuff on only TV ad The rate of people watching TV are on the decline to be more in favor of online entertainment outlet and they appear to be left out according to this video
JussmiiofW.B.	Canada also ha those ad
Jessica V	I feel this need to be extended to medical facility too I think they should have a menu telling patient how much thing are going to cost them not just do thing and surprise them on the bill later
micah feldman	There is so much i hate about the trump administration mainly about him but if this lead to price decrease in med it would drastically change my opinion especially if it help lower the price of drug people need to live especially insulin a it is basically held hostage at exorbadent price which cause the death of massive number of type 1 and type 2 diabetic and i seriously hope this help change this for my sister type 1 and all of the others who deal with insane price hike by pharmaceutical company
Geoff Roach	If this happens then great something Trump did that wa right for once and if it becomes an actual policy then great I ll give credit to Trump
ziah Reid	This is all about trying to make the republican party look good for the midterm election I doubt trump and his crony are going to follow through with much of what they are proposing Hillary wouldn t have either The pharmaceutical industry is so wealthy and powerful they re stuffing money in the pocket of every major politician out there If they actually succeed in substantially lowering the cost of medication and making prescription drug price more transparent then I ll buy a maga hat
Gardner De Aguiar	To equate purchasing prescription drug to that of buying a car is comparing apple to orange As well this move simply is not enough I d say it s merely tossing a bone at the problem This is a healthcare issue something Trump intentionally ignores
mrvvinston	imo private business have absolutely zero room to be in the pharmaceutical industry it truly is immoral and unethical to charge people money for life saving medication the healthcare system in the u is disgusting and need to be changed asap
Viatemar	Let s be real here They re already in on it lobby folk and trump the only one s who dont know whack are the citizen or people who re not in on it They just care bout money and with time changing and the interwebz becoming more popular it s just a move from the pharmacy to get from television into the internet so they still don t have to tell how much their drug cost while they still reach enough people to benefit from also more space in television for the company to display other stuff for those of em who still care about tv they just raised their voice cause you expect them to say at least something about it a if they really give a damn
1caboose1	I think if tobacco company can t advertise to naive child than farma company can t advertise to naive adult
Carrie W	Do this more
Lord Leto	Death might be permanent Since when
Jose Landa	Awww 👎 such a let down to start with out bein called a beautiful bastard lol where will i get my daily boost in self esteem
kpowers74	TV ad Who the fuk watch TV Lose
mypastlife	Because we allow drug company to act a a for profit business it is much more likely that they will just increase the cost of lower priced medication and tout the idea that all drug cost high price and issuance is the reason you pay lower so to just normalize high pricing This will just lead to a closer relationship with drug company and issuance company to price hike everything so both can suddenly find them self in record breaking number You want to lower price you call it what it is a public health concern and the same with health cost and health insurance and cap what they can charge Or you outright just put them in government control where the US say the health and safety of our citizen come first If you pay tax you are covered
Anipix	buy prescription drug lol what
rayuu	i see a lot of people discussing how drug shouldnt be advertised on tv but i wan na be honest even if youre not directly interested in that drug i think it s a good thing that they show these symptom of issue to people nation wide and truly open people eye to an issue they might have and can get professional help for i wouldve never known the reason why my boyfriend wa always so tired despite a good night rest and everything else he had wa due to sleep apnea if i hadn t heard about it in my psychology class and brought it up to him when we hear about these thing sometimes it just truly cause that click in your mind and motivates you to fix that issue also on the topic of this act i think it s really good a long a it stay transparent and isnt abused or ha area open to misleading but pharmacuetical company probably will try and find a way and likely succeed in making the price tempting even if in the end theyre wasting more than expected
Dallas Cowboys Highlights	Americans are highly medicated Very scary
Shay's Flying	Yes I am very surprised
Elizabeth McCracken	Yes Take 👏🏼 down 👏🏼 big 👏🏼 Parma 👏🏼
ImpostorZim	I love the morning show You need to get that ad revenue Phil I don t think anyone here mind
German Turtle Productions	Where ’ s “ Sup you beautiful bastard ” I ’ m never accepting “ Hello hello ” Come on
anthony harvey	most regulation is stupid this is smart legislation big win for trump requiring infomation to be presented in an add is a great way for competition to say we are cheeper
Deven McKee	I think at the very least this could go a long way to highlight the ridiculous collusion between insurance and pharmaceutical company If this go through we ll begin to see all of their price magically fall while out of pocket expense for patient remain the same Insurance company dont pay ticket price for these medication The ticket price is often an inflated nonsense number that s designed to make the insurance company feel like they are getting a discount I imagine that pharmaceutical company will simply start listing something closer to the actual price that they charge to insurance company but consumer will end up footing the same old bill The upside is that consumer without insurance or with really terrible coverage will probably pay a bit le
Wulframm Rolf	i never knew death could be so permanent lol
Rubicon	That moment when you are going online thinking about the future show Defranco will post on this great day and BOOM there is already a new show that wa posted while you were sleeping This day can t begin any better
itchy robot	Philly Are you just a full blown Trump loving Republican at this point 🤮 I don t think you could be a bigger Trump cheerleader lately Shame on you
Reginald Quinlan	I want to like because hopefully you ll do these more often But I disliked for the American bias
Quintonimo	Okay this is EPIC
Lauren Mancuso	the first thing out of my mouth wa oh no i need my medication to literally function i would be in a downward spiral without it and a i watch this video i m relieved this is a good move in my opinion
Sunshine Able	The drug price in the USA are messed up It ’ s got to the point my family ha to buy from Canadian pharmacy and have them shipped saving thousand of dollar
Mr. Baileys	It s almost like we could all have free medical but it make more money to treat than cure A revolution need to happen
Knapweed	Death may become permanent Useful information from Big Pharma 1 07
eze creative	The guy across the street from me spends around 1 5k a month for his medicine I still can t belive it it s insane
The Scouting Mama	The mar mg st ha changed so much this year This make it so much harder to just get the med my husband need for his pain He ha 5 bulging disc and he is working then last month he fell down the stair at work and broke 2 rib All of the change over the last year have made Dr s even pain management Dr s afraid to help people with pain At the beginning of the year the pain Dr had to drop everyone s pain med down a level and keep it there weather the med are working or not Maybe you should talk about that type of change
