Philip DeFranco	Hi Its 4am Im too tired to think of a good top comment so ummm if you didn t see the Monday PDS be sure to catch up after watching your bonus morning video ok love you bye http www youtube com watch v n wW1pH3 ZY
Reanne Strauss	As a state certified pharmacy technician who deal with uninsured patient day in and day out it would be amazing for them to know the cost of a medicine before they come up to my counter 90 of the time if the drug cost more than 50 for a 30 day supply patient will go without the drug that could improve their life If they know upfront what the cost is they can have better and more educated talk with their doctor about therapeutic alternative that cost le What seems to happen very commonly is that they go to the doctor get the prescription come to the pharmacy and then leave without their expensive medication and never follow up with the doctor after It ’ s crazy how this system work to make more and more money for big pharma than actually get a living breathing human being what they need to live a healthy life But that ’ s just my opinion a someone who deal with issue like this every single day 🤷🏼‍♀️
ExaltedDuck	Pharmaceutical advertising I m sure the swelling cost ha a lot more to do with the inclusion of prescription coverage in medical insurance Much like how college would cost much le if not for federally backed student loan which are immune from bankruptcy discharge
Braverocker	Welcome to 1920 America greatings from EU
Dominique Noel	Feels like the discussion they should be having is why are people so much medicated nowadays We are consuming an unhealthy level of medicine But of course the industry isn ’ t about to tell u that cause they make so much money out of it
Cody Whalen	Im anti trump but I do respect the move a lot of problem surrounding drug are because of lack of transparency that s why some people demonize something like cannabis but take Oxy that they think they need but not surprise the trump administration is taking a stab at big pharma since they traditionally support the left more hurt them hurt their backer
LET'S TALK	Advertising prescription medication to the public should be illegal And it should be mandatory for medical professional to advise alternative companion treatment method in the case of condition that are self inflicted reversible For instance a healthier lifestyle
Mollecules75	Lets just see where this take u It s a good move however I m not sure it will do what we think it will do hoping in Colorado
Luisa Guzmán	I don t think this would work but if it doe it won t have a major effect on the price You know what would Prohibiting advertisement of drug That take up a whole lot of the company s expense and make them put a higher price on their product Especially the fact that they spend a whole lot of money persuading doctor and giving them free trip and thing for them to recommend and prescribe the drug to the patient Who end up paying for that The consumer who pay higher price It s also clearly not ethical or fair doctor shouldn t accept it but there are always some who will
Khazar Hayat	I guess I ll just die than
Chava Yang	Yay Morning show
JTR	I am not a big fan of the Trump administration but this is a step in the right direction I would go further than this such a establishing a price ceiling but I will give them credit for this if it go through
Jackluck2	Good on the Trump admin for the right step forward
mrs. whales	It would be weird to hear or see price in commercial a you never see price anywhere else
Naeem Ahmad	new intro
Xicor Warface	I see you there with that improved editing style quality 😏👌
glampizational	The comment about how showing drug price on commercial would decrease the likelihood of the patient seeking out a medication that they need is just not reasonable Patients receive expensive medication all the time without seeing an ad for the product For some the patented brand only product are genuinely being the best option for them and for others drug company are legally allowed to incentivize provider to prescribe their product The best way to ensure that a patient won ’ t get something that they need is to prescribe something that they can ’ t afford
Charles Badger	Personally this is a good step do I like that the government is not necessarily I think in the free market the government should set guideline or requirement to help the free market and nothing more This seems like a good step in that direction I think that posting a pharmacy price of a drug before purchase is a positive for the consumer and will drive cost down However I think this should also be done for hospital and doctor Prices of their service and such should be posted in such a way that the consumer can shop between hospital and doctor This will also drive down cost with hospital and doctor I get that health insurance company have deal and such with drug company hospital and doctor And those price should be shown per health insurance agency if they are different from regular expected price so that the price difference can be seen Ideally then this could or would help those already having deal with insurance company or help those who provide just a good a service a anyone else for a cheaper price
Cody Choules	Well nice job if this go through This is a big win for this administration
Amarat	Why am I watching this I ’ m not even American
Rina Thomson	Phil this is so crazy creepy My family wa literally talking about Pharmaceutical company and there advertising last night how scandalous it is We werent talking about the price thing didnt even know about that but it crazy thats what your morning show is about But i compleatly agree that the price should be listed and i think it should be listed on all add not just T V add
Sarah Ro	It ’ s so weird to me that they can advertise prescription drug like shouldn ’ t the doctor be the one suggesting medication not the patient 🤔
Wonko42	I m torn on this I think transparency is great but pharma doe have a point about the confusion Health insurance is confusing especially for the uninitiated or the elderly but I am also not fan of drug company I ve seen how they jack up price on life saving med before their patent run out I also worked in a doctor s office and have seen how they incentivize doctor to prescribe drug It feel so dirty to me I don t know what the answer is but all of this just seemd to be symptom of the underlying issue Our healthcare system is broken I find it frustrating and infuriating
Abraham Castillo	I like these short single video it like taking a small bite out of a cake easy to digest Instead of trying to eat the whole thing
Butters Scotch	Title make it sound like rx patient are gon na get screwed so they scramble to watch PDS Sucks especially the thumbnail
LoyalMatter	I actually agree with the current administration Wait what It would interesting to see if this streamlines cost for expensive prescription drug but it maybe the fast spoken fine print portion of an ad I can see all the pharmaceutical company lobbyist coming together to try to stop this from coming about They ve got a good thing going but it is why insurance is so darn confusing
Gemnox MC	If you re not lying about your product then you re not committing fraud It isn t a violation of the consumer s right
Gerry Straatsma	Wow I actually agree with the trump admin on this one never thought i would say that
KuzKiller887	Next force bar and restaurant to disclose the price of alcoholic beverage I ’ m sick of going to the bar ordering two beer and getting a bill for 23 It ’ s a blatant way to rip you off If i knew the price ahead of time i would order something else
Brandon Lee Sanders	I come to realize Trump is not the evil person the medium say he is Its policy like this that is proving it As crazy a it sound I might actually vote for him in 2020 If you attack me for my personal opinion you re only pushing me further away from liberalism For the first time I m open minded and willing to listen to people with differing opinion than my own
justinfs	I can see the intent here of the addition of price In a text format however I feel like it will be more fine print which is already in these ad people don t read This need to be said allowed in the add in my point of view
MRICECOLDCOLE	We have these ad in canada
Hailey	When I first heard the 70 of the population having prescription I wa like no way then I realized I do take prescription birthcontrol my best friend ha a prescription for migraine etc Yikes
Danni Is Tired	Im worried that if they lower their price they ll use le effective ingredient chemical medication
FellNerd	The medical industry would become affordable if company had to list price
MalefaxTheBlack	As someone who s on several prescription including one that s keeping me alive I can approve of this news Especially a my prescription keep being changed Maybe this will help me avoid a nasty surprise to my wallet in the future a ha happened in the past
Cass Thompson	Drugs capital D Drugs up until 2 year ago i would take Tylenol pm maybe 2 time a year I wa then diagnosed with a rare disease and take 6 different drug every day now With insurance it a manageable 200ish dollar a month However one wa not covered by my insurance and the doctor worked very hard to find a program solution to get me it after month of not being able to get it I told my DR if I need it that badly ill just pay for it out of pocket he laughed sadly and said no no I would not pay for it out of pocket ever long story short he told my it cost 40 000 dollar for 1 ml injection I need 1 ml injection every 3 day turn out the only way to get it is through the manufacture program were they will give it to you free and use it a a loss come tax season and basically remove million of dollar from there tax what a scam
Jason DeLong	Death may become permanent 😂
Joseph Castillo	Whoa whoa WHOA Death can be permanent
Cristiane Williams	The only way to get drug company to lower price is to effect their bottom line The EU ha effectively dissuaded company from breaking there term by charging them large fine per day I personally think direct to consumer ad when it come to American drug company is ridiculously evil
BandidoTheVillain	I haven t watched this video yet but I can already tell this will piss me off
Prady	This is a great move Regardless of whether it actually lower price or not at least the consumer is AWARE of what the price is Transparency is usually a good thing It also wouldn t stop the doctor from actually prescribing a medication that a patient NEEDS This seems like a positive in all front for the customer
Connor Anderson	Trump is the smartest man I ve ever seen so I m sure it will reduce price
Ryan Chatta-G	Loving the morning show
Stephanie Walczak	TV I don t even know how to find a way to watch a TV anymore 😆
lovecraft5878	If the drug company don t like it they don t need to advertise on TV
Der Giggler	I like this format
Grigori Echegaray	I am excited for the morning show but I m also shocked the pharmaceutical company are getting hit this hard to put it frankly Since I wa a child who had a doctor who worked with the company to directly get paid for every person on the medication I never paid a dime because of the service my family wa involved with but then how much of the money they got from those service were not necessary I ended up more damaged from the dependency on those medication then I am suffering not having them in my life anymore
n0nTox!c	Yeah I get prescribed drug no matter the price I quit some anti depressant once because I noticed they cost over a 1000 dollar a bottle and that s 5 time more than my monthly income If my insurance got killed I d be screwed Not to mention it wa one of those that are very dangerous to just quit So I quit before it became very dangerous and requested something more affordable if the sh t hit the fan But all the anti depressant I ve been on seem to make the depression worse to the point of becoming suicidal so I wish they would just legalize weed already Helps instantly and doesn t lead to suicidal thought Sure it can lead to guilty thought about stuff I ve done wrong But I think that s good I don t always see that I ve been an as at time Weed allows me the clarity to realize when I m being stupid Anti depressant seem to veil my stupidity from me and encourages it to run rampant Causing all sort of mayhem and worst of all Mayhem I don t remember
Nipuna55	Pharmaceutical company have a lot of power over politician so well see what happens
Duckman1616	I m extremely surprised this is coming out of the Trump administration but I think it s a great idea nonetheless Giving consumer more information about a product should never be seen a a bad thing
Inflexi	I think they should have to post the price part of the reason healthcare in this country is so expensive is because it all done behind closed door with price you ll never see No competition Force them to say how much it cost
Thomas the chancey	Never took any prescription drug
Mephistophelolz	Not just the US and New Zealand we get these type of drug advert in Canada too
Juan Cruz	Good Morning Phil nice to see you 😁
will collier	Wouldn ’ t it be better to outlaw drug ad all together If there ’ s something wrong with you I think your doctor would know what ’ s best not some wholesome tv ad
zilean timeciper	Hi Philip youtube broke again on mobile phone the app won t play video it just play the audio with a black screen have you seen this or is anyone else having this problem
SangoProductions213	Probably not a good a just removing drug ad period but I definitely think this is a step in the right direction
Andrew Cleary	Coma or death a these may become permanent
94JAVS	Dude of course we love having this morning extra video Keep it up
Akusushi	I love these morning short but sweet vids
Matthew	Woah this could be a game changer and I m someone who normally hate regulation This is something that wouldn t hurt drug company or consumer like banning them from advertising completely would It would definitely lower price due to competition Also their excuse is pretty lame because the average consumer is smart enough to know it will probably be cheaper for them if they have insurance
cZair Kolmoslink	I think it be good
Stephen Albright	This is MAGA
Yasha TDP	oh finally trump ’ s presidency may be doing something right
Mark Cameron	Goddamn I love being Canadian
James B	Just another encroachment on the right of corporation and individual America is on a slippery slope to socialized medicine a enjoyed in bankrupt third world nation of Western Europe Taiwan and Canada to name a few Socialism doesn ’ t work Venezuela is a prime example Only absolute free market capitalism work a seen in Somalia
Kevin Herbert	Loved having an extra video
30Chompi	Judging from past practice I d say this is not going to happen the way it is being talked about currently Either some washed up version of it will happen or not at all Don t get too excited about promise happening before mid term election and remember Trump change his mind a lot
Gooniegoogle	Wow Trumps doing something amazing
Just another ghost	Coma or death a these may become permanent yea no shit
Josh Fritz	This seems like a good idea to put pricing in the commercial It help people window shop for the pharmaceutical they want at the price they can afford If they ’ re only referred to one drug without being told the price of prescription they might not know if there are other option that could be cheaper Personally I would want to be able to see the price so I can at least weigh my option a little bit before making a final decision Also making company put price in commercial isn ’ t freedom of speech infringement All it ’ s doing is making it more convenient for the consumer to make a better decision about which drug they want
Erik C 'Piano Man'	Trump doe a lot of thing wrong but promoting more transparency with big pharma isn ’ t one of them I don ’ t get to say this often but “ Go Trump ”
rageface studios	1 07 death can become permanent I never knew that
Giovanna Greeff	I m happy about this but it feel like perfect timing to try and win in the midterm It s a proposal right now and I can totally dee them dropping it after November 6th
yolodolo	better help scammer
bjarked47	Side effect death may become permanent you what mate
Orgspasm	BASED TRUMP continues to serve the WORKING CLASS
GloriousMane	The thing is if this go through with repubs in charge we have to be incredibly careful of this It sound good but who can possibly trust traitor at this point Notice how they say negotiate price not lower price with repubs in charge they d probably make the drug cost more because that way they can hurt people more effectively These are the same people who try to take away your insurance entirely don t trust them for a second
Abbreviated Reviews	1 08 Permanent death is the worst
thescrybe	Please contact your doctor if you experience any of these side effect dizziness coma or Death As these may become permanent Don t get no more permanent than death SMH
snika123	i dont even live in america but it nice to see a government actually helping the people not company for a change the australian government just seem to be chasing money from big company
eljoel89	Wouldn t it be nice if we had Medicare for All That way everyone pay the same negotiated price and pharmaceutical company can advertise an accurate price for consumer Or we could just do what every other damn country in the world doe and ban them from advertising directly
Invernessmagic	Y all Americans and cray NHS4LIFE
Cajun Kev	I know this first hand I have a severe back injury which I take pain med for but also had to start taking medicine for anxiety because I wa having trouble sleeping Doctor wrote me a prescription for my anxiety and found out at the pharmacy it wa over 500 for 30 pill Thank God they called my doctor and he wrote me a prescription again but this time there wa a generic which only cost me four buck a month My Doctor ha told me in the past that he wa even disgusted by the high price of prescription drug and the trick the pharmaceutical use the keep generic out of market
Bishop M	I just noticed there s a lot more editing than normal unless I m missing something I like it
William Mild	You said that the administration is seeking comment for the next 60 day Where can we go to comment on this
George Vieira	This seems more like a White House PR stunt than actually implementing something that would help people with the rising cost of prescription
Ice Uchiha	I am usually opposed to trump but this go to show that nothing is black or white I agree with the movement wholeheartedly
kyuven	This is an interesting one On the one hand it s something It s something with at least a modicum of good intention behind it Any kind of something that move u forward is a good thing But it seems like not even a bandaid It s like a tissue or shirt on the wound until you get a bandaid Moreover it s treating a wound we only have because of stupidity
Lover of the Knowins	Only reason all these drug are needed because there are no regulation on childbirth Retards breed pill are needed 70 on drug 70 should not breed Problem solved
Emster234	I m not surprised Trump said he wa gon na make health care actually affordable Bam
RE RE	I like the am snippet You should make a news app people Can download for free on their phone and post news alert and update along with video I would heavily be into that
TheMusicmaxxx	Im so surprised that theyre doing this I thought this administration would listen to lobbyist
Mr. Mr.	when you literally just found out your insurance benefit after paying for them for three year with no intention of actually going to the doctor or therapist but you ’ ve had suicidal thought and the complete inability to do anything productive for the past three month And you ’ ve been working out meditating and eating healthier and you kind of don ’ t know what to do because your brain is a cesspool of constant horrific defeating negativity 18 7 despite taking all those measure
John Vest	Wooooooooo more Philly D
Sheldon Barfield	In general transparency is good for keeping market honest and competitive Going through insurance company obscures the true cost price of what you re getting making it harder to compare and shop around for a better deal
Clarissa Gafoor	What an excellent idea
Jahanzeb Khalid	Loved the editing style and new graphic Would love to see more like this
horrorkesh	I would think it would easier and cheaper just to change price on a website then redo a TV ad if something change
Mikael Bergström	Living in Sweden this whole commercial for pharmaceutical aimed at consumer thing just baffle me Just seems like a big public health risk a people are generally medically ignorant and are likely to put pressure on their doctor and end up taking more medication and more expensive medication than they actually need The decision of what medication should be given to a patient should be the made by a medical professional
Mike DePung	This issue highlight the general plight of healthcare in the US When all is privatized the primary driving consideration is never the welfare of human being It s always the bottom line no matter how noble insurance company or pharmaceutical company try to make their ad and info sound We need a single payer system which is not making u a socialistic society It s making u a balanced freer society because healthcare cost enslave most of u Unless you are one of the wealthy elite you are one major illness away from bankruptcy and healthcare cost are the leading cause of bankruptcy in the US Okay thanks Phil and team for continuing excellent analytical work
Mainfold	Damn if that pharma change pass is massive and so pro consumer it s amazing
Crash Zone	This should be supported by Democrats but I bet you anything they wont
Nannette Oswalt	Remove ability to advertise No problem with the question of price Price of drug go down with significantly lower advertising budget Win win
amillerinADKs	I would be very interested to see how the ad buy in different medium stack up What I see happening is those company simply buying more print and online ad and advertising on TV at off hour We wouldn t need this sort of half measure transparency if there wa a public health insurance option for ALL citizen because the consumer pool would be so large they could easily negotiate for far lower price a they do in every other developed nation
Andrea B	This is a fabulous idea whether or not it lead to lower price They should expand this rule to ALL drug advertising
ChrisssEZ	This is a perfect and informative 5 min video I like stuff like this
magnvss	In other word and just to be clear a this is not yet set nothing or very little just to save face will change and this is merely a move to extort under the table money from the big farmaceutical company under the guise of consumer benefit Older than the politics
Eddgarur	But but but orange man bad REEEEEEEEEEEE
Losha's Channel	Call your doctor if you experience death a this may become permanent Well they aren t lying
Tyler Harris	Good Screw drug company they ve been overcharging people for decade and getting away with it I hope they re backed into a corner and end up lowering price
irvinx1986	Why wa this video monetized
Zhanger37	Trump is actually doing something positive Oh wait he s old and ha ton of prescription that explains it
Maverick5588	Phil please please do a piece on massive insulin price causing diabetic people to die because they can not afford the drug Charles Best and Banting created the drug with the intention of it being free It is not free and after all these year people are dying from it
Vanessa Vasquez	Honestly these company claiming that this will violate their freedom of speech is untrue The free speech clause provides different level of protection depending on the type of speech If the speech is non commercial I e me giving my opinion then it receives full protection If the speech is commercial BUT it is both lawful and non misleading then it receives an intermediate level of protect If it is a commercial speech that is both or either unlawful and misleading then there is little to no protection These advertisement would automatically fall into commercial misleading speech If these company ever tried to bring this argument to court they would probably lose just saying
Tim Wilsin	Love the morning show They should have to list the price it common practice
Soli2de	Ok here s what i think might happen Given that the price disclosure seems to ONLY be for TV advertising i think it will just change drug manufacturer marketing dept n instead of seeing those ad so prevalent on TV we ll most likely see them more in the market like social medium online n what not where they DONT have to disclose those detail Because let s be honest they dont want to drop drug price it s all about exploiting those loophole they purposely leave in there to maximize profit Because let s be honest here the old TV market is slowly losing it s audience since most are shifting towards streaming and just the internet in general Soon individual youtubers will be sponsored by certain drug I mean we already have hims com marketing to youtubers it s only a matter of time
moose8710	I think I heard someone on Joe Rogan s show mention how unusual it is that we get prescription drug advert Glad this administration is doing something about it Really surprised too
Robbie Cale	No prescription fee for me
McHaven07	Doubt it will ever happen but I ll be pleasantly surprised if it doe
Jim Fortune	1 08 Death MAY become permanent
