Philip DeFranco	Hi Its 4am Im too tired to think of a good top comment so ummm if you didn t see the Monday PDS be sure to catch up after watching your bonus morning video ok love you bye http www youtube com watch v n wW1pH3 ZY
Aleth86	Reminds me of how Canada got higher drug price through Nafta but hey know how much insurance price it at
lefthandcigg 425	“ Call your dr if you experience death or coma because these are permanent ”
Xenithil	LOL it s a first amendment right violation Just like how food processor s first amendment right s are being violated when they have to soullessly put the content of the food on the label Give me a break
_Told_by_Ginger _	I wonder if this will apply to veterinarian price a well I had to pay an insane amount for my pet medicine
D Mal	If the drug company is worried that it may confuse people then just say your individual cost may vary according to your insurance policy Problem solved
Tenacious Z	Every doctor my family ha gone to the last five year push a prescription for every little thing We have to screen these and say yes to only what we know we really need At my last physical for example I had unconsciously blushed at some point during the woman part and she suddenly tell me I have rosacea and she ha a prescription to help me with that Geez
Alpha 150	Why can t the drug company just say drug A may cost around 300 for an average month of treatment but price may be reduced with insurance
Katie Little	Call your doctor if you experience death Lol
missaldavisvlogs	After living outside of the U S and then coming back I wa hyper aware of the commercial and am really bothered by them I would prefer that we didn t have ANY commercial so that doctor are provided u with an RX based on the medical need and not a medical want Example I should go to the doctor because I have a medical need such a a skin disorder that I want to care for and the doctor prescribe something to me and we can have a conversation on whether or not I can afford it RATHER THAN I saw a drug commercial that said it could help my skin and I should go to the doctor to discus the drug
Meghan Travers	So I don t need worry since I m a Canadian
IMKevin117 - Animations/Gameplays	If we show our price people might not buy it well no shit Sherlock At least if we see the price we have a good idea how much it ll cost WITHOUT our insurance Obviously everyone who go to the doctor always asks doe my insurance cover any of this so how the fuck wa that a good excuse It just seems like the pharmaceutical want to hide their price to milk everyone out of their money
Megamoon Polk	Weather it help lower the price or not it will for sure make it easier for people to know how much it cost and be able to ask better questiond when going to the doctor or pharmasist about pricing
Josh Willard	20 pill of Ambian in europe is €2 50
Grinnar	I wa misdiagnosed and it s messed me up in so many way even 14 year later where I m not on any of those medication
Michael Dillenbeck	Interesting thought This could just be an attack on television and medium The rule only hurt them Ads can still run a is on social medium internet May not have anything to do with pharmacy How many million are spent on cnn msnbc from drug manufacturer that may now spend the money elsewhere
Victerran	I am surprised that people buy medicine or spend any money in healthcare in the USA Ads have turned your brain into mush
teresa vance	Looks like a bait a and nothing Only one more thing where he claim to be sticking it to Pharma but really just a sticker He ll move on without ever having actually pulled off legislation
blaziken 1213	As someone who ha relied on the help of daily medication to survive my daily live for year I say that this move is a good first step for the government I think the pharmaceutical industry is ridiculous when it come to name brand when the off brand is cheaper for the exact same medicine I don t want to have to pay 20 30 more just because the drug ha a easier to say name than the rival company that keep the actual chemical compound name Of course they might have other factor that I am unaware about that make the brand Bane required but the basic form of the medicine is the same That being said I don t think this will pas in it s current form but at least to open the door for further discussion and alteration to the subject Thank you for reading my little soap box rant Have a great day
Joseph Armstrong	Why ha this video got half the normal view of philly D show Which often get 1 1M thi is s the average of the last 20 Answer big pharma
stringX90	I think this move while well intended will not lower drug price overall
Doctor What	I HIGHLY doubt this will change price Less profit put le money into R D and le research on new drug in the pipeline and that could save life because of different disease
Alphawolfy	Thank christ I live in the UK I would be a dead man without my medication the US healthcare system is a terrifying thing Advertising to the citizen In a proper system the doctor should be the only one offering up treatment option based on their professional judgement And the ungodly amount of money they charge for life saving medicine A healthcare system should be based on health not profit
P4L4D1N	every time the drug company fight back increase the range of restriction on drug
Mr. Grey	Meh they ll either stop TV ad or find a loophole
MMEnder	What doesn ’ t Canada have the whole ad for pharmaceutical thing too
TiagoTiago	04 55 Wait her name is Rachell Sexalot
Dalaci	I don ’ t like all the editing
OoWeE Comics	And people say capitalism doesn t work
theycallmemrshaggs	This is pretty amazing a far a it go We need to stop making healthcare a for profit industry
Careless' VOD Reviews	Coma or death a these may become permanent Oh okay the death side effect of my prescription is temporary
nat lider	really enjoying the extra video thank you great to see big important news story getting coverage that I don t see many other outlet doing
Eric Nolen	Rock ON
Malcolm DuBose	“ Please see a doctor if you die ”
Anne Hijme	I agree in medical industry which includes pharmaceutical there is a problem The problem is getting upfront price for any good or service Try asking cost for any surgery from multiple place Almost all of them will avoid giving you a cost and just ask what insurance you have and that they do or do not accept that insurance If you have insurance they often try to tell you not to worry about the insurance will cover it even if it won t cover all of it I personally think advert are not the problem nor do I think it should be required to place price in advert To me the solution is insurance to go back to what it used to be in case of emergency and not for every day care That every day care should be a different sort of payment whether you want to pay every time you visit or get a deal like around here I see dentist advertise something like this and a FastMed or membership that give you free visit and discount for extra visit you may need for a set fee Now I know many of you think this is crazy but all insurance doe is hide the price and give doctor office and other medical group an excuse not to give you price upfront which make it impossible to shop around I work with an elderly man a my bos who get all sort of medical bill MONTHS after whatever he went in for The bill seldom ha a clear reference of what it is for or even when the event took place so he is always unsure whether it s been paid for already or if he should question it The total are always large with another large number for insurance then finally what the remainder is He also end up getting refund check sent to him for small amount since billing is such a mess that often time they sent the same bill twice so he paid twice Really medical need to be like other form of business get price upfront or clear estimate of what to expect aka range based on possible complication or need Another thing not uncommon in America is two get multiple bill for the same visit because one part usually the anesthetist is billed separately adding more confusion Final note Many doctor get affliation with drug company for deal that make the doctor encourage the use of that drug for benefit Also people in American culture prefer to pop a pill to solve a problem because it is easy and get to be not there problem I think if most pill were sugar pill we still have most people feeling better because they just felt the need for something outside to fix their life
idontcareuknow	I don t think it will do much It s a step in the correct direction but a stated in video list price isn t customer price The problem that really need addressed with healthcare is that insurance company hide the actual price No insurance company pay the list price for a procedure med they pay a totally different price which they agreed on during negotiation Basically insurance company are rich in large part because we don t know the market value of anything If you apply business law to healthcare it s actually totally illegal the standard payment industry compliance training about rubber duck or metal widget Really not sure how it got this way
Neil is Alive	If you experience Death for more than 8 hour please contact your doctor immediately
Maccabee Luke 22:36	This drug ha a 50 fatality rate but you should take it so that way you won t die
Cthulhe	I think being booted from a job for speaking your mind ha come too far Offense is taken not given and I think she honestly thought it wa ok Should I be offended at Halloween when people dress up a goth even though real life goth are still beaten to death to this day for being thus I wa raised and have always lived with goth culture my entire life so why should it be okay for people to dress up like u and mock about our culture whilst no one here probably even know who Sophie Lancaster wa
isolestie	I work in pharmacy and I don t know how effective this is gon na be Somebody s gon na be eating the cost if the company do lower drug price and it s most likely gon na be pharmacy This would lead to more cut on pharmacy personnel resulting in longer wait time and lower quality of service Most people are covered by the insurance so they won t see that much of a change anyway and biggest factor in high price for drug are monopoly so I don t know if people who get the medicine for life threatening condition will be able to afford it regardless We need an overhaul of how big pharma operates a well a the insurance company
Petra_Kalbrain	Easy solution Require listing the full price of the drug and adding “ Cost per individual will vary depending on insurance coverage ” I love this idea Big pharma is already beyond ridiculously shady in almost every aspect of their very existence and practice let alone their secretive pricing tactic Without a listed price before hand they can effectively manipulate the cost based on insurance coverage Someone who ha 50 coverage might be charged 400 and someone with 90 coverage could be charged 2 000 for the same medication Each customer is paying 200 out of pocket but big pharma isn ’ t treating them equally They can do this because nobody ever actually look at their receipt AND nobody ever really compare pricing with each other for this stuff
Mike___B	Great production guy I m not sure yet if I prefer it to the PDS style with the picture in picture approach of the usual show but the execution of what you were going for on this video wa stellar Also great topic to shed a light on Pharma is too huge to not be discussed regularly in all news forum So thanks a always
LezLamb	Am i the only one who noticed the new editing style in this video
jobriq5	coma or death a these may become permanent yeah death is pretty permanent
ChaosFigure	I ’ m from New Zealand and those ad are so few and far between
April P	If there is no financial accountability or penalty the drug company will do nothing Blowing smoke up their as wont work however a fire will move them As we are now our society run on money and feeling will not change it
Youtube Commenter	Real drug can not be advertised on TV Those are called accelerants
pythia delphi	This law would actually benefit insurance company more than consumer It would cause consumer to go for cheaper drug even if insurance might have covered the more expensive one
Tomi Soetan	“ Call your doctor of you experience any side effect such a death ” Might be a bit tricky to do that 😂
Lily	I moved from Canada to the States for work and had paid 20 mo for my prescription in Canada brand name without insurance ie cost price For the exact same medication and brand the cost price of my prescription in the state is 130 The difference is that the pill come in a suede packet instead of a paper packet Why is there such a difference in cost price between two neighbouring country
Caige Fuentes	I feel like this is a good move on the governor side but im worried thay cheaper price may lead to am increase in the already drastic misuse and abuse of pharmasutical drug
MrMorrigan	Americans pay more for insurance and legal drug than any other developed nation the profit margin is huge in the US So good thing someone think about the people for once and not the corporation
Victor Morales	Death is permanent Whaaaaa
Chuck Hartholz	I think the biggest mistake we can make is to allow Big Pharma to advertise directly to consumer Over the counter drug are one thing there is a certain presumption of safety and efficacy when taken a directed To watch these ad for prescription med is creepy scary and inappropriate “ Some side effect include depression or suicidal tendency If this happens stop taking this medicine immediately ” Totally fucked Bigger problem is how much money is being spent on these commercial encouraging the hypochondriac of our nation to boost sale preying on their desperation for that Magic pill Advertising price will encourage price competition so Trump is trying to enable market force to help bring price down It COULD work but the whole thing is still sickening to me
tjt072	I hate trump but the fact that he is actually trying to do something about this issue is awesome Don t know if it will work but it doesn t hurt to try I take inhaler for asthma and one of them cost me over 200 My insurance doesn t pay for medication There is no le expensive one either We have a discount card for it but it s still over 100 which we could use to eat or pay bill I need the inhaler to breath and these drug company take advantage of people like me who need certain med in order to stay alive Once they make their money back they need to make it le expensive and come up with a generic one
Klepto	I doubt this wa Trump s idea and it seems like a way to get people to forget that it wa his idea to gouge the health program Look it s not my fault you can t get those med it s the greedy company Could this still result in something good for consumer Yes I rather hope it doe a I have to spend 100 on med every month and a friend spends close to 400 I m still going to question the intent after everything they ve done
Jessy C	No I don t think so I think it ll cause a lot more bitching and moaning more awareness but at the end of the day people need their drug And Pharma know that
Sigusen	Please notify your doctor if you have any of the following symptom drowsiness irritability coma or death a these may become permanent Death MAY be a permanent side effect
Jennifer Cisneros	I take iron 3 time a day birth control for fibroid and too control my period that last 3 week I also take a migraine prevention medicine a I get them about 5 time a week now only 1 or 2 and I m currently covered by Medicare but in a year in wont be covered and I won t be able afford my medicine so idk what I m going to do
Thomas Clapp	Coma or death a these may become permanent
William Hale	It s not shaming the company that will lower the price They aren t child you aren t going to shame them you put their price out there so everyone know them then company that make drug for the same use are able to say hey our drug do the same but for 5 le then another company could come along and do the same to them
EverydaySkeptic	This come down to two thing the cost of the approval process and patent law Most peiple don t want to touch either for safety and productivity despite neither actually being the product of these regime
Jenni K.	Call your doctor if you have Coma or DEATH a it may become permanent but if you call it may just be temporary death
deadly zebra	in my experience whenever government get involved price dont drop
Ephy	I clicked this horrified that my med would get more expensive What a huge relief this wa instead I hope we re able to do this and decrease the cost of drug People are dying because they can t afford their med That s ridiculous P S I enjoyed this video a lot Very well edited Super cool Also I didn t have to see Phil s dumb face a much xp
Barbara Houk	What of a drug price is the FDA ’ s extortion That might make it clear how expensive that agency is
Brian Green	While something certainly need to be done about drug process shouldn t part of the conversation be about over prescribing
Lesley Tate	Death may become permanent America you re drunk go home
creativeusername_x	coma or death a these may become permnent
Cassie Banks	As in everything else Trump doe this just seems like a ploy he s lying about that will fade into nothing when foot hit the pavement Trump belongs to the rich white club of America of which the pharmaceutical industry is a leader Sure he ll make a bunch of noise about it to make his voter base think he s delivering on his promise but once the industry fight back he ll give up on it and blame it on them I predict nothing come of it
Saskia Smith	It s actually insane that the US let prescription drug being advertised on TV Do you realise how insane that is I mean American healthcare is bizarre any way Who ha to PAY for medical care It s crazy
Josh Keating	Or make it illegal to advertise prescription med to the public I can walk up to many place and buy many thing if I have the money all on my own I can not do the with a prescription drug so why the he ll is it advertise to me I get the concept of I then ask my doctor and if the doctor doesn t give me the script I may try a different doctor But if it isn t an item I have the power to purchase on my own it shouldn t be advertised to me
falloncj	This seems like a good way to try improve the system in America Of course you could replicate the approach in the rest of the world where we don t permit advertising of prescription drug Looking from the outside in America s approach to healthcare and blinkered vision to how other first world country don t face the same issue is astonishing
CheshireCat	My family and I always make fun of those advertisement 😂😂
Dino Spumoni	1 08 Death may become permanent You don t say
Irakproductions	How insulting Clearly the pharma company don t think highly of there user that showing the retail price would confuse people If people didn t handle price well and could not make proper decision with such information the economy would not cease because no one would be able to function
LetsTalk About	This may not actually work but I love the approach Someone need to do something about the industry I shouldnt have to work myself to death to be able to afford medication that I need so I don t want to kill myself Whether that s insurance company or pharma themselves something need to be done This spike isn t a mystery We re all just a penny in a billion dollar industry And right now there s people out there pushing expensive pill so they can get rich off our misery
Baleria Medina	I don ’ t know why they wouldn ’ t just not air the commercial if it didn ’ t follow the rule That sound far more effective then being put on a list
blaegme	If it go through then drug company will just join force with insurance company more closely and advertise a This drug normally cost but if you have insert sponsored isurance here then it will only cost for a full treatment And also there will be a larger incentive to reduce the production cost of their drug so a long a they maintain ethical practice then everyone win
Danelle DeRuse	Loving these extra video
Confused Beaver	I like the intro hello hello it s the morning show
WickedRibbon	Thanks for covering this 👍
GameDog	Death is usually permanent
HyDeph 0	legalize weed
Gigaheart	coma or death may become permanent Uh yah
tacklehisa	And people say trump suck
Puggles	Pharma nor your government doe not want you healthy Especially with cancer treatment They would never want you to buy a one time cure for your cancer when they can treat it for the rest of your life and bill you every step of the way They make BILLIONS just with cancer treatment There are medication that are helpful though But mostly they do nothing except treat symptom and end up screwing you up even worse in the long run causing you to get ANOTHER medication to treat that A K A The western pharma cycle The same thing is done for your pet too
dietmtnfuckyou	i ’ m bipolar and i buy medication constantly saying the price on ad would not do anything because everyone pay different price for their drug some people get great mental health coverage but awful coverage on other thing people go without insulin because their insurance doesn ’ t cover it it ’ s a huge problem that is with insurance and big pharma listing price would just cause mass confusion and people going without medication many GOOD doctor will give you coupon sample and referral for different type of coverage but if you ’ re barely getting by or on medicare disability you have to only go for cheap alternative many people don ’ t even have the option of coupon because the price would be too high but people will avoid all treatment if told right away they will have to pay this amount for this medication medication isn ’ t a luxury it is a necessity to say the price is acting like it ’ s a car for sale when it ’ s actually the difference between life and death so i don ’ t think saying the price will do anything it ’ s an entire system that need changed
Alexandra Seppey	Easy solution to the varied cost due to insurance add a fricking disclaimer xxx xx full retail price Actual cost will vary based on your insurance
Avie Dabber	“ coma or death a these might become permanent ” ok but how tf am I supposed to contact my doctor about my possibly permanent death Like No
CocoaGeisha	coma or death a these may become permanent WHAT I bet the woman reading that voice over wa thinking IDGAF a long a I get my check
charlespk2008	i am surprised that he is making any regulation at all but it is clear this is just a fake no real consequence mean nothing will really happen other then Trump being able to say he kept his promise
Ntin	We get these ad in Canada too
Rashid Al-Suwaidi	I don t have no clue whether or not this would affect drug price But I see no reason drug company shouldn t be more transparent with pricing
Rinoa Super-Genius	Big Pharma should have been required to show their price year ago i agree with this
Weewoo	fuck yes i love this so much
Oggie Doggie	it s about time with my insurance there is like a 3 month period i have to pay 50 of my drug cost and i have s single need that i need to live that cost 6000 our of pocket for a 3 month supply there is no way anyone can afford this this is a coverage Gap built in to the medicate prescription plan that i have so i blame big pharma and our gov for this issue
BillyC500	Was VERY surprised that something like this happened is starting with this administration I do believe price will come down but I doubt in any largely meaningful way at least not across the board or even close to it But I do see it being impactful in specific case Even if this had no effect on price I think this is a HUGE step in the correct direction Medical expense and service are about the only thing an American citizen buy while being clueless to the cost To the misleading claim about not being an accurate depiction of what the end customer pay well I positive they have market research that ha fairly accurate idea of the end cost to consumer narrowed via many factor including coverage level
GAMINEX	Is this video sped up in the beginning
nab 6215	You didn t go nearly far enough Check out organ rejection drug They got a boost a well What are these folk supposed to do What about the EpiPen What about how usual drug changed to be taken from 3 time a day to 1 time a day and they are able to renew their paten and the cycle start all over again
Kyle The Celt	Then there ’ s u over here in Scotland with free prescription Whoooo 🏴󠁧󠁢󠁳󠁣󠁴󠁿
Tasunke	Trump administration is very smart They know their republican SCOTUS will never allow this to pas
Jo 🎃	I m kinda confused Why are there advertisement for drug when it s down to dr s to prescribe them Maybe there s something I m missing here I m not American
Alex Van de Riet	I m no Trump fan but I really like where this is possibly heading
fernando jesus	Look I ’ m a conservative and I think this is very important They should put their fucking price on add and on their website These fucking company rip people off and fucking over price their product
Collin	Imagine going to buy a sandhwich at Subway and them having to tell you that the sandwhich shop down the street is cheaper
Atomix	Do people really see an ad for a drug on TV and then go to their doctor and ask about it Anything I ve been prescribed ha always been a doctor s recommendation I don t think I ve ever asked about a specific drug in my life
tiber1978	This is certainly better than doing NOTHING and letting the company be able to have carte blanche and do wtf they want
ThatLittleKitten	Are these new graphic If so nice I haven t seen this show in a while so idk
Andrew Deck	Thanks for the extra video
