Philip DeFranco	Hi Its 4am Im too tired to think of a good top comment so ummm if you didn t see the Monday PDS be sure to catch up after watching your bonus morning video ok love you bye http www youtube com watch v n wW1pH3 ZY
Mike Shilts	I love Pharma s response because it show why this is necessary A patient s relationship with their in co is THIER relationship not Pharma s The price is the price regardless Pharma is fine charging a lot money because a 3rd party pay most of it and the patient think it s cheap which impact premium deductible and coverage long term Make them show u the number Justify the revenue stream
eyesanew	The price of a medication doe change depending on what insurance you have These company can list the different price for their medication on the commercial However this would not just expose them but also expose the insurance company I don t mean expose like they are terrible evil company more exposure will lead to more competition will offer better benefit for consumer
Mellow Melee	Drugs do not follow the basic rule of supply and demand If you need a drug for pain relief addiction or to stay alive the price usually ha minimal impact on the decision to purchase
tenten32158	if drug company are so worried about how expensive their drug will seem when putting the price on a tv ad it s really simple List an average or lowest possible price that consumer will pay directly after insurance kick in along with the actual price of the drug Like I dunno Drug Price 300 but your co pay could be 20 10 or even 0
wurzyking	Obviously the best option is just not have Pharmaceutical commercial at all and have you doctor make the decision about what is best for you and the possible option This seems like it may affect how likely a person will request a specific drug based on an ad Of course this could dissuade people if the price is too much but it could swing the other way if that product is cheaper than what they already have This could be a good thing and drive drug competition and drive price even further down However this are major drug we are talking about this isn t checking the difference in price between zyrtec and allegra The cheaper option could also be more dangerous i remember an ad for birth control that popped up on almost every commercial break and a year later ad for lawsuit against this drug for family member that died Yaz i think it wa called Yes cheaper prescription drug is overall a fantastic thing but the most important thing is to listen to your doctor about the best option available to you and trust his her 12 year of college and training
Matthew Barr	I really liked the editing in this video It d be cool to see all the video edited like this
7orqu3	Nobody doe a fake worried face better than Phillip The Fence Sitter Defranco
Adrian Maxwell	Wow I m not mad at Trump for once okay I m mad at him but not about this specific thing Even if this doesn t shame company into lowing their price it s nice to have that added information Most of the time when I see a pharmaceutical ad I dismiss it it s just another drug ad stating the usual stuff trying to seem enticing while listing a long slew of side effect Including a price may make me pay attention As someone who struggle financially if I see an ad for an antidepressant and it pop up that it s a monthly price lower than what I wa expecting I may be more inclined to try to get that If they re concerned about confusion because of insurance then give a basic number a patient may pay if their insurance won t cover it then a disclaimer 30 for a month supply may be lower depending on your insurance company It s not that complicated I do think it should extend to other platform a well fewer people are watching TV and by social medium I don t know if they mean social medium commercial like the one they play on YouTube or on break on thing like Hulu or if those are covered by the tv ad requirement It s so hard to get better and be informed about medication despite in a day and age where we have such big scientific advancement and so much information at our fingertip The easier we get the information the better
MrApp Bee	Love the extra video
Mahatma Kane Jeeves	How will the leftist make this about race I wonder🤔
KrunoKing	It seems very strange to advertise prescription drug Isn t a prescription drug given to you by your doctor who should know which drug is best for you considering their medical knowledge and them having your medical information also since it s US and health is not affordable they consider your budget
TsMHicks	Super glad this ha the potential of happening Mark another thing good Trump is doing Ridicule him for thing he doesnt show result on praise him when good stuff like this happens I hope we slowly revamp reboot the pharma industry imho Too many people addicted to prescription drug maybe showing them how much it ll cost them wise will get them to not even take them Yes there are medicine that do help and those people will buy them regardless but most are to get you to take other med and continue a never ending cycle If you impact a person wallet or benefit thats where u will get the most resistance Hoping this happens and we see price fall or people stop taking a many med a it affect their income margin
Glenn Rickard	Thanks Trump 3
Miracle Mark	I ’ m not gon na lie I can ’ t watch one of your video anymore without thinking of a Better Help joke
David Doty	I like this Thank you
supersmashbro5031	The way I see it this could go one of two distinct way in my opinion One way being it could bolster the company resolve and a a result they stand their ground for the quality of their product being a key factor in keeping their price in the same semi transparent state that the industry ha garnered over the year The only problem to this being the actual longevity of their stance and if they decide to artificially restrict access to much needed medicine to the general public creating national headline at the least detrimental to the most detrimental being a public outcry which is denied by an absurdly difficult pay wall to overcome a more and more pharmaceutical are developed to combat more and more disease and disorder This creating an artificial mean of hyper inflated price which would fall down a slippery slope of general inaccessibility to anything that isn t OTC Another way being if they became completely transparent with pricing option to the general public This could result in more general awareness of what you re getting but it could create a gray area of over accessibility This could result in a lot more people being prescribed substance that have a threat of developing a dependency being subject to a misdiagnosis or an overdose of yet another easily accessible substance due to people seeing what they re getting and going through the process to get it in any way they legally can Another bump in the road is to factor in thing like AARP Medical Coverage or even the concept of having medical insurance to begin with These institution do the research on price point and even offer discount based upon their unique tier system Some would argue that this method offer a safer alternative to accessing medicine that could prolong or save your life but at the cost of a higher premium for using their service It could hypothetically render most of those job opportunity obsolete and give that responsibility to the general public who is generally uninformed of most option that they have at their disposal In short there s an unintended yet foreseeable consequence to either standpoint My opinion create a regulated system of obtaining and researching different medication through either an organized effort like a website that can only be accessed through ID number given to you from your chart at the doctor s office or create an equally regulated system of cycling name brand medicine that have only recently been developed with other brand that have garnered consistent result into an accessible OTC form The newer one are only accessible through prescription at a medical facility and the reliable older one are cycled to the public at an accessible price point that is not only visible but comparable to promote healthy yet regulated competition
Mumen Rider	Think of this tactic a a way to get more money dumped into the election cycle a lot of hype and noise now but once the money roll in this proposal will die
shmebulock	Maybe unpopular opinion but hear me out I think it ’ s important to remember that the blueprint at 1 44 said create incentive to lower list drug price While I agree that some medication are exorbitantly priced it ’ s also true that pharmaceutical company will only continue to innovate and research if they can recover their money and fund future product Marketing is a powerful tool and if too many new drug fail to get off the ground because of their perceived high initial cost we could be in big trouble Getting any drug through the drug testing process cost hundred of million if not billion per drug And that doe not include all the investment made on formula that failed out of the testing process part way through If a patient see an ad for an expensive new drug they may be deterred and not listen to their doctor when they say the old cheaper drug is le effective ha le side effect etc opting to continue with an older cheaper drug This situation could easily turn into consumer sticking with tried and true drug ignoring new product and bankrupting company that spent billion on drug research Why would pharma company risk making new drug when they can just market their old drug that have made back their investment and increase profit margin I ’ m not saying consumer should not be informed how much a drug is going to cost them but it is a bit naive to think a patient who see a commercial for an old drug being sold for 50 a month will switch to a new more effective drug that cost 200 a month just because their doctor recommend them too Maybe if the government subsidizes some of the research cost or fund more research itself drug company can comfortably lower price during their patent period All I ’ m trying to say is there need to be more that is done this can ’ t be the only way we try to pressure pharma company because we may not like how they decide to push back at u
onepunch saitama	I imagine that the pharmaceutical lobbyist hyped up on caffeine ready to fight this while Trump is just smiling over steak and egg
N Brown	Outlaw prescription drug ad on tv Many good pill many crap pill a tv commercial is not the way to pick a prescription drug
Gravity Gas	Nice morning video but I m too busy paying attention to the editing to see if I can find out you guy new workflow The video doe seem a smidge off I guess but the only thing I can really put my finger on is that there s le cut to Phil and maybe le transition I mean it s not bad don t get me wrong but it doesn t feel normal and kinda different and I m just trying to be a big brain boi and figure it out but I m not editing guru either Again nice video
Arrieta 187	Wow you guy are barely catching up on this Did msnbc and cnn not inform you The Trump administration announced this like 3 week ago
Chev Campbell	Insurance a a standard shouldn t be involved in perscription drug Your car insurance doesn t pay for your oil change If you want perscription coverage get a perscription plan or coupon It would be like buying a service plan from you car dealer Then there could be a competitive market
Leon Chen	I don ’ t really like Trump but i love this idea Im in
Michael Rodriguez	I ’ m an independent here and I don ’ t agree with this move While yes it is good in theory to advertise the price the actual price of prescription is extremely high without insurance and it will lead to a lot of confusion for consumer This could then lead to possible argument of false advertising if proper legal text isn ’ t worded properly I love the idea of lowering prescription price but I don ’ t think this move will change that
SpIdAgRaY	Why doe this video look like a power point presentation put together by a high school student for their class Something about the editing is off
Dularr	Why is this a surprise You may not like President Trump But he is delivering on almost everything he promised He talked about lower prescription pricing a part of his America first policy That it wa unfair that America paid more for prescription drug than other country
Luis Duarte	Kudos to trump for doing something good for consumer
Melissa Georges	call your doctor if you experience or death because these may become permanent
G-man	american are fucked in every way possible
mecenary1337	I ’ m digging the morning show
Drivetime Josh	What is the name of the big pharma lobbiest
Chronically Chelsey	As a disabled patient that is a former pharmacy technician this is interesting to say the least First let me say that I am not against this at all Second all of this information is already available Patients have a responsibility to educate themselves further on every single drug they are interested in prescribed already or have been taking for some time This includes side effect price alternative Your doctor should know this info if they are worth anything your pharmacy is more than willing to discus it And if either of those is untrue I reccomend a pharmacy linked to a hospital or clinic instead of a big chain this likewise link your doctor directly to your pharmacy staff I dont know I can t help but see this a just pandering to the public
Bo Simmons	I think this is good because you don ’ t know how much you ’ re paying until you ’ re picking up you prescription and then you ’ ve waited to pick it up and you have already seen your doctor
Aurora Quinn	Not a fan of Trump personally but if he can get this signed and passed he may have my vote
val see	Theatre Nothing but show Omg pricing on tv ad Quickly refers to viewership number of tv v online ad
The Fumbler	So they didn t even need to release their price on their own damn website What do you have a website for then
Weeby Boi	Mate this wa great I watched this before school
laciee	I thought death wa only temporary and that you would respawn a couple of second after you died I ve been lied to
Dontlie Tome	Accountability to the drug industry Gon na be alot of resistance from those in the pocket of big farma
Uncle Gamer	I think we should outlaw all prescription drug advertising They are sending message about drug to people that often have no meaningful knowledge of health care to understand the drug usage Also the money used for the advertising could be used for more research or even to lower the price of the drug in question
khaled Hichmad	The Pharmaceutical company lobbiests are slacking start writing them check boy Damn America is fascinating
G0DM0NSTER	I am extremely surprised due to how much of a shit human being Trump is this could be good for the future I wa worried this short wa going to be about maybe me losing my Medicaid coverage and not getting my Bipolar and Health medication My parent said they would always make sure I have my med but I just don t want them to pay so much y know Hopefully it help instead of hurt cause I have always wanted to start a project that would help people get the med they need for super cheap or free and let them lead happier life due to the medication they would be on
fuaad Mohamoud	Thanks Trump
Innermix	I think overall it s a good thing when transparency is a part of the equation but a someone who is visually impaired just having it written on a screen is not going to help me make an informed decision I think it should be spoken aloud somewhere in the ad and because their concern is different people will pay different price based on their insurance they should mention that in the ad to cover that concern
enveyorbust	american health care make no sense i take 7 pill a day thats 7 box a month t cost me £30 a quarter or £10 a mointh if thats eiser in america i wouldnt be able to afford there inflated price
Keoki johnson	Some actual good mew Sounds great to me
Electric Fangs	CALL YOUR DOCTOR IF YOU HAVE DEATH
MommyOfMutants	If the drug company are worried about having the price in the ad making people thinking the price are too high compared to what the patient would actually pay out of pocket after insurance coverage couldn ’ t they after listing the price have a disclaimer like “ Please be advised that this price may vary be lower depending on your individual insurance coverage For more information please discus this with your dr your insurance provider or go to website ”
B V	Honestly I m shocked to be writing this but this administration is trying to do something beneficial I m for it Though realistically I would force them to say the price too a it need to be accessible for the visually impaired and I would force it on all other advert too not just TV The reason social medium is abused is because people can write what they want and those not wishing to look further into claim will just accept what is said However I gulp commend them on the first step to destroying this consumer lead medical frenzy This idea that it would stop someone getting the right treatment is totally false all other developed country have managed with the doctor deciding what is good for people It work because it s on their head if they get it wrong They have trained for so many year in not only how to keep people healthy but also understanding what drug really do and how they are produced They are expert not just people accepting that what the nice lady or man making money from me on the TV said sound good for me
DeWayne Lehman	Yay the morning show is back I loved it when you first brought it out keep it going Use your other cast if it s too much for you Phil but 2 show is great
OverWatchGaming	Doctors get kick back for prescribing medication Much of our heroin addiction problem is because of doctor
ZynnChaos	1 hour ago your posting at 5 am now Fkin Heros at the Philip DeFranco office
Kdawg TheGreat	Orange man bad I NPC I know Orange man touch me and enslave like china
Flangelus	Drugs shouldn t be advertised period Were talking about thing that could lead to more health problem down the line and horrible side effect not shoe Here in Portugal you need a prescription for almost anything other than pain killer
Iroc Life	Trump stay winning
E.J. Cartagena	The best part of waking up is PhillyD in your sub 😁
Isaac Gruver	If this is a violation of freedom of speech then so is the requirement to put a nutrition label on food The government isn t trying to mandate what you can and can t say it s trying to give the consumer what they need to know about a drug
Rake Steele	You re A Scammer
The Moore Clan	Didn t JFK go after the drug company
Raymond Kapala	I love the disclaimer at 1 08 Thanks drug company didn t know death wa permanent
toqe	i visited usa few month back and those ad made me laugh 80 of those ad are just side effect and warning
Teresa Sández	I don´t know if this would work but it seems like a good thing to do right America ha a big problem with public health and the FDA In Spain most drug are free or really cheap if they´re including in a prescription and a doctor gave it to you So only unnecessary drug are expensive It work very well but also we have a good health system so idk
Oonagh72	No one watch tv anymore so excluding it from social medium which is where people research drug is a gift to the drug company
Hector Perez	Liked it
The [REDACTED] Guy	I think drug ad are both odd and creepy I also think that drug ad should not be a thing but that s something I don t feel too strongly about
Quinn Reed	Always found the American drug ad soooo creepy
Cheybat	I mean an actual positive development would be banning these advertisement all together like the rest of the world
LordOwlBear	These sort of tactic are commonplace direct the conversation somewhere else a to distract them from what we really want and what the conversation should be about Universal Healthcare
TheCintnoti	I m willing to bet that if the pharmaceutical company opposed it then it s likely to loose them money Maybe by forcing them to engage in price competition or maybe because consumer will be dissuaded from asking about expensive drug Pharmaceutical company are business and business exist to generate revenue All that really matter is that direct to consumer advertising for pharmaceutical is fucking weird
Lynn Rolaf	Great first step The lawyer sound like Big Tobacco screaming about first ammendment right But still a great step it reeling in Big Pharma
Truck Driver 101	Coma or death may become permanent 😂
Michael Stone	How about a simple disclaimer the listed price are not definite Speak to your doctor insurance on how the price may change Cause even if this get turned into law they ll always be some loophole or some clause to get by
PlaygroundPrincess	Oh my god you talk so fast for my morning brain
Shaun Westling	Pharma argues they shouldn t advertise the cost because consumer won t be paying it Meanwhile healthcare cost is crushing our society and is still rising along with our insurance premium of course they want the consumer to only consider their out of pocket cost and not consider the total cost to the care system that is hidden inside their premium Meanwhile insurance provider and employer are moving to high deductable healthcare plan where the cost transparency is an important factor a plan participant must make more direct difficult decision of cost v health
GG RELOADED	I don t know which is worse prescription drug or BetterHelp
Silent Mobius	Uh oh the Trump administration is trying to keep another promise wonder how many head are gon na explode if he succeeds on another one
Will Lastnameguy	How much you wan na bet the leftist freak out about this
Adel Wolf	Am I the only one who is dubious about this Yes this would be great for the people who actually watched television Will this cover streaming TV a well Excluding print and web advertising leaf out a significant demographic of people who would be well served by this information Just using myself a an example I take several prescription one that without the manufacturer s 1 year assistance program cost over 900 a month I wouldn t have known that even if they were starting to plaster it all over TV commercial And lem me tell you the sticker shock you face when you re at the counter and they re ringing you up and you find out that the med is so new that your insurance doesn t cover it
Nova Kobra	it s about time someone doe something about big pharma in the US it s growing a nation of addict and poverty They will prob win this fight might have something to do with hundred of BILLIONS of dollar a well a powerful politician in their back pocket THis is what Trump should be doing going and and sorting these criminal out Wait a day or 2 though to see the leftist spin on this to make Trump literal Hitler
TheLightningScience	It s a half step in the right direction
Fragtastic	Things I noticed 1 This wa a little mini episode 2 You re using graphic like the 8 o clock news now 3 Drug company will price you to death and expect the government to pick up the tab
Peter Wysoczanski	it a big we will see but I think a a first step to actually try and make a change that no one s been capable of it a good one also ha this been tried before in other field what didn t we see pricing for at one time that we do today
beccathebadger	honestly i really hate trump but over this yes completely should have medical transparency it so important and even though he a bankrupt failure he still seen a a business man and might have more sway The drug industry need tackling let see if this could be a start to it
lopu	YES GOOD VID
thehALomolov2	So only the USA and new Zealand have direct to consumer advertising I m in Canada we have it too Idk if it s on USA channel but they re definitely not being replaced with allowed ad Our provider and network would probably replace them if they were being fined for breaking the law
Riley Findley	i m really anti Trump but this seems like a good bill
Gerald Miller	Thanks Trump
peter peet	So company have a 1st ammendment Interesting
emma de banville	Hey Phil are you goign to talk about what the trump administration is thinking of doing in regard to trangender people They want to determine gender more narrowly tostrictly the sex at birth which would just take away so much from what the trans community ha managed to earn in regard to right in the last decade I know it s not a set thing yet but it could be a very damaging thing to so many people
Kingjay814	Hey I work in this industry on the insurance side of thing Okay so I personally feel like this is a good idea I remember reading about this a few month back for the first time and provided there isn t any hidden evil shit buried in this thing somewhere I m all for it These ad are targeted towards elderly people who are generally in a Medicare Part D prescription drug plan These cost are a big deal because sure they may have a copay most of these plan have a limit The donut hole is pretty much all on the patient to meet That s when this cost would come into play because depending on the plan the member may be responsible to pay for the ENTIRE RETAIL COST Now for younger folk Small company who have to offer coverage probably have a really shitty plan With those plan it s not uncommon to have a deductible on your prescription coverage and then the plan will only cover a percentage 80 of 3 000 is still a metric crap ton for people starting off A lot of people thing hospital are where the big expense are and that s not true nowadays This is a good thing The argument that these company are using is utter bull shit Violation of the First Amendment WTF get out of here
