MysticUmbreon	Alright so I don't get 1k comments about Gyarados not getting Crunch use bite. There you go problem solved. I thought for sure it got crunch oops.
Lab Rats Battles	The one thing that makes Staraptor so great: it's the only starter bird to learn a Fighting-type move, and I agree with you, he looks so rad!
thedazzlingshell101	I feel like if you don't want to use Gyardos, Floatzel would be another great option. Its early on at the Valley Windworks as a Buzel (sorry if my spelling is off), but once you evolve it, it becomes a rather cool Pokemon. (Plus its not 4X weak to electric type attacks)
Timmynator 9000	Torterra, Floatzel, Staraptor, Garchomp, Luxray, HM-slave or Lucario
Gage Waltner	My biggest complaint about pokemon you tubers is that they all have 1-2 minute intros that are completely stoppable, anyone else feel?
Rick Mannion	Dude piplup and turtwig are both trash everyone knows chimchars the best not opinion change my mind
barrowkade	Torterra is my favourite starter of all time but its not as good as the others :(
CrazyMangoz	Here is my altered version of this team it is made to include all the HMs to get through the game tell me what you think!    Torterra: woodhammer, earthquake, crunch, rock, slide.  Staraptor: close combat, fly, cut, return.  Gallade: psycho cut, close combat, leaf blade, night slash  Gyarados: earthquake, waterfall, ice fang, surf  Kangaskhan: strength, rock climb, rock smash, rest (scrappy for kangaskhans ability)
UltimateHero128	Torterra was my Pearl starter. I have no regrets. Infernape was Diamond, Empoleon was Platinum.
Noah Tackett	Isn't dragon dance a gen 5 move? Also, Bidoof. Perfect HM slave
Tristan Stoner	Instead of lickilicky i went with Blissey
Andrew Shaw	I think Luxray's better than Lickilicky
Zuzumita	Lickilicky is a really good pokemon imo   It gets access to stab Explosion (A feat only possible for Lickilicky iirc) which can KO most pokemon in the game and has a really diverse movepool, however A physical set is what works for me so wew (You can run a special variant if you want) Also it's decently bulky so it's likely to survive lots of attacks (as long as they're not fighting type)  Held Items should really only be either a silk scarf or leftovers (maybe even expert belt :thinking:)  For moves i'd suggest: Return - Most reliably powerful stab move it has (Next to explosion) Explosion - For all reasons above (Also for when Lickilicky's about to faint/A last-ditch effort Power Whip - Great power and deals with pesky rock types The last move can be anything from Fire Punch to Gyro ball tbh (I would recommend fire punch/flamethrower though to deal with steel types)  For a special variant you could use: Return - (unfortunately Lickilicky doesn't really get a good normal stab special move apart from hyper beam so you'll have to make do) Hyper Beam - (Basically a lower powered, less risky explosion, although it leaves you vulnerable for a turn)  Water Pulse/Surf - (Same reason for power whip, deals with rock/ground types) Flamethrower (or if you're feeling risky, Focus Blast) - (for steel types)  Lickilicky has always been one of my favorite pokemon and it's for all of the reasons above and it's really underrated the only thing I don't like is that it's really slow, but that's not that big of a deal tbh also explosion is a fairly difficult TM to obtain in platinum (but trust me, it's worth it)  Anyway those are just the sets I use, feel free to use them yourself or modify them!
Gabriel Silva Rocha	Hippowdown is also a great filler option for the team btw
Random human	My team is İnfernape Staraptor Garchomp Lucario Gastrodon Leafeon
scizor squad	Turtwig was my first and one of my favorite starters so the beginning triggers me but it’s ok
Broseph	But I love torterra
Infinite Bacon	Just completed a run with this end team! Decided to play a bit faster than normal and managed to beat Cynthia within 22:10 of game time (a pretty good time for me, I like to explore more typically).  But due to the speed at which I was playing, I didn't end up filling out the entire moveset for each Pokémon, as by the end the highest level was my level 52 Gyarados. Thankfully, as it turns out 6 dragon dances is just enough to sweep Cynthia's entire lineup.  In other words, had a lot of fun trying this out!
greek1237	You hate the grass Turtle? It was my favorite of the gen 4 starters.
Ganon Tice	*I love torterra!!*
Draco roblox bad piggies more	Lickilicky @ Expert Belt   Ability: Own Tempo   - Swords Dance   - Cut   - Earthquake   - Zen Headbutt
kenny chen	It's ehhh..
Oliver Cloezoff	WHY the hate, not just from you but people in general I don't understand!
Ash Ketchum	You don’t have a good mix of physical and special attackers. Almost the whole team has better attack stat than special att stat Also it’s isn’t really great to have Pokémon to share types. So I wouldn’t have 2 normal and 2 flying types. So I’d swap gyarados and lickilicky.   Swap lickilicky with porygon(eventually porygon Z) which you can get before finishing the game   And swap gyarados with a special attacking water type. Perhaps vaporeon
Billy Creates	*the moment u have diamond but not platinum*
Willem Wijaya	You suck as pokemon game
Jack Patterson	But Torterra is great!
Garnetore Gladiator	It’s funny that his favourite starter is the only one worse then torterra
mukesh md	What about Ariel ace instead of takedown
Youssef Lataoui	How do you get past heart home city the second time you get to it
yanniek pijper games ypg	I actually like torterra
Meta Knight	Yay i love torterra
Caiden Magill	Starraptor is my favorit bird
Sweet Tea	Lmao u guys are hypocrites saying staraptor and houndoom is bad in other sinnoh vids and then completely contradicting that
Roblox ultra Beast	It worked kind of
MALOE	hey mystic I got a request i'm currently doing a ultra sun journey & well i'm gonna take on the elite 4 in a few months & I wanna know what should my final team's moveset be for my pokemon ultra sun journey? i'm just asking you to give my team some final moves & describe where I can find each move because i'm not changing any of these pokemon because they are my final teams & pick each move carefully for their natures to fit anyways here is the teams for the elite 4  part 1  Robin Hood The Male Decidueye Level 59: Naughty nature (+attack -special defense) ability: overgrow  Kahili The Female Toucannon Level 57: Gentle nature (+special defense -defense) ability: skill link  Lana The Female Araquanid Level 57: Docile nature (+nothing -nothing) ability: water bubble  Hapu The Female Mudsdale Level 56: Mild nature (+special attack -defense) ability: own tempo  Roark The Male Rampardos Level 56: Sassy nature (+special defense -speed) ability: mold breaker  JoltSpeed The Male Jolteon Level 56: Serious nature (+nothing -nothing) ability: volt absorb  part 2  Robin Hood The Male Decidueye Level 69: Naughty nature (+attack -special defense) ability: overgrow  Kahili The Female Toucannon Level 67: Gentle nature (+special defense -defense) ability: skill link  Lana The Female Araquanid Level 67: Docile nature (+nothing -nothing) ability: water bubble  Hapu The Female Mudsdale Level 66: Mild nature (+special attack -defense) ability: own tempo  Roark The Male Rampardos Level 66: Sassy nature (+special defense -speed) ability: mold breaker  JoltSpeed The Male Jolteon Level 66: Serious nature (+nothing -nothing) ability: volt absorb  also no egg moves at all or post game moves till part 2
Arry Reddy	Luxrayy
Gavin Mauk	I recently did a Normal-type run of Diamond, and I had a fast Clefable that knew Flamethrower, Ice Beam, Thunderbolt, and Hyper Beam. Keeping it just a couple levels above the trainers had it going first and destroying.   I also ran Bibarel (practically Water-type starter), Staraptor (so good and neutralizes Fighting weakness), Blissey (Toxic, etc.) Lopunny (basically my Fighting-type, knew Dig) Girafarig (Psychic- and Ghost- type move special attacker).
Roxas	Torterra is love
Nedu Egeh	10:50 - 10:53 I'm glad I'm not the only person who thinks way too many people sleep on Lickilicky.
Takato 214	What do you think of dusknoir
Moises Cañeca	I had a similar team right now except I have Lucario for lickylicky and gardevoir for gallade
Caspar Alderson	I'm skint but those tees and hoodies are sweet
Jeddy Steve	I think that Gastrodon is better due to only one weakness, and has good bulk with usable special attack. I know it's a repeat type, but having a good water type that can also be a backup ground type to Torttera. Also it's got early access as well as having surf, which means you don't need a Lickylicky on your team since even though I like Lickylicky, A lot of people don't. Also keep in mind that Gastrodon can learn ice beam so Garchomp won't sweep your team. Even though Garrados(I probably spelt this wrong because I'm too lazy to look it up) can learn ice fang, it's not as good as ice beam.
ChillMoogle	Both Gastrodon and Snorlax have slower speed 90% of Torterras segment you talked about it’s passable 56 speed
Kinsai	I would recommend replacing Take Down with Return once Staraptor reaches max happiness. It's the strongest Normal attack move without any drawbacks.
Henry Rubio-Ventura	Lickilicky is a physical attacker not a special attacker.
Max Ettling	Sinnoh has the best starters
noa Kastle	Why not curse instead of crunch
ProKobe	Torterra is my favorite Pokémon ;(
x Hasan	Redo Infernape The original one sucks
Jared Kinz	i used torterra in my first game and used Torterra Staraptor Luxray Machamp Palkia Poliwhirl (and eventually Poliwrath)  idek what i was thinking
Starter Paks	My torterra is always bomb and super fast
LegenderyFox	Good night, well I'm Brazilian and I'm learning English, and I do not understand everything, but can I put subtitles? Well, thank you for reading.
Luke Chan	shouldn't staraptor know how to use roost?
Joy Chowdhury	U still need to make a Venusuar,Typhlosion,Feraligtyr and Swampert edition
Inferno Burns	I agree Stataptor is my second favorite bird after Pidgeot.
Ben Naughton	Why Torterra is actually good ( not to spite you or anything just that it's one of my favourite starters. Please don't hate me)  For starters ( pun intended), even though Torterra is weak to Infernape, the best Infernape can do for a while is flame wheel, which is easily tankable thanks to it's bulky defence. Yes, special attacks cripple it, but would you actually see an Infernape use a special move?  Second, moves like Giga Drain can be helpful as it sacrifices a bit of power for the ability to heal. Curse could also be viable as it's already slow as heck, why not just up it's other stats instead ( I used only grottle to beat gardenia using curse so it's a good early game option) What I'm saying is that not all pokemon have to only have attacking moves. Synthesis could also be another option.  Third, many pokemon could be used to build a team around as the vast amount of TMs that can be put on certain pokemon covers most of Torterra's weaknesses. Personally, getting an altaria in this gen is extremely useful as it can be taught moves like ice beam and earthquake , giving it to Gallade it kind of a waste as fighting moves cover some of the things that earthquake is super effective againts ( Steel, rock etc) Even if you Have some other weaknesses, your fire type ( or in my instance a clefable with flamethrower) can deal with those threats for you.  Finally, I think that torterra is a pokemon for more advanced players to use. It's tanky nature makes it difficult to grasp for the less experienced players, making Infernape as good as it is kind of an easy mode for the game. Understanding that not all pokemon are fast sweepers makes it easier to appreciate how good Torterra is ( Not saying to don't expect all pokemon to be fast sweepers, it's just your preferance).   I hope that you appreciate what I was saying. I'm not trying to make you look bad or anything. I'm just spreading mu opinion out a  bit. Thanks! ( Btw I reaaaallly love your channel :3)
Anthony Gulick	This dude is so biased... never seen anyone hate torterra this much. Going to say it’s the worst starter of all time is complete BS
Jose Salas	Wouldn't it be better to carry curse instead of crunch?
Justine Mariano	Galade is MOST VALUABLE POKEMON
Rossy james	Wow!
Judith D	Yes Torterra!!! My young self who knew nothing about types actually used torterra to beat the Ice gym. Torterra is beast
Tyren Prowell	My Torterra had helped me beat the kento leaders in the pwt torterra exactly got a good move set stone Edge dragon rage leaf storm Nd earthquake
Amolik blesson Singh	Well I think that lickilicky is actually equal to snorlax
Louwrens	I always go for Shinx on the first route it is A not really good at first but once it had evolved into luxio this thing rocks and its final stage luxray is A really good mon as well and is in my opinion A great addition to the team.
MadMike96	since i had diamond and Platinum, I've sent a chimchar and Turtwig to platinum so I've got Empoleon, Torterra, Infernape, Electivire, Staraptor and Gliscor you didn't mention any trading pokemon.
Fyntom2	Torterra is completely my favorite, can't believe this :'(
Michael Hendrix	I'm tryna figure out if you know adam22, he references someone he calls mystic when hes talking about pokemon go, if you are part of the rope gang then that makes my day.
Rami Saab	Magnazone...... 😩😩😩
Timekeeper Zaphkiel	Hi Mystic, I'm doing your Best teams in my pokemon games. I got a Shiny turtwig when i copied this. SO HYPED!!!!
Nathan Parker	I'm so glad to see my favorite Pokémon on this team
Jordan Duggan	9:56 B I B A R E L M A S T E R R A C E
yago padilha	I love using Turtwig and Honchkrow on the team
demonte mccoy	Me personally I would use ambipom than licklylicky
OpErAtiOn Seiged	Highscool dxd anyone?
Hugo Santos	"Licklicky" BOI
Fiona Wallace	Torrtera is the best starter. So screw you
Damon Frey	Is the a possibility of a samurott black 1 team
FaceOff Power	My team would be  Torterra Crobat  Gyarados  Houndoom Medicham  Porygon-Z
Marielena Potts	Torterra is actually better than Empoleon, you and HDEvee really need to stop labelling it as bad all because of speed  ""But it's based off a turtle!" (Correction: tortoise, and yes, there is a big difference between the two) that's cool, I get the concept. If you like the design that's dope. The problem lies with its speed" Did your microphone glitch out at some point and you didn't know it cut off some of your dialogue, or you intentionally or unintentionally edit out what you said after talking about the design and before going back to the stats or did you actually just try to sweep the design's explanation for the low speed under the rug and hope that no one notices? Complaining about speed, understanding the reason why and ignoring it and going straight back to complaining just looks pathetic.  "The problem is it gets outran by literally everything" oh yeah there definitely aren't any slower Pokemon out there, and ALL Pokemon that don't have high speed are hopeless (this sentence is sarcastic by the way). It's not only a TORTOISE (again, not a turtle) but it's also a CONTINENT. Both are known for moving slow, and continents can cause limitless amounts of destruction no matter how fast they move. And you STILL expect these two combined to be as fast as at least a little kid on a bike or scooter? And you clearly never heard of the story "the tortoise and the hare". Also there are moves and items that deal with its speed, stop labelling slow as bad
Allen Duncan	I got to say togekiss is better than staraptor can support take hits and dish out damage plus serene grace awesome movepool
Chris Cooper, random man of music	Sounds like you're saying Brek Brek instead of Brick Break
Goran Yugi Dubravic	My team in diamond was Torterra, Luxray, Staraptor, Floatzol, Rapidash, and Lucario!
theRJschannel	Suggestions for the BW Samurott and Serperior: Samurott Team: 1. Samurott 2. Stoutland 3. Swoobat 4. Krookodile 5. Darmanitan 6. Ferrothorn  Serperior team 1. Serperior 2. Stoutland 3. Swoobat 4. Seismitoad 5. Darmanitan 6. Vanillux  There's not too many in the original BW games, but I grew up with these so I know some good coverage with these guys. And Mystic, if you're wondering why I chose some over others you might've thought of, here are some reasons; -Swoobat has a base 114 speed compaired to Sigilyphs' 97 speed. Sure Woobat has much less Sp Atk than Sigilyph, but it still has some nice STAB moves for the game and can do away with Bianca's/Cheren's Pignite/Emboar and Cheren's Serperior. -Seismitoad is a great water and ground type, while not having much in terms of coverage, it shuts down Elisa's Volt Switch tactics greatly and Tympole evolves rather fast -Vanillux because flying type coverage I can't think of any other, but I would appreciate if you gave these some thoughts.
Otto Kapanen	I went with: Torterra  Luxray Gastrodon Drifblim Drapion Froslass
Rhyperior Ranger	I love Torterra. My team is  Torterra  Gastrodon  Togekiss  Drapion Magmortar  Lucario
Dylan Ward	why does barry have a torterra on his team?
Master MoJo	Torterra  Magmortar Gryrados  Staraptor Garchomp Electivire
riotmaster145	You can teach Torterra rock polish or to make it’s speed way better
Eduarte's Productions	At 7:10 why does Barry have Torterra? He's suppose to have Empoleon.
ArchetypeGotoh	Tropius -fly -flash -strength -cut  Bibarel -Surf -Waterfall -Rock Smash -Rock Climb
Surinder Garg	You can use garchomp
muncher videos	#4 gen gamer am part pilup  people
Slovakian Mapping	My god how many videos do I have to comment if the have the defence to tank then u don’t need speed if u can easily take hits then speed don’t matter
JimmyXP	Turtwig was my first starter in pearl, hes a beast
Brian Ludwig	How is Mega Houndoom a disservice? I don't see anything wrong with it, and the fact that it got a mega is a streak of luck.
Keshav Agarwal	I like all sinnoh starters and their evolution, except one.can you guess which one?
Nathan Dawe	Finally
Anthony Hand	When you just decided to restart platinum again. Perfect timing
Sean Davis	torterra was and always will be my favorite starter no debate
a cat that is stripy	Garydos. GARYDOS. Not to be mean but it's gyrados to me to pronounce it is gi-ra-dos not ga-ra-dos
Caleb Chmelyk	FUQ U MAN TORTERRAS COOL AS FUCK BRO
Ariel Roa	Have u consider playing Pokémon revolution online its basically most of the regions in one game
Ian Animations	This is my team for Sinnoh: Torterra Staraptor Luxray Floatzel Houndoom Lucario  This team kicked ass!!! One of my favorite team so far
The Officer Friendly	My team when I beat the game with Torterra: Torterra Staraptor Luxray Medicham Houndoom Vaporeon
Britney Young	Hi
Phoenixlord123	Finally a team for my favorite starter
Moon DarkWolf	Can I just say that this was literally my team (except lickylicky) on my first platinum team  My team was  Torterra Staraptor Luxray  Gallade Gyrados Garchomp Houndoom   What can I say I’m super shocked
Michael 5	Floatzel would be a good water type too. It has a great speed and attack
Joan Aguayo Planell	Okay, let's tear apart this crap while I watch.  Off a good start: Complains about torterra's speed. Never even considers Rock Polish.  Return is THAT much better.  Gallade has completely redundant moves with Torterra. Also extremely overrated.  Gyarados is good. Guess even a broken clock is indeed right twice a day.   Lickilicky sucks. Having a million TMs available won't matter with that mediocre attacking stats. If you want a tanky attacker just bring Bronzong and consider using Trick Room to fix Torterra's speed without having to invest in the Rock Polish TM, not like you will need it for anything, but I guess it opens a slot for Torterra to bring Stealth Rock to the table, wich is always a good thing to have.   Houndoom is SHIT. For the love of Arceus just use Garchomp instead, you can even get him right away after the second gym in Platinum. He got banned from competitive for a reason. Please don't ever bring up again this trash pokemon who couldn't even use a mega evolution right.
Nick Ellis	Yeah, I'm not paying nearly £50 for a hoodie
Connor Stevens	Staraptor is Both normal/flying Gyarados is flying and lickilicky is normal- ergo I can’t use Staraptor or Gyarados/Lickilicky Sorry. Replacements? None of the types of Torterra Houndoom Or Gallade Staraptor or Gyarados/Lickilicky
YoBoi Nebby	Torterra is always going to be my favourite starter of all time, i love it so much (mainly because of nostalgia but still) and i like standing up for the under dogs. When I play sinnoh I usually use Torterra, Staraptor, Floatzel, Mismagius, Yanmega and the last one is never really the same but usually its just like a skuntank or something.
Namenlos	My Team: Torterra  Luxray  Staraptor Garchomp Weavile Lucario
Ryan Mc Kenna	Are you going to do a best for Infernape for Platinum?
Jose Sosa	Dat best starter edtition 💯
Dudeldani	Torterra Houndoom Togekiss Golduck Weavil And magnemites last evolution
HimSnow	Best turtle pokemon.
Daniel Furman	I used Torterra, Staraptor, Luxray, Floatzel, Houndoom and Lucario, have to say it was super super difficult, especially some of the later gyms, Cyrus, Cynthia (Floatzel's Ice Fang did 1/4 of Garchomps health) and the double battle against Volkner and Flint. Lost countless times in the Playthrough 😅
Masara Town RGBY	What if the entire Pokemon franchise had ended after Generation 2(GSC)?
Coffeetoad	Where is CHOMP?!!!!!!!!
Zigsaw Gaming	Loves Turtwig wears Piplup cap
タイ人サヤマルット	*Thank you for picking up this wonderful Pokemon! As this year is the 10th Anniversary of Pokemon Platinum's Release...* *I, as a Thai Pokemon fan, truly love TORTERRA!!!*
King Doko	What about Togekiss 😭😭
Beth Smith	Torterra CARRIED my platinum run, tbf I was 8 so wasn't focusing on team comp but I used Torterra, Staraptor (swapped for Giratina later), Tentacruel, Golem, and then a random mix for the last 2 slots
Jason Dodds	Torterra isn't bad mystic I know people are entitled to their opinions but no one cares you dont like it
Roald Gaasbeek	Torterra is my most favorite starter pokemon ever!
Edwart Norton	I just begun my game a few days ago, currently team is: Grotle, Buizel, Gligar and Togepi and i wanna get a Croagunk. A good sp atk option for my six party pokemón?
Jay Conic	The team I used for Platinum was Torterra  Staraptor  Garchomp  Gallade Vaporeon  Houndoom
Iron Wolf Man	houndoom just doesnt learn good special moves until late :(
QuietStar silence	I always use floatzel instead of gyrados, i just like it best
roke tataroğlu	Torterra is one of the realest niggas
NightFly	Honestly, I love Infernape. My team would be:  1. Infernape 2. Luxray 5. Garchomp 4. Staraptor 5. Mega Lucario
Tempted Badger	5 ads on a 13 min video..
Lati 312	Did you cover all the HMs cut, Surf....
Italo Caycho Torres	The filler Pokemon could be Garchomp and honestly, it's not very hard to find.  A moveset should be  Dragon Claw Dig/Earthquake Fire Fang Slash/Crunch
Olly Tropics	My team for this team game was  Empoleon  Straraptor Misdreveus Toxicroak Lopunny  Luxuray
Vince Eggimann	TURTWIG IS GOD
Thomas Page	I used a Torterra during my own real run of Sinnoh (Diamond). I can’t know what the team was for sure (because the file got deleted) but based on a Battle Revolution team I still have, it should have been:  1) Torterra (Frenzy Plant, Cut, Leaf Storm, Earthquake) 2) Gastrodon (Water Pulse, Surf, Muddy  Water, Blizzard) 3) Drifblim (Psychic, Ominous Wind, Defog, Shadow Ball) 4) Luxray (Crunch, Thunder Fang, Scary Face, Discharge) 5) Starraptor (Close Combat, Fly, Brave Bird, Endeavor) 6) Bibarel (Strength, Rock Climb, Waterfall, Rock Smash)  I have no idea how I beat the game
Reaper of Things	Licklicky? The f*ck is that? I know every Pokemon in the Dex and I've never heard of that Pokemon, the only ones similar to it in name is Lickitung and Lickilicky, is this a Gen 8 spoiler?
Safal Muhammed	i love torterra more than infernape by a teensy bit
Ilija	Brick brick? U can't say break 😂
Elijah Toombs	Wouldn't return be better than takedown?
Tuvya Maeir	Staraptor doesn't learn Fly by level up...like...there is so much fact-checking in this video you should have done and it's really embarrassing. Forgetting to record something in audio and making up for it in editing is one thing. Forgetting to double check your facts and then trying to make up for them by saying "Whoops!" in the comments or something after it's uploaded? Come on, man...
Kevin Bibow	I would teach staraptor return instead of licklicky ^^
Nerdy Neko Girl	Can u do 1 for infernape
Night Zebra	As much as I like these. What about a team that only consists of pkm from said region, not including pkm like magikarp that can be found in every region.
Matthew Raley	torterra is my favorite starter of all time...
Nick den Toom	Since i don't like Doubling Up on weaknesses, i would replace Gyarados with Gastrodon and Houndoom with Luxray.
Champion DarkBlaze!	This was awesome! Torterra is my fav Sinnoh starter and in def gonna try this Team one day! But as for right now with the current playthrough Im doing of platinum, my team is: - Torterra  - Staraptor - Spiritomb  - Garchomp - Lucario - Magmortar The final four being Pokémon I’ve never used in an actual playthrough before. I’ve used all these Pokémon, but just not the final four in a platinum run. And this team has been great! Other members I used previously during this run were Floatzel, Luxray, Kricketune (hilarious in game cry and first time using one).
