Craig Campbell	Never played the DS games but torterra was my glazed starter my team was Torterra Electravire Charizard Hydreigon Aggron Gyardos all my pokemon intimidatin no puszies on my team
GATAZO	Actually, Gyarados doesn't get Crunch in Gen 4 Edit: My boy Lickylicky got some love yes! Edit: How is Iron Tail good for Cynthia's Togekiss lmao
TheMojoLemon	Torterrrrrrra
maguire bentz	I’d never ever user a licklicky
Emilio Camacho Erice	The biggest problem is his special defense or lack of it to be honest for something that is slow just like with emboar
Joey Grant	It's very easy to get Torterra by the time you fight Maylene and it absolutely destroys her Meditite and Lucario with Bite and EQ respectively.
TheMightyBlaze	What if speed effected accuracy
Aqua	This video is all I ever wanted.
Dragon Zek	Why tortera its trash do wish it never excited
Deth I am The LAw	I got a better idea: Don’t use Torterra
joshua primmer	LICKILICKI IS BEING USED!
Horatio786	Will you do this for Infernape?  I know you did one, but it includes Diamond and Pearl.
WishiWashi Gaming	Thank you
King Archie	Yesss
venomboy Wild	Yeeeeeeees I love torterra
Joleu	Where is Lurcario I have a moveset Aura sphere Dragon pulse Metal claw Fire,Thunder,Ice,Mega,punch
Vinicius Dancing	This is great!
Ben Maue	Where do you get Lickutung? I didn't see that in the video.
HylianAnime	Are you going to do Platinum for Infernape?
Not Spoiler At All	Wait, so people DO choose Turtwig as starter?
Dries de groot	Ah, I’m under 5k views... the satisfaction is real...
Snug Kieran	Yes!! I love turtwig 2 so thank you Mystic i luv your vids and i watch alot of them
GamerWatch Productions	if you do unova next I want to see serperior
Condor7215	As bad as torterra is in game, you have to admit it’s design is incredible
Mr E	For once a normal Pokémon that isn’t snorlax.
PlatinumWispa	Torterra is great though...
Mehmet Ali KOÇYİĞİT	Why no one uses gliscor ? It can OHKO all elite four and champion with swords dance + earthquake. And it is fun to use
Dinar El-Amin	I had such a horrible experience with Torterra in Platinum lol it's the reason I've never chosen a grass type starter again
Matthew Irons	My moveset for My Staraptor (My idea): Double Team - for evasion Close Combat - Very important Brave Bird Fly
Twi tch	YEAAAAAAAAAAAA
Cubzilla 123	Your team builders helped me for Omega Ruby and white and ultra sun👍
Harvey Coughlan	Oh dear
Θωμάς Νικολαίδης	No just NOOOOOOOOOOOOOOOOOOOOOOOOOOOOOO
Fantasysaurus	My team was: Torterra  Staraptor Luxray  Gastrodon  Machamp Magmortor
KernowShinigamiViper Lil'Dragon	Have never used this starter. May look into breeding one at some point.
Yoda Date	Torterra is a badass starter Pokémon.
Gila6918	not first
ZimonZieClown	MysticUmbreon: You really need to work on your pronunciations of Pokémon names (e.g. Lickilicky, Gallade, etc.)
heh heh	Hey could you do worst team next when your done the great teams for the other starters
Akash 13	I giggled everytime you said lickillicky
Furretmon Gaming	Uh staraptor doesn't learn fly by level up😐
Nathan Warren	My team for platinum was torterra garchomp staraptor pidgeot  gardevoir and gyarados
Tu patrón	I would choose a water type from the generation not a old one, no Gyarados, please. At least Buizel evolved. I
Samuel Anderson	I would rather go for the blissey than licklicky
heated typhlosion	Typhlosion squad where you at
Everton Batista	I play Platinum right now so many pokémon for team
NeomG	Land turtle... you mean a tortoise?
Amanda Watkins	I hate you Tortara is great
Benny	If you’re up for it, you could remove Gallade and use Toxicroak. As for a replacement, that’s up to you, but I think it’d be a pretty alright Pokemon! For a move set, I recommend:  - Sludge Bomb -Close Combat / Cross Chop -X-Scissor  -Knock - Off
Mr. 1up	Wow, he really likes advertising them T-shirts lol
Alexander Evans	I respect your opinion, but I like turtwig and torterra
Audangas Kozmianas	Torterra is one of my favorite starters, how dare you say it's your least liked starter, now I'm not gonna like your video
Brawlerman 10	I played platinum last summer with this team  Torterra Infernape (Traded over, sorry) Gastrodon Drifblim Lucario Weavile
Thirdy Guy Productions	YES!! Finally   Hi there nice vid it's 3:04 AM here because I woke up at 1:53 AM And it's October 22,2018
gagers78	Personally I find houndoom hard to use in a playthrough due to it getting flamethrower late game and so it has to use fire fang for stab. I prefer using rapidash. I don't get why people say rapidash is so weak. It has a good stab attack in flame wheel from a low level and it has a good speed and attack.   My team would be: Torterra Staraptor Drapion   Gastrodon  Gardevoir Rapidash
Astaku Dreemarc	I'm about to play pokemon white 2, I thought of a team: Samurott Lopunny Lucario Crobat Arcanine Zoroark  Any thoughts and/or suggestions on moveset and/or replacements?
Dryden Joss	what's wrong with mega houndoom?
Akash	Thanks so much mystic
what up	Sup
Nicholas Batawui	Love Fourth gen playing it right now
Mawile #303	I still like my Role Play team of  Dawn as name character   Empoleon  Togekiss (Cynthia Egg) Lucario (Riley Egg) Glaceon (from the PC runner Bebe as Eevee) Garchomp because Pseudo Luxray simply because you need something else at the start
Fear the Pig Gaming	I will never defile a team involving my beloved Torterra with that pink abomination thank you for the suggestion but I will absolutely find a different filler lmao.
SurfingKyogre	Torterra is underrated tbh
Animelover445 Serrato	Your brave to do this
XannyFanta	Don't like how you're dissing torterra -_-
Virasman	I used:  Infernape - Flamethrower, Close combat, thunderpunch, earthquake. Togekiss - Aura sphere, air slash, fly, extreme speed. Luxray - Discharge, thunder fang, crunch, iron tail. Vaporeon - Surf, ice beam, acid armor, hydro pump. Gengar -Thunderbolt, Shadow ball, psychic, sludge bomb. Abomasnow - Wood hammer, ice shard, avalanche, brick break.
SteelTypeNULL	Man I love Houndoom, i didn't used Infernape in my first Platinum walkthrough just for make a slot for this hell hound
Shiny Arceus	Awesome video!
Kudo 108	I think lickylicky is cute :3
Max Oakley	I feel sorry for mystic for making a team for a slowass torterra
Bryson Beran	Your a poopy head
Devon RoseRed	What are some Pokemon I could use instead of the Platinum exclusives, I don't have Platinum
D B	Piplup is the worst for platinum. Chimchar is the best. Turtwig is the middle. I prefer medicham over gallade.
Don Slaughter420	I love Gen 4
Galaxy-Eyes Garchomp	I knew this was s co-op between you and 4thgengamer.
JStan96	Wouldn't Return be a better option on Staraptor than Take Down? It's more powerful, has better accuracy, and doesn't do any recoil damage. Plus there's more than 1 Return TM in Platinum so you can teach it to Lickylicky as well.
The Solao	Take down is useless on staraptor U-Turn is wayyyy better
Patrick Kennedy	This is a very well balanced team I like it
Kevin Murphy	I like Torterra....
Mal muffin	What about porygon
SAA AZI	I felt like Luxray or Electivire would be better in the place of lickylicky. Specialy Electivire
Joshua Shark	Infernape is my favorite Sinnoh starter.
Michael Anzulavich	I feel like Floatzel or Milotic is a better option of a Gyarados
Tasty Treats	@00:10 2spoopy5me
David Larkin	My prediction: Torterra, Staraptor, Houndoom, Gyarados, Jynx, Lucario   Edit 1: Return is also a very viable option for Staraptor, nearly as powerful as Take Down, but without the huge recoil. Edit 2: Thank you for showing Lickylicky some love! Edit 3:  4 out of 6 right, not bad!
Catherine Whittaker	Why Take Down on Staraptor? Return outclasses it - higher power at max friendship, no recoil, better accuracy, and you're given 2 Return TMs for free (with additional ones purchaseable in Veilstone).
CormacThunderStar	I'd switch Take Down for Return on Staraptor
Sofia	Use a Quick Claw on Torterra, it really helps.
TheGamerBros	Hi
super gespierde femke!!	Hi mystic my team fore tortarra is torterra starrapter vlochle gelaite hhundoom and glgliseon.
Jayden Ross	Turtwig is my favorite starter.. :{
Bear 0601	My first team in Platinum Torterra  Garchomp Gardevoir  Magmortar Scizor Machamp  If you want to you can rate this team but looking back at it I think maybe Golduck or Floatzel could have been better than Gardevoir.
Can we get 500 subs With bad content ?	7:50. Lol. I thought 99% you guys would pick Floatzel.  Because he makes up for torterras speed.  Otherwise,  for me personally its design over viability.  So Gastrodon it is.  Its slow but has the Hp it also has Ground so  It was my strategy against Bertha because Hippowdowns Sp.Def is its weak spot.  Torterra being a physical attacker, Gastrodon led the way.  With Ground it also doesnt have any effect with sandstorm.  Overall Gastrodon is good but I can see why gyarados is here.  Heck, 5/6 of my Pearl team are from sinnoh.  With the exception of course being Rapidash, but even in Platinum Houndoom, Camerupt, Torkoal, and Magcargo aren't native to Sinnoh either.
Javier Ramos	Allright time for me to go home to unnova cus that's what is next.
G.M Twins	Love you and your vids
typhlosion 787	use return instead of take down on staraptor you can get it at the game corner
Spartan Sid	Man...I have to be honest with y’all!!!  I FUCKING HATE EMPOLEON!!!! IT IS IN FACT, THE WORST SINNOH STARTER AND THE SECOND TO WORST WATER STARTER OUT OF ALL THE WATER STARTERS (NEXT TO SAMUROTT OF COURSE)  I mean sure it’s dual typing of Water/Steel is amazing and all but that’s as far as it can get!!!!  Reasons: 1.) It’s HP, Attack, and Defense stats all suck due to it ranging at the 80s and it’s speed is at a stupid 60!  2.) This Ugly penguin is NEITHER a tank NOR a glass cannon! Yes it’s Special Attack and Special Defense is good, however it gets OUTCLASSED by Vaporeon with acid armor and Goodra with the abilities Gooey and Hydration!  3.) Also I know it suppose to be based off of Napoleon and an Emperor; However, I feel a penguin pulling off that look is terrible! MAYBE if a MOUNTAIN LION 🦁 were to pull of that look, I’d consider it okay on my book! (And I think y’all can agree a mountain lion is better than a stupid penguin)  4.) It does a SHITTY JOB in the Sinnoh type play through!!! Having to only take down no more than two gym battles!!!  5.) Finally when you take a good look at its move sets, 90% of it is mainly water and normal moves having access to only one flying type move and about two steel type moves!  So yeah those are my reasons why I FUCKING HATE EMPOLEON!!!   Go ahead and trash my response to Empoleon but I’m NOT SORRY for saying that!!!  #empoleonsucksdick
Juho Autio	Gyarados can't learn crunch in gen 4, so earthquake or toxic can be in the set
Ricardo Melo	Please do Black and White next!
Bary Sanchez	When is the hg and ss coming for typhlision
Koolad	NOICE MYSTIC
Grandark Zephyrum	People talking about Torterra sweeping Bertha makes me cringe, as I tried that and my Torterra got one-shot by her Whiscash and Gliscor.
Nick Cruz	Gyarados can't learn Crunch in Gen 4. I would replace it with either Taunt, Thunder Wave, or Stone Edge.
JordanLovesLizards	You made a little mistake with Gyarados. Gyarados can't learn Crunch in Gen 4, so you need to replace it with another move.
osha wott	3:38 mistake 1 the starter right there -__-
Ruben lGomez	Yeah boiiiiii!
Spectral	The Lack of music in the beginning was creeping me out and making me feel uncomfortable.
PsychicBlizzard	Finally
Mike Sal	My team for torterra is  Torterra Staraptor Floatzel Froslass Bastiodon Toxicroak
Zack Likes To Ramble	Gyarados doesnt learn Crunch in Gen 4, it only got it in ORAS, also why waste your Earthquake TM on Gallade when you can give it to Gyarados for coverage
ARCangel	Holy crap! I love lickilicki Thank you for putting it on the team
Liam Flanagan	not first
MrKidKeeb	Can you do Decidueye for Ultra sun and Ultra moon?
_Dak_	TAKE DOWN on staraptor? why not return? it's much better in power and accuracy, doesn't have recoil, and you can get it at the beginning of the game too  also, Gyarados doesn't get crunch in platinum, didn't learn crunch until ORAS, stupid i know
joinmarch76	Eh, I stand by what I said some time ago: Torterra speed is SUPPOSED to be slow. And given how it holds an entire mountain on its back, I don't blame it for being sluggish.
Tuxedo Banana	Man already under 60 comments?
Koala Fontnite	It's not that bad as a pokemon
PVSM1 6731	Gyarados couldn't learn Crunch by level up in Gen 4, so keep Bite on Gyarados.
Carlos Canal	Infernape edition?
RedNightCoreYT Undertale	Notification squad where ya at
BaconHairKing	FINALLLY BOII
Навала Земия	cant wait to try this team
Aspen Karch	Im surprised of Lickilicky being on this team
bxby. txna	First please pin this
The Champion of Morrowind	TORTERRA FTW
Canal do Torterra	Nice
UltraGingerCat1337	You forgot to add "ft. The4thGenGamer" btw Mystic.
The Barbarian Hunter	Why there is no background music????
danick00	Torterra is my favorite starter on sinnoh, but Infernape is definitelly better
Ceschar 4	I love Torterra this would be my team  1. Torterra 2. Staraptor 3. Magmortar 4. Garchomp 5. Glaceon  6. Floatzel
Muhammad Anus	Finally
BatvViki	Cool, TrueGreen7 will like this video
Happy Pidgey53	Who didn't use an army of Bibarel in Sinnoh? Like if you did;)
PrototypeXD001	Oh I’ve been waiting for this one
FTS x CARNAGE	Finally, my favourite starter from sinnoh is getting some love!
J'siah Thomas	Sanurott HYPE
FeelsGoldMan	First 50
Pika-Mickey-Chu	This Is My Asian Soulmate's Favorite Grass-Type Starter Pokémon, Along With Venusaur &  Decidueye!
AceTrainer Roel	Yeet gen 4 with my fav starter and best birb
wadejwjonesorg	I’ve been waiting all day for this
Joe McGill	Been waiting for this
loldis gaming	Mystic I remember u complaining about torterra sinnoh edition , u got so pissed on ur twitch stream at times
TheAkM07	Waited for this all day
Bogdan Lubura	Finally
no1arthurfan i also like anime and ladybubs	Tortilla the starter that taste good
iran lassninja	Torterra was my first platinum starter He soloed Bertha in my elite four challenge
The legend of the Gamer	Finally torterras my 2 favorite Pokémon  First
Lil’chico 8720	Hey peeps
Vinny Rey	Who's the best legendary in you guy's opinion?
Luca Filigenzi	First.
Vinh_ Cent	Torterra>PornHub.
Demon Reaper Gamer	First comment
the flaming charizard	First
Mohamed Abo elnasr	1st
Ash Pearce	First
HailedSpace25	You probably died inside while making this didn't you?
Stewie Griffin	you are the best poketuber
Jadyn Davis	Mystic was holding up on us
Anonymous Octopus	Woopy spooky I dunno
