Nicholas Walleston	I mean, this team is alright. You could also give torterra a quick claw like any sane person would and teach it curse to be a physical wall. Also lickylicky is more of a slight physical attacker than special attacker. So if ice beam is going to be the main ice move besides ice fang on gyrados, well good luck with the nuclear attacker garchomp. Also I played diamond recently, and I had no problem making a team up. It's not "impossible" to make a team for sinnoh around torterra, I had brongzong with levitate, toxicroak with dry skin, clefable, milotic, and some flying type. But it isn't impossible because of one gallade and houndoom.
Mr Pokemon master	You need to start a new draft league to celebrate lets go games in the draft league you could use only original 151 Pokemon it would be awesome
Roger Ly	Just copy off chuggaaconroy‘ steam and you will be gold
keller blair	When will the inferape team be out
Peterson Byrd	You should include the stat trainers.  Marley  Mira Buck Riley Cheryl
James	Level 60 Gyarados - dragon dance, waterfall, ice fang + another move of your choice. Holding leftovers.  I swept Cynthia's entire team with that.
King Ping Bell	Just use Drifblim as your flier because you can just use stockpile and minimize then baton pass in battle to win easily, and then obviously use fly for the hm.
Owaim Azam	You are the best
CrazyGamer 101	I dont really lime sinnoh games
Haziq saiman	Tbf it's better if you replace lickilicky with magnezone
Turtlelochy Gamez	Its meant to be slow cause its a tortoise ( yes im captain obvious ) and its carrying a mountain oncit back, think about the struggles of his everyday life ;-;
Vasisht Srinivasan	My torterra team was: Torterra Weavile Rapidash Drapion Golduck Staraptor
El Carlos	I'd sooner put garbodor in my team than that pink abomination
Vled Hoccain	use M I L O T I C instead
mohit kalasuwa	Please do serperior edition, gen 5
Dalton Roe	gyarados is the real mvp because it can destroy cynthia's entire team. the moveset should be waterfall, dragon dance, earthquake, and ice fang. set up when spiritomb is out and after 6 dragon dances you can destroy her team.
Kinta02	Presumably another episode of bad choices, falsehoods and misinformation so lets go
G 92	Torterra's actually my favourite Sinnoh starter Key is to run Curse a few times, he'll tank like mental Yeah speed's an issue but to paraphrase the anime - "You're dealing with a defensive type", hence why Paul's was a beast and Ash's... well... wasn't
Brian Patino	Everything is cool and all, but uno to beat the game, u need TMs like cut, rock climb and rock smash
Hugh Jazz Hole	Guys, don’t use Take Down for Staraptor. Use STAB Return instead. Trust me, your Staraptor will be OP once you max out it’s friendship with you.
Zac	how in the fuck do you choose delphox over torterra
cheezywiz2	2 normal
Prajwal Dhule	I used lickylicky in platinum befor, and its reallyyyy good
EmperorOfTigers	Would have been nice if you offered a DP replacement for Gallade like you did on the Empoleon video.
devin johnson	I want to use this mega altaria in my rom hack with pixelite BUT MAN staraptor makes it hard to let go as my flyer.  His attack surpasses it being an early pokemon which are usually weak or blah
TKCool TV - Gaming and More	YES FINALLY
Killer Kirby	Sweet! you showed some love to my boi Lickilicky!
Abel Munoz	turtwig is one of my all-time favorite starter
Random Pokégamer	I love torterra!
Rcs493	I've never actually used Lickylicky before... Can't wait to try it out!
Star Spangled Gaming	If you had made the original best sinnoh team with Infernape use platinum pokemon like you did for this video how would it be different?
Pokemon maniac 33 Hillarious	Yay!! I predicted gyrados
Guy with no subscribers	The turtwig line is ugly
Silver Nicktendo 64	I'm thinking of getting Platinum again and making a new team for Infernape. How does this team sound? Infernape Floatzel Roserade Bronzong Garchomp Either Luxray or Dusknoir
Elizabeth Ingalls	I do like this team. It's different. And I love Houndoom.  One thing... how come most of the sets are purely attacking sets? No Toxic, Thunder Wave, Confuse Ray, Leech Seed etc? Those moves are so much fun. Everyone has different playing styles though, so I can't really fault that too much.  For Houndoom, its Attack is decent, but I'd stick with more Special moves. He can learn Sludge Bomb and SOLARBEAM. The latter requires set-up, but it's still pretty cool. Iron Tail is just not very good on it; it's not a very good move in general, and I'd personally only use it for STAB in gen 4. Thunder Fang isn't really strong enough imo, although it's good for the middle of the journey.  Torterra is good. It's just a physical tank. It gets Curse too, a decent set-up move that complements its stats pretty well.  No Swords Dance on Gallade?! Are you serious? At least you gave Gyarados Dragon Dance.  Lickilicky is one of my least favourite gen 4 Pokémon, but I actually liked its inclusion here. I like seeing less popular Pokémon being used in teams.
Jaden Storm	Saw lickilicki...and shut it off. Dude come on...wtf.
ChingChongChing DokiDoki	Hey Mystic how about Best Teams for Pokemon Colosseum and XD gale of darkness?
LilJoeFromKokomo	That Platinum remake better be done on the Switch!! I’ll give Nintendo all my money at that point!
sea dragon	Heres my team  Infernape Starraptor Gardevoir  Gyarados Bibarel or lickylicky Giratina
Sarah Gorrie	**sobs** torterra is my favourite...
iBenjamin1000	Lickilicky suggestion-swords dance (game corner) + brick break earthquake and normal STAB. Can get power whip by level up. Give it explosion (by level up I think) for a great big chuckle. Fire/thunder punch by one of the tutors you get before e4. You  could put surf instead of swords dance since you already have an attack booster
Ronald Rhodes	My boy lickilicky FINALLY got some recognition. Thank you so much 😭😭🤩🤩
Yahkov thegreat	Move set for Staraptor is trash. Better one would be Brave Bird, Return, Close Combat, U turn   Personally I would run EQ (over bite) on Gyarados and Night Slash (over EQ) on Gallade.   Lickilicki is just an odd choice. I would go with something cool like a porygon Z or eevee-lution of choice.
Jimmy nunya	I've never played gen 4. Really hoping they did a remake
Matthew Roberts	Lickilicky! Hallelujah! I love it som much 😍😍😍
atharv pande	Why not stone edge instead of rock spide
Super Luck	Close combat on two different pokemon , Crunch / bite on two different pokemon, and two flying AND normal types. Not a very balanced team overall . Platinum has such a wide variety of pokemon to choose from and you have repeating types and moves on this team which is unnecessary. A better teams comp would be: Torterra, Starraptor, Gallade, Houndoom, Rotom, Vaporeon. Less repeating weaknesses and more Stab coverage
blackdragonwtf	Are you going to do best teams for black and white 1&2?
sam kul	Remove lickylicky and add THE PERENNIAL SLAVE Bibarel can learn most HMS and if you tank him a little  he can take some hits in clutch situations .Best sack mon period.
Marcus Vinicius de Alvarenga	My Gen 4 Team: 1.Torterra 2.Lucario 3.Staraptor 4.Glaceon 5.Rotom 6.Floatzel
I b	All these are abt is just based off of Type/Type Advantages.
Safeena Rafeeqe	I
metagross9092	My team would be: Torterra, Togetic, Lucario, Magmortar, Electivire/Magnezone, and Floatzel
Lunatic fringe	No personally No liki,Gallade and why so much Dark move, Pokemon
The Legend27's Toxic Mailman	Use weaville it gets ice punch in Platinum
ashwin ajit	Why take down on staraptor?? Ever heard of return?
Master Brad	My team for Torterra is Torterra, Gyarados, Garchomp, Electivire, Staraptor and Lucario.
Harold Burton	How's Torterra the worst? With Rock Slide, it takes care of all four of its weaknesses.
SvelterGraph	Amazing video's keep it up 👍
Torterra gamer 101	TORTERRA IS THE BEST FULLY EVOLVED STARTER EVER  😤
Jaypom	yall better put explosion on lickilicky or im done
Dino World	My Team: Torterra Floatzel Drifblim Houndoom Drapion Jolteon  Shit I should have waited for this. I aint gonna reset and relive that slow-ass tutorial.
Jacob Ruby	Help? When you have a Torterra on your side, there ain't no way you need extra help. ~~Except ice types/moves. Those can melt in hfil~~
Tarlander	My team was 1.Torterra 2.Togekiss 3.Froslass 4.Flareon 5.Raichu 6.Golduck
Seth Walton	How about roost? Or Defog for starraptor? Normal stab truly isn’t that useful since brave bird is simply better (all types normal sucks on flying sucks on)
SplatoonAndPokemonFan54	WAHEY! Somebody else is a Piplup fan!!!
Henry Louie	Torterra Staraptor Gyarados Rampardos Houndoom Weavile
The Austin	Do Infernape Please and Thank You:)
Chasing Fish	U said "Link" would be in the description below but I couldn't find him. #LegendofZelda
Matthew Tardaguila	Just a tip, if you plan on using Gyarados. I wouldn't want to have a lvl 5 Magikarp as baggage for the first 3 Gyms, instead I would wait until Hearthome City to get a lvl 15+ Magikarp (so that it could atleast get Tackle) with the Good Rod found in the next route. This would make getting it to a Gyarados easier, having it fight in double battles and giving it an Exp. Share from Eterna City. And like the amount of trainers to fight around Hearthome (along with the Vs. Seeker) would give it more than enough exp to evolve and learn Bite for Fantina's gym. I'm a Sinnoh fanatic so I hope this helps :))
Alfonso Payan	Fuck take down get RETURN 100+ power
Nick Vallie	3:39 you have the wrong team up
Gaming with Golems	Staraptor brave bird, takedown, roost and steel wing/toxic, I find it good
HezBolt Productions	My team was torterra, staraptor, gallade, floatzel, houndoom, and luxray in platinum
Matthew Hecht	Before my game crashed I also had Gyrados and Staraptor.
LFuture	Torterra is trash Torterra is trash Torterra is trash Torterra is trash Torterra is trash Torterra is trash Torterra is trash Torterra is trash Torterra is trash Torterra is trash Torterra is trash Torterra is trash Torterra is trash Torterra is trash Torterra is trash Torterra is trash Torterra is trash Torterra is trash Torterra is trash Torterra is trash Torterra is trash Torterra is trash Torterra is trash Torterra is trash
Steven Chen	Please make an Empoleon Edition. Since you already did it for Infernape. If you didn't know, Infernape and all beat the game easily. No others included.
Aries Hindman	my hall of fame team fir platinum is Torterra, Giratina, Lucario, Dusclops, Golduck, and Togetic
hbarudi	Suggestions: 1. on torterra, choose 1 of crunch or rock slide and for the last attack, choose worry seed. If they have levitate, use worry seed, then earthquake them on the next turn. 2. on staraptor, you can use giga impact (buyable tm) instead of take down and avoid recoil, and keep fly as the sole flying type damaging attack and use the next slot for defog hm. Close combat is a useful attack on this pokemon, but having gallade on your team can also let you consider another attack in this slot such as quick attack (always attack first), aerial ace (never miss), or agility (get more speed). Steel wing if you are ok with using single use tms on your pokemon. 3. Why leaf blade and earthquake on gallade since you have such type coverage on your starter? you can use x scissor for coverage on gallade which is a tm you can reobtain later in battle points. For the 4th attack, you can use slash, night slash, even false swipe to be able to catch pokemon and possibly hypnosis also for sleeping them and catching pokemon, but does not work if you used worry seed by your starter. 4. Houndoom, why physical attacks on him when the special attack is better than attack, instead do flamethrower, dark pulse, nasty plot, and sludge bomb or shadow ball. 5. Lickylicky or possibly just use Bibarel and give it the remaining hms you need. 6. For a water type, I don't like what magikarp evolves into. Pick another water type such as floatzel. Can teach it a water hm if you can't fit all your hms on the other pokemon such as bibarel. You can use waterfall on floatzel while bibarel can get surf, floatzel can learn ice fang and crunch, and you can give it the non buyable tm iron tail. After some analysis, it has come to be known that 2 types can hit the entire national dex including modern generations of pokemon either neutral damage or super effective. Those types are ghost and fighting, the same type as marshadow, this also applies to earlier generations since the 7th generation is the most type diverse generation and this condition still applies. But not for inversion battles in the newer games.
Deth Troy	my problem with torterra is not it's speed, but lack of grass options to back up it's great attack stat, it's special attack is a joke at 75, and there are only four grass moves to use with it's physical attack even to this day in gen 7,  and only one of those moves is gotten via level up Razor Leaf, the other moves are Wood Hammer (which requires a Heart Scale), Seed Bomb (Move Tutor), and Bullet Seed (which is only available in the gen 4 games as a TM), but why would you even bother with the last one, another problem is Platinum compared to D/P definitely makes things harder for this thing, since two gym leaders, Crasher Wake and Volkner have counter measures on their platinum teams to deal with it, when it should have an easy time taking on both.
Daniel Kean	Licki licki?   I'm fine with it but clefable is better
Koensko	Turtwig and torterra are my favourite starters so stfu😂
Chuck Pierce	I didn’t realize I was in such a minority, but Torterra is my favorite Sinnoh starter lol
Spedghetti Star	Speed speed speed. You know speed is NOT the most important stat. It doesn't define whether something is good or not. Ex. Magearna.
Johan Buis	Why would you use Iron Tail on Togekiss? Fairy type isn't a thing yet in gen IV
cool 23819	I actually like Torterra. I like its design. Also SPEED BOOSTING MOVES AND X SPEED PEOPLE!
Nathan Garcia	What about togepi, it can be a flyer
Tom The Boulder	Torterra is such a Cool Pokemon in both concept and Design,  But Opinions are Opinions so can't get to disappointed.
GreenE4	If I were to create a team with Torterra, this would be it: 1. Torterra 2. Staraptor 3. Electivire  4. Lucario 5. Milotic 6. Scizor
Awakeandalive1	I am completely indifferent to the Piplup line. I started out a hardcore Chimchar partisan, but then a Nuzlocke in which I let my ID# determine my starter got me to use Turtwig and gosh dang it if I don't love the little guy, for all his eventual weaknesses!
League of Anime	ty umbreon
89StevieC	3 best teams for sinnoh and no Luxray? I'm a little disappointed, really like that mon
Tejendra Chettri	Lol the way you say lickylicky is oddly satisfying and weird😂
BennyBoy46	Surfing the waters of Sinnoh on the back of a Lickilicky...  Majestic
DrMobianDoom	Don't worry Umbreon, Torterra is my least favorite starter too:)
Richard Lavariere	Leech Seed and Wood Hammer.
Jacob Lacey	FINALLY SOMEONE THAT LIKES LICKYLICKY!
Castrel Troy Madria	Where the other HM's that they can learn how do we complete the game then?
SpaceJam45	Land-Turtle... sir did you mean a TORTOISE!?
Y 7654321	9:55 kill me
Pedro Reis	Remake of the Infernape video baseade on Platinum would be terrific
Goompro Gameplay	I legit just started a new game of Diamond today and chose Turtwig. The coincidence lol.
Kaimana Lawrence	Way to keep cool mystic, and thanks for not burning, or icing  Torterra to hard (see what did there?).
Blong Blong Boi	I don’t agree with your opinion commit neck rope
Axel Kusanagi	Why does every starter need to be a sweeper? Sometimes you need a wall/tank.
Brandon Roberts	love these.
Jeffrey McMullens	you should teach lickilicky explosion that you can get in the veilstone city game corner you need to get to 10 bonus rounds in the clafairy game but if you can get it than use it on any pokemon and it will most likely go down it is just a good move to use if you are stuck on any part of the game and if you do not want to go thought the trouble than I still recommend it for other moves in the game corner like ice beam and thunderbolt.Also i recommend not wasting your money on coins because in my opinion sinnoh has the easiest game to get money
Infint	Aye, Mystic added Lickilicky, I don't understand why people hate it, it's one of my favourite normal type mons
EM11212	I'm playing Platinum for the first time right now. My team is  Torterra Staraptor Bibarel Luxray  Houndoom Bronzong (Heatproof)
Natalia Loureiro	Tortaras speed doesn't matter because defences are good 😊
blooddemon661	Do serperior next
Ur Boi	That’s a good team but I’d still make changes:  I’d rather teach Gallade Sword Dance over Eq. Why teach Gallade Eq when it has Close Combat and Psycho Cut? That coverage hits the exact same types except electric. It would be better to teach Eq to Gyarados so that it can beat the electric types that threaten it. Sword Dance in Gallade makes it insanely strong.  In place of Take Down, I’d give Staraptor Return. It’s better in every way. The only downside to it is that it depends on happiness/friendship so I’d wait before actually using the tm. I think you can check if happiness is maxed out by talking to the person in the house on the beach before Pastoria City. If it’s maxed then you will get a ribbon.  Not sure why you would even consider using Lickylicky. If you need a Surf user I recommend Vaporeon or Gastrodon. Then can also learn Ice Beam. They are both good since they are insanely bulky. Gastrodon might be the better choice because it has a better typing as it is part ground so its immune to electric. Plus it gets Recover at level 54.  To be honest, I’ve used Houndoom before in Platinum and I think that it’s pretty useless. Sure it beats Byron, Candice and Aaron, but so does Torterra, Staraptor and Gallade. The only reason you’re using it is for Lucian and in my experience Houndoom does badly against him. I find that it’s too slow and gets OHKOed by Focus Blast which every member of his team has. And even if he misses and you land a Dark Pulse, the damage isn’t that great and by the end of the turn you will be hoping that he misses the next Focus Blast. To replace it I would use Drapion. To be honest I’ve never actually used one in Platinum but I think that it would do better because it’s better for beating Lucian which is Houndoom’s only job. It has a better typing which leaves it with one weakness. It gets Crunch at level 49 and Toxic Spikes at level 28. But I don’t know how easy Skorupis are to find.  So if it were up to me the team would be:  Torterra - Earthquake, Woodhammer, Crunch/Curse, Rock Slide/Stone Edge/Curse  Staraptor - Brave Bird, Fly, Close Combat, Return/Quick Attack  Gyarados - Dragon Dance, Waterfall, Ice Fang, Earthquake   Gallade - Sword Dance, Psycho Cut, Close Combat, Leaf Blade  Gastrodon - Surf, Ice Beam, Recover, Toxic  Drapion - Toxic Spikes, Crunch and any 2 coverage moves of your choice.  Bibarel - Keep him as a Hm slave and swap him with Drapion when needed.
Benjix Bishop	One word: PORYGON-Z  Guys, he is unbeatable with hyper beam!
Duncan Donuts	A better Staraptor move set is Close combat, brave bird, return, U-turn (if u r playing on set)
Twiggy the Torterra	Well torterra is my favorite starter, and on top of that my favorite Pokémon
EagleBlue	Its LICKIlicky not LICKlicky You trigger my ocd every time you say it wrong
Jefferson Castro	My Platinum Team Torterra Staraptor  Houndoom Luxray Gallade  Floatzel
Gainsley Mc spice meat	Torterra is best if you disagree then you're entitled to your opinion
GD Joojmiguel	i swear the moveset you chose for staraptor was the one i used lol
Moises Gonzalez	My pokemon team for Torterra is Torterra  Staraptor  Magnezone Floatzel Frosslass  Garchamp.
Your Lord and Savior	Torterra is pure garbage. It’s grass typing is useless since if you go against a water type, it’ll obliterate you with an ice move. It’s use is literally only for facing rock / ground types, and for that purpose you’re better off going with a water type.
Tommy Marino	This will be my team: Torterra Mothim Glaceon Gastrodon Lopunny Togekiss
BlackStar	Instant like becuase its a team with torterra. Oh nvm u dont like him :c haha
char sage	I find it rather funny how he calls Torterra bad do to it's low stat speed there's pokemon in OU slower then Torterra or close to Torterra in speed.
TheJH1015	I'm SRing for a shiny Turtwig in platinum, and I'm planning on the following team, what do you think? - Torterra - Whiscash - Vespiquen - Drapion - Houndoom - Bronzong
Muhamad Karimo	Do a infernape
Neutral	I literally use Torterra every Sinnoh game, he's my favourite of the Sinnoh starters.
ShadowSamuel	I hope houndour will be available in gen 4 remakes. In Platinum I picked Chimchar, but in remake I plan to pick Turtwick.
Braeden. Inc	Wouldn’t return be better for Staraptor?
Nefarious Nektarios	Edit: *PICK UP A QUICK CLAW EARLY ON IN JUBILIFE CITY FOR TURTWIG* The team I most recently used: (3/4 times playing Platinum I've used Torterra, the 1/4 being Infernape) 1. Torterra 2. Staraptor 3. Vaporeon 4. Magmortar 5. Lucario 6. Electivire
Patrick Zieverink	Infernape (mach punch (lvl 14)/brick break (tm31 oreburgh gate after surf) , close Combat (lvl 36), flame wheel (lvl 21), punishment(lvl33 (move relearner)/swords dance)  Scizor ( X-scizzor (lvl 41), Iron head (lvl 53)/bullit punch(if technician), aerial ace (TM becomes a 90 move)), swords dance (lvl57) ) at route 210 (southern part at lvl 19-21 or northern at 27-29) or 215 (at 20-22)  Drapion (Poison fang (lvl 39) / Cross Poison (lvl 58), Crunch (lvl 49), Ice Fang (move relearner), Night Slash (lvl 38))  Can be caught in the swamp evolves at lvl 40 (use the look tower and see skorupi!)  Hippowdon (Ice Fang (move relearner), Yawn (lvl 13), Crunch (lvl 31), Earthquake(lvl 40)) Evolves at lvl 34. Found inside the cave at route 214 at lvl 22-23  Alakazam (Psychic (lvl 40), recover (lvl 30) , grass knot (TM 86) , SHOCKWAVE (TM route 215)) can be traided for a machop in orebourgh city  Gliscor (Aerial ace (TM, route 213), Roost (TM,  route 210 ), earthquake (TM), Sky Uppercut (level 45)) found at route 205 at lvl 16-18. Evolves when leveled up with razor fang held at night, which can be found at route 214  And some HM slaves. What do you think? Water coverage is low/absent but I do not think I need it due to ground coverage
James Maxx	My Platinum Team Torterra - Wood Hammer, Earthquake, Stone Edge, Crunch Houndoom - Flamethrower, Dark Pulse, Nasty Plot, SolarBeam Floatzel - Surf, Ice Beam, Crunch, Brick Break Staraptor - Fly, Return, Close Combat, U-turn Lucario - Aura Sphere, Dragon Pulse, Shadow Ball, Psychic Weavile - Ice Punch, Night Slash, Brick Break, Swords Dance
Neonlayers	Tbh it should have been let’s go clefairy instead of ever but ever is okay
Scott Bayley	I hope the unova videos don’t take long, I’ll be going through black and black 2 as my next Pokémon games. I’ve been planning potential teams and is curious to see what you’ll come up with!
Ivan Angeles	7:10 doesn’t Barry have Infernape?
Sayoroki	I was actually using a Torterra on my team before this came out and I want to share what my team is like and what I used to beat Platinum with.  Torterra: Miracle Seed  Wood Hammer Earthquake Curse Rock Slide  Luxray: Magnet  Thunder Fang Thunderbolt Crunch Iron Tail  Togekiss: Sky Plate  Aura Sphere Air Slash Fly Water Pulse  Vapeoreon: Mystic Water  Surf Ice Beam Shadow Ball  Toxic  Houndoom: Dread Plate  Flamethrower Dark Pulse Thunder Fang Sludge Bomb  Lucario: Fist Plate  Aura Sphere Flash Cannon Earthquake Ice Punch   That's the team I used. What do you think?
georgegeorgex	You almost made Torterra's half screen time spent being crossed out by a big red X. You don't like it we get it, but It's a funny subtle message... so gj.
Smack Jack	I’m happy you’ve shown Lickilicky some love by putting it on a team. Slurpee (my nickname for it) is an amazing Pokémon.
Trey Morrison	Torterra, Staraptor, Gallade, and Houndoom are excellent choices. Personally I would be using Vaporeon instead of Gyarados. Also, I would add either Froslass or Weavile. Ice is so underrated
The_Great_Rasputin	To be honest, Medicham is decent replacement for Gallade in Diamond and Pearl. It doesn't get a good physical Psychic STAB, but it's still pretty powerful with moves like Force Palm, Drain Punch, Rock Slide, and Psychic is a decent move on it.
John Lizzio	Again, why is there no garchomp?!?!?!?!
shadowedpast	Why leaf blade on Gallade? As opposed to coverage like night slash or pne of the elemental punches?
Juan Sebastian Florez Buitrago	Why do you put in narrys team the team he will have if you chosse empoleon with torterra
Dragonmist19X	"The Houndour family is one most underappreciated in the franchise" Yeah cause so many families got megas.
Jace Beckner	Why do you hate Torterra??
Gerjan De Zeeuw	I don't get how anyone can hate torterra, it is literaly a moving f*cking mountain ready to stomp your ass
Dragon Quest	My torterra team: Torterra Luxray Staraptor Machamp Vaporeon Drapion
Deadend36	Feels awful man. My favourite pokemon is Torterra
pwrsurg35	I personally like torterra. Its my favorite grass starter because of its typing. I usually dont like grass starters. It really does get very good moveset variety which is cool. Its main downside is the speed, but it doesnt bother me because I can put other pkmn on the team to cover that need.
Science Is Ma Thing	Why do you hate torterra?
BradPlaysGames	LICK-ee-LICK-ee the way you say lickilicky's name makes me really uncomfortable I can hear the spit in your mouth so stop it
Adrián Avila	And where can I get a licky licky or Lickitung??
