Daniel Rodriguez	Why doe lewis almost sound sad to win the championship 😂
El Emperador92 Vloks Vloks	go through my channel you will find video about the grand prix event of mexico 2018 you will like
TachyonKing	REMEMBER INDEPENDENCE DAY LEWIS REMEMBER WHEN I PUNCHED THAT ALIEN AND SAID “ WELCOME TO EARTH ” IT ’ S JUST LIKE I TAUGHT YOU LEWIS YOU BEAT THE GRAND PRIX JUST LIKE I BEAT THAT FUCKING GREEN ASS ALIEN MOTHERFUCKER
kaleab amare	I wanted to hear stoffel he finished 8
Euan Findlay	Hartley What a bunch of amateur Oh the irony
FusDy	jivanatzi is idiot
Skyrocket888	HARTLEY need to fuck off back to F3 the cocky prick
DESTROYER67732	Your telling me lewis won the bloodys f1 world championship and he sound like he reading a school textboook
Elia Waeber	Sorry guy but this is f1 Just poor guy complaining about some sh t ooh he drive in the middle of line oooh Amateurs wheres the f ckin racing
harry sivri	It isn ’ t racing if you ’ re told to slow down Wtf
Shivam Vaid	That wa kind of an insult to alonso when he said it s quite unusual but you are p1
A. A.	Thats how you cringe baby
Adam Brough	Hartly bunch of fucking amateur How can he call anyone an amateur
Don't light your own cigarettes.	So many child who didn ’ t get the Bad Boys reference Also y ’ all mad a big star isn ’ t your friend or what He wa congratulating Lewis for winning the championship lmao
Obito Uchiha	Hartley calling people amatures lol
Foley48	For a guy who just won the world championship he doesnt even sound that happy Probably sulking about not winning the race
everyday life	Could ve said something better for his 5th title
j4ck	I m actually going to miss Alonso he s an absolutely amazing driver with arguably the best race craft on the grid he ll always be in our F1 heart
Santhosh Prabhu	Who else find Hamilton annoying
Mr. Sparkly Pants	Man Fernando sounded very sad
Matteo Moretti	Come si fa a dire a un pilota di rallentare perche fa il miglior tempo dio can è per questo che vanno tutti a vedere la moto gp
Максим Худяков	Why they always say “ Copy that ” “ I save it ” What doe it mean
ericsbuds	I had a feeling Daniel s car wa gon na break down Wish it hadn t
Péter Nagy-Miklós	The background music is unusually good here Most of the time I find no joy in F1 video background track in this channel to be fair
wouter haaksma	MAX VERSTAPPEN
KurkkuMopo	You realy take Will smith voice over to this Cring Dddddd
Phillip Muchiri	Brendon Hartley calling other driver Amateurs is the funniest thing I ve heard today Will Smith clearly did not watch Verstappen s drive no wonder the guy he taught how to drive wa 4 second from being lapped
Me Me	Glory thief that s or will smith is he still think he is the prince of bell end I mean bell air
The Gamers Channel	Daniel Riccardo did a great job I m saying a an Australian
Sailing Channel Marinus	http youtu be addme pbk3FJ YjPAkN5UJyhEjONgZ0Q7HjQ
干し芋	What is P 0 P 1
Owen Simpson	Will Smith is a great guy but let s be honest he doesn t have a fucking clue about F1
Chang Freddy	Now I hate Will
Patrick Nancanha Seidi	Max going too fast again 😂😂😂
wert freund	What the f ck happened to Ricciardos Renault engine I want Charly Whiting to investigate on data Secondly where is Ocon driving F1 next year it got to be in F1 s Liberty s and Chase Careys natural interest to keep such an excellent driver in the series who outrode his teammate Perez A L L SEASON although Perez hounded him badly several time without any real consequence Is that the message F1 want s to send out to all the Young viewer drive fair and ambicious and get kicked out of the sereies cause the guy who drove unfair to You teammate most of the time kept his seat really
ZER0 DR	Just turn it down please Max please
Power Plant Zone	Just like I taught you Taught him what How to work a Instagram account smh
BlastForward	Purple is nice 😄
Jeremiah Jarrett	Will Smith wa crazy plus Lewis never swears have you noticed that
Mister Xav	Nice
Edski F1	Go away will smith
Schwar tz_	Will smith lol
ZAIN worldwide	http www youtube com channel UC9TTo5lSdvuspGG3INhFEEA
RRoJ	Man Alonso don t deserve to leave F1 like that
Amin Hafdaoui	Fernando wa cry
JM	Liberty Media ha such a hard on for celebrity Europeans don t go that mad for celebs thats why we don t have half time show during football match
Charles HD	I hope that Vettel win the championchip in the next year
shivam chaudhary	Lol Hartly calling other driver amateur theb what s he
Vectro666	This is officialy the most anticlimatic championship in the history of F1 with LM trying to be funny at the cost of emotion and pure reaction Why the cringy team radio This isnt a fucking kid show Grow up LM and give u what we want
Martin Horvatić	So arrogant from Hartley
Hauptsache Puls	Every Mercedes official and Hamilton himself did not sound happy like they should in a title winning moment One bad race stand out more than a title Just impressive Ferrari and Red Bull should be aware for next season
BrettJones27	What the hell is Will Smith doing here FFS A down vote just for the shameless pointless insertion of a hollywood star when he ha nothing to do with the race or hamilton s success Just utter crap
Kyle Parkins	You can hear the sorrow in both Alonso and his engineer ’ s voice when he is told to stop the car
A or Ta	The race where Lewis almost got lap d by Verstappen
Nico RosbergFan	I wonder why they didn t pit Fernando
Κωνσταντινος Μωραιτης	Woaaa Wait a minute Did Hartley just say what a fucking bunch of amateur Hartley 😂😂😂😂😂😂😂😂😂
That Dude Over There	Hartley calling people amateur Yikes
Shravan Pammi	Hartley Givonazi is an idiot Engineer copy that😂 Hartleys engineer is my favourite of all team engineer
Jones	i love Best Of Team Radio
The Old Fart	Come guy you missed some Epic radio Ok that s a decent cushion so let s match lap time with the car behind Was that ok Yeah Hamilton lap time 21 8 What wa i doing 21 6 how doe it feel slow
nes suno	Ruined by you American Liberty Media clown with that 1 race old Will Smith recording PROMOTE TRUE FANS AND FUTURE RACERS not these hollow and shallow VIPs
M3nt2 R3pr3z3nt	That s how you supposed to drive to a man coming in fourth xD Verstappenn is a beast MORE forzakubica
Flamecrest	That s how you do it baby Just like I taught you Will Smith never professionally driven a race car to Lewis Hamilton 5 time F1 World Champion Cringy a fuck
JC Whats	I like that American sauce over the Formula 1 just like everything they take what isn t there s and put that F ck yeah USA USA USA over it stupid fresh prince and so on
H.I 21	Please upload in 4K
Kaito	engineer will always say copy that
Logan11thMEU	thats a real shame what happened to Daniel
GroundInactiv XD HACKED	people are saying that Will Smith made a reference to the Bad Boys movie but why in a Mexican GP where Lewis got 5th place
Lontong Gaming	So wE aRe P1 pUrpLe iN eVeRy SecToR
Pixels DXL	Hartley said a bunch of ameteurs but he is also an ameteur😂
Matěj Macák	1 50 feel so bad for Ricciardo
Ameer Qayyum	no one care about max
Vadim Kropotin	nice music
Nihar Bendre	Hartley calling the guybin front an Amateur 😂 GG
Daniel Matthiesen	Love listening to Hartley getting fired up
deathmetalshredify	I understand having Will Smith a a backup for the sport is advertising it What he said wa incredibly cringy though
Adam Janik	slow down max Nice to see how f1 turned over last few year From being fastest on the track to being most effective with tire and fuel Just put diesel in it those have some nice MPGs
Unpanda Rouge	Lewis doesn ’ t heard Will Smith anytime
Santo72	Alonso P1 wot
THE NOTORIUS SAL	Hartley is ridicolus
Raiez njr	Daniel can t wait to get out of that Redbull once and for all
凌漪公主	hat也好意思说别人新手
Erik Vernarský	hartley talking about amateur which are better than him D
slavmart	Lewis this is Will
Sparkie raven	Just hearing Ricciardo about to cry 😡😡🤬🤬😭😭😢😢
Doodlebug YT	Great job Lewis Your now considered one of the great I like Sebastian but still amazing job on being a 5 time world champion 🏆🏆🏆🇬🇧🇬🇧🇬🇧
jianh1989	Dear Liberty that thing with Will Smith stop it
moddok	im so sorry for daniel
cocabeer	That Will Smith thing wa aweful Just like I taught you Is this guy nut And Lewis drove like shit last Sunday so it s double messed up
Jenny Gavin-Wear	Never heard Lewis sounding so tired after a race
Jack Bauer	GTFO with celebrity pre recorded message No one buy the bullshit that it s live and that they actually love the sport
Alexander King	Hartley to stay in Toro Rosso please
Thomas Ning	So doe anyone know why alonso had to retire the car
Aykut	Did Lewis not know it wa Will Smith or wa he just not thrilled for being P4 why no reply
WiseGuy02	The message from Will Smith wa the most cringeworthy thing I ve heard over the radio
Gustavo Santos da Silva	Ahhhh those where some great battle Michae Schumacher Mika Hakkinen and Will Smith Best driver of a generation
GloomGaiGar	Hartley going full savage Meanwhile Gasly start from P20 finish P10
mini696	Who thought it wa a good idea to get Will Smith on the mic
Roland Lee	Soo Will Smith taught Lewis how to drive And he is supposed to finish 4th wtf pure cringe
Sofyan Nanda Fahrurrozi	P1 purple in every sector 🤣🤣
kickinbackinOC	Will Smith Pure shmaltz Lewis is a hero to me maybe the only one I have But Will Smith is nothing to me sucked to hear his voice just then Like Will had a shred to do with anything
potato911	Alonso and Ricciardo two of the better driver that don t deserve what s coming to them
General Almirante Presidente Aladeen	Hartley saying amateur that s funny
Mao A	I m a Will Smith fan but ugh that wa embarrassing It seemed so out of place
pritam cv12	It would have been really nice if Lewis Hamilton had mentioned Ron Dennis atleast in some part of his speech He and his father worked tremendously for their dream But Ron Dennis deserves atleast a thanks for his company s funding
george langan	No wonder Riccardo s leaving Red Bull It won t even be a downgrade if his car manages to actually finish a fucking race
Adam A	Wtf with the will smith message Why Soo annoying and embarassing Does he need air time that badly Argh I m offended
Armchair Racer	Will Smith 5 time world champion driver coach apparently
BigBoyMcEvoy	stop hating on will smith lol
Nicholas David Hutabarat	WILL SMITH CHEQUERED FLAG
Jorge González	Will “ cringe ” Smith
Matheus Pereira	Man Max is an incredible driver Too bad that he s in the wrong team This boy have a brilliant future in F1
Sebastien Tuscano	hartley message lmfao
Imran Nadal_ CR7_Khyber Pakhtunkhwa	some stupid people are copying each other by saying will smith sounded cringy not at all i loved it i think they dont undertand afro american humour
Robert M	People saying that the Will Smith pre recorded message telling Lewis he taught him how to drive is acceptable because it s a movie reference are being ridiculous What next At the end of Will Smith s next movie we get 30 second of random footage of Lewis Hamilton driving That s the level of irrelevance we re talking about here
nismo007	WIll Smith giving driving advice is like him giving marriage advice OH WAIT
Antonio Gallagher	Ricciardo Alonso Hartley cursed
DugBingo951	Really calm radio message
Oyi 87	Will Smith ha no business doing that radio comment He ruined the moment
Santi BD	missing a radio team boah better than 4th position
Suresh Kumar	I m wondering where would Hamilton be without Will Smith He taught Hamilton everything What a DOUCHEBAG
Zlatan ibrahimović	At first i thought it wa jeff gordon that wa talking to lewis because jeff wa a special guest at the mercedes garage I thought to myself while the radio message wa played daamn jeff gordon must be a hardcore lewis hamilton fanboy because he want to sound like a black man so bad hahaha
beetle juice	Hartley is one annoying cry baby
Just Simon	Poor Alonso sad to see him leave the race right at the start
Hugo Seelen	2 19 That wa purple in sector 2 and 3
Carlitox b	2 17 my new favorite driver hahaha thats how a champion think
Ethan Roberts	That wa Will Smith ’ s voice
JJ4824	Angry Aussies and Saddened Spaniards
Erik Coronel	Ricciardo 😣
SilverRonald	Which team doe this Will Smith drive for
Ivan Plis	Raikkonen wa napping all race long how the fuck did he finished on the podium Typical Kimi race weekend
james manson	29 comment down to find any mention of the WDC You guy salty a fuck 😂
Andy Lee	Max s engineer pleading for him to slow down Classic
DaylightDigital	Bad Boys
tarksable	Just because Will Smith is a gun at F1 2011 and the two time champion give him no reason to say that
David Pyles	Um Will Smith wa the Worst of Team Radio So silly and contrived
yz249	Hamilton nearly get lapped Will NoW tHaTs hOw yOu DrIvE
Ryan Fong	alonso cant give a shit at this point
Insane Racer	It s funny how they tell Ricciardo and Alonso how to go to P0 when they have so much experience doing it I feel sorry for them both
William Stephens	Who wa Max s fellow dutchy on the podium
GhaV jGRite (jeaHAvee)	I know you don t hear this very often so we are P1 purple and every sector
SennaRossiFan46	You have to feel sorry for that poor guy Ricciardo
Rude Boi	Liberty F1 fan do not care for celebrity it is cringey
Justice Warrior	Ohhhh yes Will Smith really taught Hamilton how to drive What a joke Cringe level is insane Why doe Will still speak Wakandian when it doesn t make any sense and it s stupid
Luke Wallace	Hearing Danny like that wa gut wrenching I really do feel for the guy
PhantomUniform0	Great race also whats the music in this
AlectriczOfficial	Brendon Hartley is getting furious about amateur but he is still one of them It s his first season so he offended himself hmm
ramesh anand	Ok Mercedes the YouTube comment have spoken Keep will smith off team radio
Subi_fan	That Will Smith part wa pure cringe
Zaac Spencer	What race wa will watching
allawee1991	Looks like Will Smith doesn t know shit about the sport That s wa one of Hamilton s worst GP
Adam Advocaat	Well I guess we can all agree that Will Smith isn t a racing driver Probably better off just getting jiggy wit it
Casper Due Hansen	Disappointed with this one Where wa all the Hamilton cry About losing a second a lap been given the wrong tyre and what not 😂
Elroy lobo	Hamilton not a worthy Champ great wat he ha achieved but dude come on your team mate ha to slow down twice in one race Instead you driving Give Toto to drive and you claim the point F £in joke
Ricardo Bespalhuk	Leave Max alone He just want have the taste of having a great engine and going purple in all sector
thebanhammer1	Will Smith wa cringe a hell Get it through your skull Liberty nobody wanted it
ER BE	XDD ’
Fr35HPR1NC3	8 DNF for Daniel this year and almost all due to mechanical failure Get away from that toxic team and get to one who isnt going to sabbotage your chance Makes me sick Redbull always seem to give him the le reliable car in 2018
Mister Conan	1 15 wa Alonso cry
Hugo Stiglitz	Will Smith is such an annoying cunt
Khin David	I feel for daniel riccardo The guy just cant catch a break
DJ AidonYG	What happened to Fernando
Rasta Man	Me Hi 2 33 Ok
Mansch007	Who s that Smith guy Never seen him in any competitive racing
Denis Kudlik	That Will Smith fake radio message is among the top 5 worst thing my ear have ever been exposed to
Mickaël Dorvidal	Hartley Bunch of amateur Engineer look at Franz Tost rolling his eye
Martijn Vv	Team radio s are now recorded in a bathroom
Simon der Weduwen	Wait should we rewind a bit Alonso ” I did Some donut practice for next year ” 😂😂
VANITY80	Jesus Will Smith is so cringeworthy 😷
my name	Why all the censored message Fuckin idiot
Kevin Papenburg	This weekend had everything Happiness relief but also salt arrogance cringe heartbreak frustration Really enjoyed it Did I mention cringe
pls team	an almost lapped car just got 4th
Pedro Silva	Next year im cheering for Vettel just to hear the message recorded by David Hasselhoff
Benjamin Puljak	hartley calling others amatuers lmao
Psyclone The Seahawk	Brendon Hartley calling people amateur Yeeeaaaaah
MUZZAMMIL BOLTMAN	Apparently Will Smith taught Lewis how to coaster an F1 car till the end
machine bomb	will cringe shit smith
BWOAH	That s how you supposed to drive So you re supposed to finish in P4 78 second off the lead Interesting
Schadows77	Silly Verstappen he should know by now a F1 is not meant to make purple sector and attacking It s made so you can look after your tire look after your engine look after your gas consumption all while making sure you re not surprised by those guy running in F1 5 on the same track a you
Harold2018	Im confused when Dan wa out Max wa saying on the radio turn down the engine so why is he doing purple sector on lap 65
Ali Aljoubory	How come I didn t hear Hamilton s team radio at the end of the race I just heard Will Smith
Manuel alaminos dominguez	Heart breaking listening to Alonso and Ricciardo They were both sould broken
Pratyush Kamboj	You didn t often see the engineer swearing
Karpia	0 25 xDDDDDDDDDD
MIAthe305	Lol take it easy Hartley you ’ re gone in 3 race so how about you serve yourself a slice of humble pie
Alen Ozim	Hartley is talking about amateur but he is an amateur lol
Andrew Small	The cheesy American style will smith audio wa awful STFU
Миша Сушков	1 18 SO SAAAADDD
Nikhil Menon	It would have been great to hear someone from Lewis family congratulate him on the title at the chequered flag Instead will smith Cringe
Baran Yavuz	Respect Lewis
MrSgtScotti	Will Smith need a off switch
SuperMechguy	Red Bull messing with Ricc
Savannah M3	Damn I didn t know Will Smith wa a world champion and taught Lewis That s the perfect idea for a documentary about Lewis Sitting in a class while Will Smith is teaching him how to drive
Mik Davies	I could not see the point of the Will Smith voice over totally unnecessary totally cringeworthy typical American must get involved at all cost rhetoric
denmark39	I hate celebrity
Liam Savinainen	1st time alonso doesnt get mad over p 0
Cp Gautam	pretty sure ric is screaming just a loudly a in quali after the race
kbst84	In 25 year of watching F1 there are only two driver I would consider myself a real fan of Senna and for whatever reason Brendon Hartley I want him to stay so badly in F1 And I m not from New Zealand not even close
Duckingtanker	Hartley talking a lot about people with confirmed seat next year
Grin Wakiin	What is P 1 then P0
The Marauder	Why didn t they just pit Alonso and remove the carbon from Ocon s car instead or retiring Also Hartley really man you re also a rookie Just because you got a seat with Toro Rosso it doesn t make you hot shit on the track a you re mediocre at best
tommobeast2	Hang on a minute when did Will Smith ever teach Lewis Hamilton to drive
Simracingnoob	What wa that echo on some of the radio message
Max 33	1 ham 2 verstappen 3 alonso 4 ricciardo 5 vettel 6 Leclerc 7 ocon 8 hulkenberg 9 perez 10 gasly 11 Sainz 12 bottas 13 grosjean 14 kimi 15 Mag 16 Hartley 17 Ericsson 18 stroll 19 sirotkin 20 Van Thoughts
AVP •	Will Smith wasn t even part of the race the most stupid radio message F1
Lucky Luke	Vettel should hire Will Smith to coach him how to drive
Sharmik Thakar	C R I N G E S M I T H
TheFikri136	I know Will Smith spoke in radio But his name in 3 07 Honestly wtf is going on
michael williams	Ricciardo having terrible luck along with alonso lately cant get passed the 1st lap without someone crashing into him or hitting debris
Mr Rayquaza boi	What is the background music
blackAngel	That s how you supposed to drive 15 second from being lapped xD But I agree so maybe next year Vettel get the Title We don t need it but it s nice It is indeed Now to more serious stuff What happened to Alonso wa there still a bit of wing stuck in a crucial place And Ricciardo Engine failure
Cbr 3	see thumbnail dislike
Andika Tansir	Vettel In 2017 Mamma mia 2018 Well done
Teoxx	3 22 to skip Will Smith s message
KleiberFan	Complaining about Will Smith cringe is not a substitute for a meaningful contribution to the comment section
Mauricio Bastazini	Please dont let celebrity who dont understand shit about the sport speak on the radio Now we gon na have to listen to fucking Will Smith every time we rewatch lewis being 5 time world champion thats how you drive probably Lewis worst race this season
Elliott Wardle	That ’ s how you supposed to drive to p4 and 60 second off the lead 😂😂
Joe Molineaux	Lewis is boring af
Βασίλης Δημούσης	Hartley talk about amateur What a joke
Lyionis	This race wa really similar to the race in 2017 Max win after great start and is slowed down by the team at the end Ricciardo after good race retire with car problem Hamilton ha problem during almost whole race and win championship arriving at further place
Angga Pratama	the HungarianGP curse ha been broken
Pedro Delgado	2 Things A Where Is The Radio Of Sainz s Car Issue B Is Brendon Hartley Getting Fired From F1 And Moving To Indycar Next Year I Want Artem Markelov With A Seat In F1
Kandarp Vyas	Well background music is just dope Anyone know it please reply
Craig Hamilton	5 TIME WORLD CHAMP Congrats my brother Woo
TheIVY321	Really glad you had the exchange between Lewis and Bono the Will Smith attempt at comedy wa completely out of place
El Chaval Duro	Will Smith is starting to piss a lot of people off The older he get the nuttier he becomes Motherfucking nigga say thats how you drive If Lewis drove like that the whole season he d be below even Verstappen in the driver standing
capitao rex	Poor Riccardo
alessandro lagi	Hartley ha to be penalized that it ’ s not the language that he can use to talk about Giovinazzi
Matías Tadeo Rossi	What doe p1 and p0 mean in these context
Lucas Gomes,Tamba	WILL SMITH
Tongankakarot 66	Fuck red bull
Klenex	why is brendon hartley calling giovanazzi amateur so is he
RED Productions	I don ’ t know why you guy callin will smith cringy it ’ s a bad boy reference he a baller regardless he can say what he want 🤪
Jens Plöntzke	Ricciardo ‘ s race engineer wa so unenthusiastic about P1 in Qualifying because he knew his car wouldn ‘ t make the entire distance anyway So sad though
Maketsu	Just here to tell that the pre recorded Will Smith radio message wa one of the cringiest thing ever The post race interview come close though Come on Liberty You re trying way too hard
D R	obviously RBR test some part on ric car same wa with webber 2013 when vettel broke all record we are not blind and stupid
Carpy Fernandes	Will smith wtf is he thinking
Sergi Monserrat Mascaró	Hartley bunch of amateur The irony
FRFM00	Hey Daniel it hard to win race without having a safety car and fresh tyre eh yeh get it girl get it get it fckin loser you couldn t even beat Wickens
mufc gamer	Hartley very angry atm sign that he know he been given boot
Timi Akinlonu	Ricciardo sounded like he wa gon na cry Man I can feel the pain he s going through
Kevin Parks	Poor poor Daniel I would be so fucking mad at my team
Rob Finney	Will Smith pre recorded message C mon Liberty What the hell That wa about the stupidest thing you could have done
Rocco Cingolani	Biased championship 5 race with an irregular solution for Mercedes
I Don't Know	A random question but what ’ s a pre start
Csaba H.	HAM wa great this year but will smith wa a joke a prerecorded crap Just how I taught you dumbass
Zoa Khiangte	There ’ s a conspiracy against Daniel Eighth DNF of the season It ’ s a fucking joke
pc_da_ one_84	Hartley bunch of amateur Ricciardo No u
Wole Oyeyele	Is it me or the reliability of the RB14 s engine are Red Bull s fault I mean I know they re Renault engine but Renault and McLaren almost never have the issue that Red Bull is having The engine of the Renault and McLaren seem pretty damn solid and never blow up like on Ricciardo s car and never behaves in such a weird manner like on Verstappen s car I think that s no coincidence and Red Bull push the engine to destruction and want to extract every drop of performance without giving a damn about reliability That s not how to use an engine IMO if they treat the Honda engine the same way it s going to be just a unreliable
M Q	wwg1wga
Billy Bollox	YAWN
OdySey PyRo	You don ’ t simply tell Verstappen to slow down
Ночной Позор	Alonso s breath say everything
Sir_Flankalot	I honestly feel soooooooo freakin bad for Alonso man that guy is just in the eye of a storm right now everything is looking okay and all of a sudden boom either engine either another driver cough cough Stroll in USA or some other thing Next year without him will be so strange
AMG	On what Verstappen said he is a proper racing driver
tycoon	I hit the front wing from ocOn D D fernando s killing me with his accent everytime
Daniel G.	So ocon wa able to pit on lap 1 for front wing damage why wasn ’ t Alonso allowed
Shoxy	Last season when Max wa having all the issue Ricciardo said maybe he s too hard on his car and everyone jumped on Max for it Why is nobody saying that maybe Daniel is too hard on his car this year Because it wa taken a the reason when Max wa doing all the retiring
Han Solo	Thank you Liberty Media for putting on Will Smith Trying to make F1 more American That Will Smith thing wa so disrespectfull to Lewis and also to F1 in general Why put Will Smith on the radio Man o man Why And also what an arrogant and disrespectfull cunt Will Smith is It is a shame for F1 that this happened Never do this again
Nicolai Kystaubayev	0 32 v 1 48
all_is_bball	Lap 61 so sad
coaster323	ironic how hartley is calling amateur to other driver
Atje	Will Smith That s NOT how you supposed to drive
Blaise Hope	Driver of the day go to Will Smith
HojozVideos	Ricciardo s reaction on Sunday sum up mine
TTTMusic	Whats up with the mercedes radio sound They talking in a tin can
