bebop hunter	It's the 9th album please!
Alwyn Nienaber	Where's the BLEH!? :(
Sabertooth	Parkway Drive and Ice Nine Kills: "we've got the best metal record this year"  Architects: "hold my beer..."
Lev Kushnarev	What an amazing track! As fellow human beings and architects fans, I would like to ask you to help out the victims of the Pittsburgh tragedy. I created a GoFundMe, please consider making a donation. https://dm2.gofund.me/supporting-tree-of-life-community
Nic Carter	So much emotion in this.Its quite hard to find other songs like this these days.
Oreo Penguin	Does no one realize how hard it is and how much talent goes behind screaming AND screaming on key for a melody? Not many bands do that. Keep it up guys
Captain Gwen	Goog song but always the same song
THRASHCA	OMG very very very nice song
Jordan Payne	Whats weird to me is that they havent stopped being emo. I mean, I know why but it must be hard to takeyourselves seriously when youre being that dramatic. Kudos to them
Bruceski	I instantly clicked this video because he looked like Zefrank1 in the throws of passion in the thumbnail. Not disappointed
Arkansas Backyardsmen	Fuck! This sounds like a song that would be on daybreaker or lost forever lost together even. So fucking sick!
iAndroid	forgot i was subbed to epitaph
Mohamad Roslaily	This is impossible to sing. 😭😭
Dorian Arcia	So...I just want to let you all know that this album is going to sweep modern metalcore off it's feet, okay? Like it'll just blow everything out of the water, alright? Just letting y'all know. Holy HELL this is gonna be great.
ItsAvalxnche	A perfect mix between AOGHAU and LT//LF in terms of production and songwriting.  I can't wait for this album already
Aleksandr Sidachev	As always, It's a gorgeous work.
Konstantin Staroverov	My opinion is somewhat unpopular here, but I don’t really like any of the new songs. They all sound boring and bland. I do love every album from hollow crown to AOGHAU though.
Artur Shapel	Самая лучшая рок группа,  каждая песня несёт в себе глубокий смысл!!!
Charlie Jorgensen	Tom lives on.... Much more his sound in this song.... It's beautiful.... architects make you feel emotion better then anyone else in my opinion
Dylan Hardy	Think it should be "all the devils are here, singing us their lords prayer" seems more fitting for this shit tip world being torn apart be religion
Qi Ub	Give it to me !! Give me this album #.#
Michele La Spina	0:22 Finally we get the chance to hear the bass !
Nicola m	1:45 is ridiculous.
Norman Rocher	AWESOME. want dat BLEH at 3:19pls 😎🤘
Sammy_Irish	Soooo moist right now
Jason Barry	I don't expect it, especially since you guys have done more than most, but a video for every song on this album would be next level if that's the trend you're going for.
RextheRebel	So glad I heard Doomsday so I could find so much more by these guys. Great stuff.
chace lee	*B* *L* *E* *G* *H*
Alex's World	Parkway drive: we're the best hard band on the scene! Architects: hold our bleghs.... This is gonna take a while...
Daniel Meza	Fuck I got into these guys so late!!! I missed out on so many great tunes!!! Better late than never 🤘🏼🤘🏼🤘🏼
Paul Krischke	Got some hollow crown vibes here. Very nice!!!
Pz Blue	the boys are mental
Steph Ashton Van Niekerk	I love how they've stayed architects throughout all these years.
darwin kartiko	fuct voice
John Reznik	Anyone know what song it  sounds like from 1:17 to 1:21 when he says this is a prison for lost souls
Travis Lee	This band is trash.  I just cant ever get into this gay shit. Sorry
Simpatico	I love this track. Royal Beggars is still my favorite, but this is probably my second favorite. I'm exempting Doomsday, but that would be my favorite. I love Hereafter, but not as much as everyone else.
iKrebbs	They aren’t fucking around with this album. Beautiful 👌🏻
Rangerafi	This is more than likely going to be my favorite album from them. I feel like they put so much more heart into this one. I’ve loved the past 3 albums but this one is on track to be my favorite. Every single song so far has been on repeat because they can’t put out a bad song.   I don’t doubt this album is more or less a dedication to Tom.
Stephanie Templar	“Just a parasite killing its hosts” is a perfect depiction of the human race. We are leeching off the dwindling resources produced by the earth in which we inhabit, slowly killing it with our greed and insatiable desire for more.
maikonny manquecoy	Hare un rewiew
Eradicism	Honestly, i came to this.
Tony Barber	fucking modern day soilwork baby fuck yea!!
Jonny Wu	Yessssssssss
Hybrid_Birth93	In conclusion, my peepee hard.
Blottskie	*Sees new Architects single* O.O      Guess I better smash THE F**K outta the like button
Alex Taramona	This band is simply OTHERWORLDLY!!
TheMusiicAddiction	The feels and message coming from these singles are so powerful. The 9th can't come fast enough. Dat look at 3:02 tho. You know it's about to go down
Manuel Wozniewski	just kickin ass ! great work guys and hoping to see u live again ! <3
christian Grey Gonzalez	Rayos esto esperaba de ARCHITECTS.
Lucas Fernando Silva	Que venha novembrooooo
Bryan Kral	Fucking album of the year. My body is ready.
Fallen King	Its so good, like damn guys
Adam Fowler	God damn I feel very bad for the judges that will have to decide the best albums of 2018...what a mindfuck of a good year for rock and metal.
iMental	my bird just broke the cage and flew away :(
Cool Plastic	AOTY incoming
Joffrey JANSSENS metal KoRner	Wow
yoga ayom	BMTH, While She Sleeps, Architects, we are so ready!
Julian Barriga	Jesus Christ I need to punch something
McDowell Fool Reselling	The amount of people quitting their job over this song.
All Lit	Royal beggars and Hereafter was a bit better! In Modern Misery is not enough hardcore moments for me... But still it should be in album <3
BellaIsDead	Architects are on fire right now!
Lloyd Algarne	I love you guys!
Noe Gaudette	This.....this hits hard.  Oh my god
L Ruhland	YOU WONT REGRET IT https://youtu.be/v16J0_z6A3o
KA M	You guys okay? Between this and Royal Beggars, you've been losing a lot of blood lately...
Joseph Versleys	The chorus reminds me of the one in All Love Is Lost, it could be intentional, good song though.
SamWilliams_Music	Sounds a lot like madonna
Marco Matienzo	This song hit me hard. Being burned out of my passion from repeatative way of living and sitting in an office everyday. Thank you Architects for reminding me what I was and the things COULD still reach.
Rekt	I'm a simple man. I see Architects I click like.
Pskylark	Holy Hell his voice is pure power.
Marco Celotti	Great lyrics
TheCpten	This song revokes so many feelings in me. Been having it on repeat all day, probably my favorite song throughout the whole year. Thank you Architects for yet another masterpiece. ❤️
Teresa Danhauer	I love how the video for Royal Beggars and this video just work out together. Both songs are incredible and I can't wait to hear and see them live.
kittyp330	just wow ❤ there is so much going on musically and the vocal layering! I can not wait for the rest of holy hell.  everything is so emotional charged and the lyrics are amazing.  I can't stop listening to this.
Ryan VanDerSchaegen	Wow..... lyrics are unbelievable
Jerad Scharrer	Album of the year?  New Architects?  New While She Sleeps?  New Ice Nine Kills?  New Silent Planet?  I can't handle the amount of perfection hitting at every angle right now.  Pretty sure Architects is going to take it for me.  Ive been having INK on repeat, such a solid perfect album front to back, and they will be followed by 3 more solid albums.  What a year....
Rise Of The Idiots	Respect for staying heavy when most other bands go soft.
Todd Romine	November is going to be a damn good month for metal. It starts with new albums from the ocean and silent planet followed by architects.  Then new unearth I'm so excited!
Corey	Thank you guys for not selling out and going soft to hit a wider audience. I love that you have stayed true to your style since day 1, regardless of whats happened on your path as a band. You guys fucking kill!
D.G. OLVERA	AMAZING!!!!!!
Mijael Raúl Arapa Figueroa	0:
michael majewski	architects ......never disappointing
Bryan Williams	Am I the only getting a slight Like Moths to Flames vibe?
Charlie	This is already album of the year
Incog Nito	I think this is my new favourite band
Fablinker	This song is Awesome! Congratulations!
Damian Mann	Garbage
Deziree Soto	I think they got influence from TAAs album "Misery" with those lyrics 😂
PheFo	Free Josh from this so we can get a new Sylosis album already. >:/
Matheus Freitas	Literalmente curti o vídeo sem ter começado. Que banda foda!!
Mandy Jackson	Reminds me of Chester Bennington
HOHT	Something else this tune.
Laszlo Küster	Am I the only one, who thinks that the last 2 singles are missing something?
Edward Keselman	I didn't know Macklemore  was doing metal... interesting
Wade Lawrence	0:00
ethan lavoie	holy shit
Слава Богу Православие	HA HA HA 😁
Ярослав Лебединский	Ребята спасибо что вы есть,каждое утро с вашими песнями поднимает моё настроение и заставляет идти вперёд! Жду новый заряженный альбом!
Qwerty Qwerty	Is it sound like nihilist?
Dear Agony Official	Literally every song since Doomsday has been on an entirely new level, like fuck i like old architects but this album is shaping up to be absolutely spectacular
Isaac spohn	*C H U G I B L E G H T S*
Bogdan Sarasek	Very emotional song! I ike it!
Roque	So far so good
IWLPanda	They keep getting better
Arben Fejza	Im done with this teasing game, see you on the 9th.
HaremofScorpions	Eh, pretty samey. Kinda boring.
MK 25	My nipples are awful hard after listening to this. Anyone else experience this?
tristananvilcaster	New Architects=YES 😭😭😭 So good guys, can't wait for the new album!
Bloodtear13	nice. This album blows Disturbed new weak ass garbage out of the water. Thank you for making great and heavy music!! come to San Antonio on Holy Hell tour please!!!!
Star Fleet	Kinda feelin a Haste the Day vibes on this one
Mason Powers	THIS IS GOING TO BE THE ALBUM TO REMEMBER FOR CENTURIES TO COME
sahra skellington	I haven’t forgotten about how Sam called out that piece of shit guy who groped a woman at the concert. Sam you are a hero!!!!
Omar Diab	straight metal
Mikee	Pressed the like button before watching it.
Brian M	Josh is a perfect fit for Architects.. He's not a replacement for Tom either. I wonder how they would've sounded with both guys.. FUCK
Stuart Steele	Holy shit this is amazing!! cant wait for the new album!
Mike Lee	New architects new while she sleeps and new bring me. I can see a tour coming up with all three bands
Dylan Gauthier	Architects and While She Sleeps on the same day, has christmas come early?
Cause Meanski	No bleagh
Joka Crazy	Pros: Es una pasada de tema.  Contras: Todos los temas suenan iguales xdd
Ville Tomminen	Holy Fucking Hell, this is perfect! I Love and respect!
Dylan Potts	Getting Early Grave vibes from this. Hell yeah.
david_runyon	Holy Fucking Shit...  That should have been the album name.
Johan Sandberg	Damn! F-ing amazing... Can't wait to see you guys live in Stockholm in January! Keep doing what you're doing!
ĐΔŇZ Z	muito bom, architects e tdwp são outro nivel, que banda!!!
Reza Tmhd	loved royal beggars and doomsday but don't like this song.
Hamza Cherief	*O N E  O F  T H E  B E S T  B A N D S*
Mike Sebastianzt Burnet	holy energy scream!
Derk Ender	I felt it. I really did.
Tushar D	I desperately was waiting for a new one. It's not as good as royal beggars and hereafter but damn, it's an amazing song!!
Marcin Banan	Parkway Drive 2 :)
JPMBful	just amazing!
Tabitha Potter	https://youtu.be/XrT3G5T7VDA
nephilymbass	Badass, great song. Really relate to this song
abyss	Holy shit
Alex Glass	1:46 sounded pretty sick.
Isaac Yoder	*CHUG CHUG CHUG CHUG CHUG*
Joss Harver	Are they using the same samples from previous albums? Everything these guys do lately just sounds like one very long mp3!! Josh, go back to Sylosis mate, this 0-0-0-0-0-0-0 type of riff doesn't suit you man!!
Ryan Sousa	a melhor banda que já passou pela apitaph foi 'bring me the horizon"
Tim Hobson	Definitely better then the new while she sleeps song
ellabella _sykes	FUCKING LOVE THIS OMG
Thomas Barrett	"We used to run with the wolves"
Nick van der Vegt	I've never clicked so fast on a video. UNREAL how hyped I am for this album
Guilherme Meira	Alex's stare at 2:09 is so unsettling.
Jay Ryan Clark	Is it just me or does this song seem like it should be titled “run with the wolves”?
JPR	FUCK
Juanjo Santacruz	Sam vocals just keep improving, omg
Tony	ready for the holy hell
Nikolai Evans	Shakespeare quote ftw
Silence Machine	can i know the technique that sam use for the vocals ?
Teddy EG	This goes hard af !
Nick Florian	Yo is it only me but did the line 'Seven billion hungry ghosts, Just a parasite killing its host" + the "dark room" with the illuminated cage look like a reference to Venom?
Ice phoenix	I *SO* can't wait for this album, holy fuck.
martin sedy	3:36 Everytime when I hears this, I just imagine myslef flying through outer space ... absolutely beautiful
Lucifer Vane	Can’t wait to hear the final track🤘
Brian Williams	I don't want this to come across the wrong way, but I'm REALLY glad all the songs aren't just about the loss of Tom. When they said on their mini documentary that this was an album about coping with loss I was concerned they might all be different versions of Doomsday, but these singles are straight fire and this band deserves credit for being emotional, strong, and fantastic song writers.
Algernon Blacker	This band is fricking amazing, I love what they stand for and they are coping so well with what happened Tom, guys never stop making music 🤘
Dan Vernon	I'm not quite sure, feel like I'm guessing way more than with "Royal Beggars" but I think I got my very own interpretation of what this track is about.  Throughout the video we have this glass-cube in which they all perform but Sam, who at some point towards the end has managed to break out of it - I believe this cube to symbolise a cage, putting your mistakes on display for everyone, being transparent to others, a 'messiah not wearing any clothes' (Reference to lines 3-4). The fact that Josh, Ali and Adam have in some way a connection to the computer or smartphone in the video and are not being shown to live outside of the that cube, somehow leads me to the thought, that this cage of glass is supposed to reflect our identity online. We are transparent, we are flawed without showing shame, we are naked in a very abstract way. And most importantly, we are caught in this image of ourselves on the web. "This is a prison for lost souls" Then, there's Dan, who suffocates on the table with Ali facing him and not caring at all. It seems like the mobile in Ali's hands is not only distracting him from the situation, it became more important and hinders him from feeling empathy. He watches Dan die, stands up and takes pictures of the scene, rather than feeling connected to what's happening in any way. The whole verse "We planted a seed..." and so on seems to underline that once more. Josh is starting to bleed from the eyes in a very similar manner he did in "Royal Beggars", where he sat in front of a TV and smoked, Ali is on his phone, not quite yet effected by it. Adam is busy working, handing Josh stuff to do and thereby contributing to Josh's destructive behaviour (I mean, that sentence sounds weird but Josh is literally bleeding so I guess...). Adam too lives in the box but on a passive level, while it's slightly more of an active act for Ali, even more so for Josh who destroys himself.   On the other side we have the very frequently occuring picture of Sam with an arrow in his chest, hit like a hunted animal, like a wolf that has been shot down. 'Running with the wolves' to me stands for a more natural way of living than being caught in this horrific crate of glass and "now we can't see the forest" basically reminds us of how far we have strayed from living freely, how far from being wild and not killing ourselves. He is in his room, not falling for the destructive lifestyle - "I won’t go to the grave, with the song still in me, and I won’t live like a slave, begging from my knees". He lives with the pain, because he believes it is what's right and doesn't trust false 'emperors' or saviours.  That's all I got, I'm sorry for it being a bit rough and way to long. And now - please, someone finally explain to me what the sunflower in every room but the cage is supposed to mean...I can't make sense of it. Thank you all for reading and if you stuck with me, I really appreciate it. Of course this is just my take on the song, dunno if it's any better than guessing. Cheers!
SYTHEOPATH 1	I know I'm not the only one who expected a BLEGH! @00:30 🤣
Jestermac02	Ok now. Some people say, that this song is similar to All love is lost or the chord progression sounds like Memento Mori.  For me, the bachground melody in Modern Misery is clearly different than the one in All Love is lost. And i actually hear no similarities between this and Memento Mori. Maybe my ears are fucked up, but can someone explain to me, where the connection between those songs come from? I mean, they definitely have the Architects sound but for me these are all very different and awesome songs.
Perch	If someone finds my head please send me a message, I lost it during 3:19
Ondřej Bursa	Am I the only one that finds this band not interesting anymore, releasing 3 versions of one song all over again last 3 albums? Not saying it's bad tho, it's just... boring to hear the same thing again and again...
Sven Klein	Thought it was a Macklemore video, when i saw the thumbnail. I feel bad now.
Ayden Woodruff	love it
Josh Serovski	Sam's screaming while singing is a thing of beauty.
Jessie Kurz	Dan that video was again beautifully made!
Chandler Bing	I've ruined the barbel while rowing!!!
SuperDan	I love this and architects although, I'm worried about them, they've sorta gained a cursed that many artists get and its where all the songs sound the same. this sounds like gone with the wind and a match made in heaven.
zoranfdz	who/what is Maya?
Muhammad Fahim Norazizi	babi apa dah 3 single keluar tiga tiga mantap ni macam mana ni woi
Awi Jay	Release the god damn album already,
V E I N S	This is why they’re the best metal band of our generation
flintenFLORI	This Album will be so AWESOME !!!
Gelina X	I can't wait more for the new album 😍❤️😍🤘
Diogo Quelhas	The beginning reminds of the 'These Colours Don't Run" build up, and that's a good thing
Jake Ryan	Why doesn’t he ever do lows? He does semi low mids but I wanna hear low.
Brutal Sam	I'm a huge fan but come on why does every song sounds the same? If you give me architects songs that idk and you tell me to guess the band I'd know it's architects, I mean let's have some really heavy breakdowns and a catchy choruses. this song is cool though
Farhan Pratama Juniansyah	greatest comeback
Luis Rodas	They won a new fan lml
Lore Medina	me cago en la puta qué temazo
Federico Borghi	🇦🇷 argentina
Max Michel	Yey
Tim Thornhill	Parts of this also remind me of Memento Mori, especially the end.
Antonio Ferreira	Whats going on in Modern Missouri??
Josef Krüpa	Fuck yes
disaprimat	hard to watch because the truth level is so high
Ramon Nefi	Outra? Já? Pqp, assim fica difícil kkkkk
eric valero	amazing
preyfan	wow Ö__Ö he is such an amazing vocalist and probs to the band , this song is super powerful !!! :D <3
Avi	Too weak.
Theflamehead14	I'm so ready for this album 🤘🤘🤘
Pete Za	Well, FUCK....
Chase OA	All these new songs are such a relief. I'm so happy Architects is evolving the way they are. Such an aesthetic.
Jason Svrcek	This isn’t going to be album of the year. It’s going to be album of the decade.
Joabe Paes	architects is live !!
Glen Huang	Heavy
Drood	There isn't a song on this album I won't listen to.  Best album of the year, probably of the decade IMO.
Justin Ussery	Just crapped my trousers...3 mins. Til I clean myself..or I could just play it again so I don't ruin two pairs of trousers today.
CovinaDrummer	This album can't drop soon enough!! These guys are at the top of the game for sure!
Reckless Gaming	Ok yeah, its a banger, its fire, additional generic hype compliment... but seriously, incredibly powerful lyrics and BEAST instrumentals. Can't wait for this album!
John Roger	Q gritaria do djabo. Gostei.
Bradley Proctor	Fucking madd song
Mark Green	"We use to run with the Wolves"
Alex Valdez	I f*cking love this, this band never disappoints nobody keep going guys is been a lot of years listing to your music lml
Dream Awake666	"Hell must be empty All the devils are here"  I love that Shakespeare is still a thing in modern lyrics <3
Jan M	Awesome song man. Can't wait for new album !
rin316pi 20	おいおい新譜楽しみすぎるだろ……
Katie Beth	This is my favorite song so far.
Etheroff	Bleugh!!!
David Evans	Still better
Joe Lackey	I hoped their sound would evolve. They’ve sounded the same since day 1.
Hassan Alnajjar - A65AP	Why do he always wear suit shirts 👚
DarthJega	Пушка
catherinescorner	This is perfection ❤❤❤❤
Anna Paula De Oliveira	Come back to Brazil <3
Gergely Deak	There were place for some additional "blegh"... Why did they take it out?
Denis Fedorovskyi	What the f*ck, that vocals is awsome! Hope Sam will get it good on live shows
Cresh Berndicert	just when you thought they couldn't get any better... this drops. wow
Tyler Ballard	" Architects are going soft " Sam Carter " Hold my beer".
baihaqie reza	How the fuck did this song even got 112 dislikes? You all must be new here to dislike this song.
abdul haris	I see my fool in this video, big thanks Architects  :)
Max Buchsbaum	Tone city
LePhobix_	I looove it! <3
Stafen Guevara	Needs more depth in his voice
epicsnail14	Architects. My boys. You dudes are on track for album of the year
Alec Kurth	This is my favorite Architect’s song since 2014.
My Sick Plague	This beautiful, never disappointed
Milkita Bai	♥️
dd ddd	>Architects and While She Sleeps on the same day?  Not today, old friend.
Thraitor	Ehh not sure how to feel about this album,just going to wait but Hollow crown is easily my fav Architechts album.There last 2 albums were pretty damn good but extremly similar and wore out on my pretty fast.Hope it doesnt happen with Holy Hell cos Doomsday is fantastic
Tyler Short	Tom wouldn't even be able to comprehend the legacy he's left behind.... This band is a force to be reckoned with... keen for next Friday.
A Lyons	Architects keep on doing it. Every song is an amazing part of work. Love their style!
mohammad firdaus	💦
Fanity	Vinyl is incoming <3
xavkoston16	One of the first time that architects disappoints me, it's boring from the beginning to the end, i hope the rest of the album is better than this...
thelaughingwood	Simply epic
Sebastian Hurtig	The band we need but don’t deserve.
Reza Ruki	Sam face's looks like The Miz in this lol, badass song as always
Lazarus	Tom is missing. You can here it in every second.
Alexandre Laborie	WAAARF but poetic WAAARF
Jay Burris Wayne	*never got chills like this in my whole life*
Zion	OH FUCK
Adriano Santos	Brasil aqui... Melhor banda metalcore da atualidade
Dylan Wallace	Good god this Shit is wild y’all.
Roy van loosbroek	holy hell this is amazing
Chris Lomax	00:21 fuuuucc!
Guilmer Da Costa Silva	NUNCA DECEPCIONAM ❤️ 🇧🇷🇧🇷
Chris O'Neill	So excited for this new album
максим даркович	Ну все, давайте уже альбом, я хочу услышать это полностью!!!
Em	In some parts, this sounds so much like gone with the wind and memento mori nhijhunjsn I LOVE ITTTT
Estelle Marie Humbel	You guys never cease to amaze me ♡
Alex Kasinskas	Omg best song yet
Mr. Someday	There is no doubt that this band will make metal great again
Lord Toman	MODERN MISERY!!!!! 🤟
M-200 Asny	Modern Misery!!❌❌❌
Kseoh	am i the only one who got goosebumps from all released yet songs?
Angie102	Every single has been amazing can't wait till Friday
laurent bost	I love how this song can be related to the new song of While She Sleeps, the same denonciation of our world
ThatHipTurtle	Fuckin siiiiiick  Can't wait for this album drop
Zayloume Nime	I can't wait for this album, I'm so hyped and every single they put out is hyping my excitement even more.
Nishant Gandhi	Tom would be proud, Dan.
patze182	The ending gave me goosebumps because it sounds like the ending of "Memento Mori" WOW
Alief.S	No blegh?
Abik Kabik	Dan😭
tinkoasd	They're their own generic version.
Markus Orth	Oh HELL YEAH!! \m/
Alexield	La técnica vocal del vocalista es lo mejor que hay en esta banda, y en general todos hacen que sea mi banda de metalcore favorita <3.
miguel piñeros	Os this the better band of the moment ? Yes it is
Harun Kamsaini	Show this song to unskilled labour..  They became the Architects..
Russel basumatary	This is the New Architects. I miss the old Architects.
Alessandro Natale	Best in their genre. Pure passion, true musicians, true people, real as fuck and all of their music hit me like a train.
Melanie	Can’t wait for the album each single strikes me so hard
Alan Sayavedra	Al comienzo de la canción parecía Suicide Silence ....jajaja pero estuvo buena la canción
邱柏超	I JUST DIED.
Bill Waugh	O O F
Alexander Gavilan	Because of Architects, every band should change their name... Blegh the fall August Burns Blegh As I lay Bleghing Bullet for my Bleghlentine For to Blegh... And the list goes on!!!   😁😁😁
Lisa Empathie	Archtect-gasm ♡
