bebop hunter	It's the 9th album please!
Саид Юсупов	The new album will be awesome😭🔥
Ryan Lane	Different enough and still Architects enough to be a masterpiece. Can't fucking wait for my signed album to be delivered 😍
danielkavanagh1994	Man I love Architects as a band, as people and everything they stand for so it kills me to say I don't like this.. All their songs have just become very formulated with the same intros, choruses and bridges. They need a change and that upsets me.
Chris Deathwish	😍
Shadow Wolf lOl	the empror wears no clothes lmao 😂
Matej Viečorek	I can only say: Awesome 🖤 can't wait for the Holy Hell 🖤🖤🖤🖤
Vitor Vaz	HEHE
Jascha Balu	I was a little afraid they gonna lose their bite with the new album. How did I dare to even think about that! Can't wait to blast Holy Hell until my windshield shatters
crocodileman77	Holy ...
Austin Frye	Where is the “love” button at?
Sam Tonkin	Can I hear a part of Memento Mori in there?
Danny de Ara	Surprised to see no one talking about the chord progression in the chorus being the same of 'Memento Mori'. Unbelievable progression and continuity. Same as how they did with Doomsday/Hereafter. So stoked for this album now!
Selina Kaminski	How about a discussion about potential interpretations of this song?
Ahmad hebriansyah	again and again
arif Ishartadi	Does it hurt? The arrow on your chest
Morty Klew	These colours dont run copy
trastxy	hell must be empty, all the devils are here
Yutsi Aion	Gila
Santiago6277	New architects and while she sleeps music. What a time to be alive!
Maks Davis	thats fu##ng awesome...
fuck_crunk	Awesome< get it up
Blame Frank	1:44 that came from the depths of HELL
Molag Bal	Wow every single sounds exactly like last 3 albums
Nedur Frog	Architects just kept my passion towards Metalcore
Selina Bennington Leto	Architects 😍😍😍❤️
Jack Brown	the new While She Sleeps song is better
Kevin Riedel	People: Metalcore is dead... Architects: Hold my Beer
Benjamin Carradice	That Memento Mori chord progression at the end though
PUBG BIZZLE	Do love the band but I’m just not seeing the variety in sound these days. It’s like how many times can you churn out the same song? Not hating I’m a massive fan but for a band that has evolved so much, they are certainly stuck in a rut at the minute just releasing the same song over and over.   bleh 12-0-0-12-0-12-10-0 and repeat for 3 albums.   Again just my opinion, obviously still going to see them when they are in my town just a bit gutted with the latest releases from them.
André Hosken	MDS, QUE BANDA!!
Sideness	We're gonna fight hard in the pits ;)
Donlyn Staz Kuroneko	Your wife as soon as you open the front door
Sam Jardine	Liking this better than the last two...
Nikoleta Fellner	BEST. BAND. EVER. ❤️
juan atmaja	D E E P 🔥
Tomáš Kampf	Awesome... 31/1 Prague... I'm waiting 4 U guys 😉
Callan Paterson	What ? No BLEGH??
Petros Laloukiotis	Can we take a moment and appreciate how violent & intense the way he growled "Are these our new messiahs?" sounded? Like holy hell, where are these vocals coming from.
Memphis 13	Awesome!!! ❤️🖤
xyLooo	Naysayer V2
Detestor 420	This is a fucking crusher!
Shivs	That little melody in the background during the chorus is so fucking beautiful. Josh, you're a god!
Михаил Маслов	To my mind, song is pretty good, but guitar part is too easy for architect's song.
Tommy Raviglione	fucking slaps
Benjamin Müllner	When you rent a studio for a week and have to record a music video every single day.
Nazrin Brubaker	This and Royal Beggars are totally awesome, but I hope theres more songs like Hereafter in the album. I hope they dont turn into a full on EMO Metalcore band.
Bushcraft Buddha	We used to run with the wolves meaning we were in a perfect symbiosis with nature and our surroundings. Now we re running behind technology which has become our new god. Technology measures and quantifies us, so we become predictable and replaceable...  But you can'tcompute, measure or quantify what comes from the heart... welcome to the times of modern misery
g h o s t k i d s	It it just me or do some parts sound like AMMIH, specifically the 'all the anchors in the ocean...' part? Either way its such a good song 👊👌
Siturba	Prepare yür anüs für new albüm
Virtual PradaZ	Architects AND While She Sleeps new songs on the same day? Today is a good day.
Olivier Seyler	I'm just banging my head as hard as I can. Well done guys. Well done. 🤘🏻👌🏻
Joel Puente	Deje de escuchar Metalcore desde Sempiternal (BMTH), porque la escena cada vez se esta volviendo un poco gay. Pero este album de Architecs va muy bien y los temas uno mejor que el otro, son el mejor exponente al dia de hoy
David van Vuuren	Brilliant!
Ένη Φλού	❤
Austin Kuhlenschmidt	I can only imagine the hate for this, but... As much as I like architects, this is lacking, like the other songs released already. They’re still better than 95% of artists out there, but without Tom they simply aren’t impressive as before. It’s like there’s just something missing to it and unfortunately I don’t think AOGHAU  will be topped.
Mike Hunt	Tom would be so proud of you guys like,honestly you really are keeping his legacy alive <3
Cole13517	Bleghtastic 10/10
Terry Bowman	i swear that i extremely love Architects to the core, Architects is fucking pure art
dynatwenty	i love you.
Ashish Pisharodi Drums	nolly
Craig Simmonds	This band just keeps on delivering. 10/10 what a tune
OuttraZd	Heavycore
Samy	My body is ready
HCROCK	Seven billion hungry ghosts
Ramadhan Sudaryanto	This is insane🔥
Johannes Sch	It's crazy since Lost Together they never changed their sound but at the same time they're constantly getting better.
linchpyn	Hearing a new Architects song is like when you get together with a good old friend after a long time. The first 15-30 mins are rare, but then you get realized everything is as cool as always.
Sinan Uluc	I can listen to this all day.
Aldi Satriahidayat	3:20 these colors dont run vibe
Léna Oliveros	Holy hell ! All our gods have NOT abandoned us, because A R C H I T E C T S still here … Awesome ! 🖤
Charlie Stackhouse	Sam’s vocals are fucking savage on this one. Especially on their own at the start. Jheez...
Tu Gfa	2:05
Andre Anna	❤️❤️❤️
Фореигн Дицк	Someone, show me where the BLEGH is at! I can't find it.
violet goodman	Stop screaming at me.  Can this guy only do highs?
Khal Lamar	Santos demonios qué himno el que sacaron estos cabrones 🤘
Trankvillin t6 Shirokovskih	Это не Джордж Миллер, расходимся.
Joe McPhail	Def one of my favorite bands and not just out of whats left of metal either. Thanks guys keep it up - rip tom
syanachannn 95	I don't like hard music... I want Architect keep make song like "royal beggars" one
João Vitor Mesquita	This music fits right into the reality of Brazil, I feel thrilled listening to this song.
tak jest	Incredible... Those sounds from momento mori corissing over...
DaveyCrockett5000	I wasn't ready for that. Love it.
Kabz	fuck i don't remember the last time i was this keen for an album to drop
Anibal Zuniga	Gees this band is coming out hard and im loving it cannot wait for the album to come out..
Jamie Lawrence	This is...ok? Reminds me a bit of Daybreaker, but also feels like a bit of a 'standard Architects' song structure. I think Hereafter is a much better track, this might work really well sandwiched in the middle of an album though.
Johnny Rakete	#Holyhell, was ein Brett🔥🖤
Iron Moon	This will most likely be the metalcore album of the year.
NinjaCloud	Sam is a beast vocalist, he can scream like that with an arrow in his heart? Goddamn...
Bartosz M	First Architects, then WSS <3
JimboShreds	Anyone notice the Momento Mori vibe at the end though? Goosebumps
Soyer	So heavy and angry! Love it very much
Mandi Hernandez	I’m so in love with them!! Now and then there amazing beautiful 🖤🖤🖤🖤
tofol cano	Damn why is Gus Johnson so angry
Amy	I haven't been this hyped for an album in years.
Cj Cribbs	Holy Hell, each new release is just better than the previous this is easy choice for album of the year.
sirtagada	I think a few people just misclicked on the thumbs down button instead of thumbs up !
TheTallTom	I am in love with everything this band has ever done.
Cameron Little	I think if I was a caveman I would have run the fuck away from the wolves, but this song may have helped me get along with them. p.s. Ali taking a picture of Dan passed out in a pool of blood was fucking hilarious.
Giorgos Abso	I expected a nice ol' BLEGH after the second 'Modern Misery'.      10/10 still
Siddhartha who?	Hell is empty , all the devils are here singing us the lord’s prayer ! Damn true Vatican City *cough cough*
Jonathan Jimenez	Nice
Remember Me	JARED?
Jason Bentley	I used to be an adventurer like you, then I took an arrow in the chest.
berk ayaz	Çıldırıyorum..
Ádám Völgyesi	Hey, look, a new Architects song without a blegh!
Hitwood Melodic Death Metal 2018	1.46 the magic happens. But I was wondering why there are no BLEAGH's at 3.19?? It would have been perfect.......btw New Architects and new While She Sleeps in the same day! With this constance they release all the album songs before the release day of the album will come :)
Mr VossoRox	No bleagh no party
dante	WE USED TO RUN WITH THE WOLVES
Acoustic Showcase	I may be wrong but I think we have a BLEAGH Guinness Record Here 00:33 .... LOL
Ruben Muller	Holy shit
Work For it	Why are they so good!!  😍  I cant wait to see you again in Poland!!
Dom O'Brien	Why is there no fucking LOVE button on YouTube?!?!
britney arkin	Royal beggars is my fav new single. That one goes hard af. But i have mad respect for anything these mofos release. 🙌🏻🖤
Handian Hutabarat	This breakdown could make a tsunami
Cappelletti Benjamin	I am so ready for the new album :) Can't wait.
GlarhzillaFox	Fucking magesitc! These guys know how to write emotional bangers!
Chrono S	Architects Silent Planet Ice Nine Kills  Holy trinity of current metalcore ❤
Sam Dobson-O'Neal	Naaaaaaa, Not Natural at all. How can a band just keep getting 20 times better everytime. You fucking champions;)
Logan Riley	God I love this band!! Brilliant!!
Lil Pump	💕💕
Andrey Vasilenko	Respect from Russia, guys🤘🏻 You are the best 🔥🔥🔥
Bartłomiej Kotlarczyk	this could be the end of the world. thank you Architects!
AceOfHearts	Wheres youtubes love react my god. I cant beleive you guys keep upping your game no matter the adversity you face. Fucking killing it x
Artūrs Virsis	This got me waking  up this morning better than any coffee. Such an adrenaline coming from their songs.
Tyrone Loney-Wright	Awesome 👌🤘
Yudho Stwn	Nice halloween costume sam
Chelt scene Uk	❤
Marcus Quidenus	There will be a lot of haters, but for me their new songs are a little bit to slow and kinda sluggish. I like their new music too, but not as much as their older songs.
Peter Baker	Is it just me or if you listen to the chords underneath the mid section, it sounds a lot like Memento Mori.
Imran Sahir	Architects and While She Sleeps are two of the greatest bands in business right now. WSS is a bit underrated but they'll get there. I can't wait for this album.
Michael Pfund	Hearing memento mori references in the chorus 🤔 absolute banger 💥
Aeour	Sounds like they're about to release yet another masterpiece.
Jesse Stewart	They can do no wrong.. dying to hear this album!!
ilikeittight	Awesome song but no blegh? #prayforblegh
Craig Kasiske	I let my parakeet listen to this song, now it's a dragon.
Gleb S	пацаны второй видос подряд блюют, дайте им уже угля кто нить.. жалко же)
attila Kaszonyi	Ohh🖤🖤🤘
Al ჻ 。	IM GETTING DAYBREAKER VIBES
NEIL SAEL	75 and counting disliked this because this has no BLEGHS.
JD Carfield	Damn, man. I was one of those guys yelling "SYLOSIS!!!!" in these threads on YouTube and IG and now I'm ashamed. Although Sylosis will always be my all time favorite, this band is the best thing out right now. Each song they've released off this album is special. I can't wait to hear the whole thing!
Dwayne Voisey	Gave it the thumbs up before it started because these guys are beasts
Alexander Walker	7/2  Will listen again.
Дедушка Колхоз	Not bad
настя белова	все новые песни одинаковые какие то
Jack of all Trades	Sick
a_silent_songbird	Awesome song aside... Sam looks like he's been hitting the gym!
Crispy Calzonie	Fucking banger
Proton Rus	Who is from 2018? Who is from 2019? Who is from 2020? Who is from 2021? Who is from 2022? Who is from 2023? Who is from 2024? Who is from 2025? Who is from 2026? Who is from 2027? For the future
Tom	Love the stories that they tell with there music/music videoclips!
Mr X	JUST A PARASITE KILLING A TOAST!
Дмитрий Пунин	Be careful and prepare to consequences. This song just divided my head by zero, after this my head divided by zero everything around in act of epic headbang.
Adam Miškove	bitch this is quite heavy for architects
Mitch Shipard	You guys are awesome. Come to Toronto, please.
Danjah	wow
Dariø GR	ΑΝΑΤΡΙΧΙΑΣΑ ..
CardboardWallet	this was kinda weak though tbh
Jason Gore	That bass, that synth, that voice, that drums, that guitars
Alex Malandiy	No "blegh" no life.
The CrazY Bass Man	:') new year came early for me Architects and WSS with Anti Social
Bishal Bhattacharya	Am i the only one hearing a bit of memento mori in the chorus?
Callum Mason	Damn, how do you always seem to capture my own feelings as I form them, hail to woden and the wolves.
Dmitry Timofeyev	Preach it, Sam
zack Jones	really sucks
Harrison Edwards	Cum in my ass this is incredible
Laura Franke	i need friends who listen to this kind of music badly
nisa noire	sam's vocals are just amazing
DELUXSONGAMING	My dick is so fucking hard to this video
Jerred Robinette	Youre the only band I know that makes me cry with everyone sing you have released. Why do I connect with these songs so much? Idk it hurts but I love it at the same time.
Muhammad Faris	hidup melayu
Yam !	Great Song, Progress is real!
stoenchu122	Heavy song and meaningful lyrics. Architects still sticking to their roots
EpicArianas	Architects are the only band left in a stale genre that is continually pumping out amazing music. Keeps my faith in hardcore alive 🖤🖤
Randy Evan	No bleagh ?
D Hansdah	first 30 secs in the video; goosebumps already
hum an	Let get this album to number 1 boiis and gurls....show them that metalcore is still alive and well.
LostinOC	YAAAS QUEEN SLAY!
DRAGTR0N	i was just looking for something to enjoy my cigarette to.. and oh boy!
allseeingowl 1220	Who else expected a blegh in that beginning breakdown? Lol
Michael Chikviladze	I'm bit disappointed, there was no BLEGH! :(
Nick Johnson	I think it’s the weakest of the singles so far. It’s a good song. I don’t have a problem with it at all. Did Tom write all the technical guitar parts in LF/LT? The riffs were super sick. AOGHAU has slow but heavy hitting riffs, as does HH so far. I prefer LTLF, but I also love these.
Josh Torre	Best metalcore vocalist of the year!
just1goon	wow, just wow! its 6:45 atm in germany, im waiting to go to school, but im so flashed by these guys. cant wait to see them live in february here in germany..
Jesus H	goddamn, this will be my favorite architects album for sure.. insanely good.
Mia Vegan	"there's not enough water in the world to wash the blood from our hands"  this has so much history and meaning behind it..wow..
Alex La-Chiusa	No 'blegh' to be found.   Not good.   0/10  Just fucking with you. Song rules.
For 20	This is my favorite of the 3 most recent releases  but they never disapoint
Ben Hamdorf	The breakdowns on this album are incredible!
Сатана Печет Блины	Sometimes I feel sorry for Sam's vocal cords.
Anjelo Baruelo	SIIIIIIIICK! bleugh!
Renzo Bse	En un mundo donde BMTH me decepcionó por primera vez, Architects y The Amity Affliction lanzan los mejores nuevos álbumes
Fischkimme	Can’t get rid of the feeling that royal beggars and modern misery sound very similar... But still 9/10 Bleghs!
Jesus Christ	I‘d go to the grave for you a second time tbh. Love you 🖤
Johannes Life	AHHHH :D 🎃🔥❤️
Super Sweatt	That replay button lookin real sexy right now.....
Pitra Agung	Holy Hell should be Album of The Year! without exception!
Marcos Cortes	AWESOME !!!!
Faris Haiqal	Fuckinh harddddd
Srinivas Pepalla	Like and watch
limonad666	Amazing kings is back
eyeshalfclosed	Is it just me hearing a little bit of Memento Mori in the chord progression here? :O
andreasy 73	Damn, sounds and feels so good in my ears!
Emperor Gontier	Holy hell Will be an epic album
Jannis	Fact is : I love architects and their style. They’re good musicians and they know how to bring out bad ass songs  ...another fact is since Unbeliever the style never changed and every song sounds just like the one that got played before .
Erik Jason	Every time Architects is releasing another single/song is always definitely a masterpiece. They are heading in the right direction in this upcoming album.
Так Блэд	ебать, как же ахуенно
Ian Dalton	Jfc Josh Middleton brought some Sylosis sauce on this one
Kaelen Brix	damn, architects are indeed the GOATs of metalcore
Jimmy Klasson	Sweden love u guys, keep it up! 🤘
mohd shahrizan Ramli	Architects just save my life sounds a bit cheesy , but you guys just did that, beyond that perhaps
David Ll	This is perfection
Toby K.	Jesus Christ my left year was not ready for that beautiful, brutal low end. 2 seconds in and I'm already hype.
Dániel Deák	Sick af.
Dark Incision	I pre ordered AND ITS FUCKING SIGNED Can't wait to get it guys x
Tommy The Krunk	I don't like how sam says modern misery so much. also the structure of the song is jarring which is not made better by a unimaginative and uncreative breakdown. I mean it's the same riff from the intro, speaking of which is played TWICE, tom is gone and sadly its starting to show.
Kyle	Is there light at the end of the tunnel guys?
Noah Stoddard	With these lyrics this had the potential to be really great song but the synchronization between the instrumentals and the vocals were off.
Mikey V	Loved it buttttttt where's the BLEGHHH that I look forward to?
William Moffatt	"I used to be a metal singer like you... Until I took an arrow to the heart."
George Veras	Lindo demais
Tania Castro	Ok I'm dead, this song amazing.
Aldo PrasetyA	https://www.youtube.com/watch?v=-hLGS5YGy5k
jose kruzpe	The chorus have the same tone of the song memento mori
Payish Deen	we all know that Josh have his own signature guitar with Sylosis by ESP but with Architects he still use late Tom's guitar signature. such a good friend ❤️
Street Drummer	Yess!!! Loving those drums!
Robbie Jones	I’ve always been a sucker for clean guitar. This song is the dope!
Christopher Robin	Holy. FUCK!  Words don’t do this masterpiece any justice.  The day will never come where the Architects disappoint me...
Cole Vick	Doing every thing in your power not to destroy your ears ability to process the album to come as a full piece is so hard to with every track these Gods put out, not to put every track on repeat until your ears bleed. But you can't do that. Fuck it. Ill rent more ears. This track is too damn good.
Richie Arriola	3:30 killed me
Huy Yang	Wow, everything they've released so far this year has been amazing.
Ricardo A	The only band with "society is shit" lyrics that I can't cringe to. Fantastic song.
Aylê Roqueiro	AMAZING !!! I LOVED IT!!! <3 <3 <3 \m/
zean freak	Who likes this fucking song at the first hearing!!??   #indonesia
Adam C/ FIRINGSQUADraf	Now i have to buy a new headset bc 110 volume just blew these bitches but worth it!
Jhon K	I discovered Architects by accident, and I'm glad it happened.
Windson Elric	"Are these our new Messiah? Cos the savior has a gun to my head" There's a curious fact about this lyrics Brazil (where I'm from) elected a fascist piece of shit as the president today and his name is Messias (Messiah in Portuguese)
Jedidiah Bertram	4 tracks released so far. All 4 fucking brilliant!
Toms Alcore	1:03 cool
Malkit Singh	We Used To Run With The Wolves , You're Right Sam , We Are So Lost Now!!
Brent Growe	Awe man so good! So So So good!
nicolas santana	"Don't worry, he just use the Amaterasu", what good fucking song dudes!
Owen C	Can't wait for Holy Hell to drop! This is yet another sick song fuck yes \m/
Alejandro Maldonado	Está disquera no me gusta por que tiene más banda alternativas pero por ellos es que estoy suscrito al canal.
Tide Apparel	This is going to be deadset the biggest album of the year... and probably next year... and most likely the year after that.
Brady Hargett	ESP HORIZON with cockstock, Nice.
Apis Boh	Goosebump
Clay Drummond	Album of the year LET’S GO
Sumit Aich	Nice work
Waldenor Neto	Comecei a ouvir essa banda faz pouco tempo, e já é a minha segunda favorita. Simplesmente maravilhosa as músicas dos cara
Joe Smo	Goddamn those high harmonies
Seize IMmUnITy	Great work guys keep up the badass work! ❤
Mike Lemasney	The Goat 👌🏻
Serj McCoDZombi	💪😏👍
Janny Doesnt Know	METALCORE G.O.A.T🔥
Missy Sarge	Oh hellz yes!!!
Enrique Rojo	Esto está de puta madre 🤘
Jake Young	SO FUCKING GOOD. Album of the year for sure.
Edan Corner-Evans	Takes me back to GWTW. love this so much.  Keen for the new album
Ángel González	57 Dislike? Fuck that fucking people .l.
Solaire Of Astora	Holy hell this made me tear up
Avik Das	Thank you Architects. You have kept me alive for so long. You are the band that gave me one last hope when i was about to quit.
just browsing	79k in 5 hours, that's an Architect song for you. 😍
UziNineMillomeetah	I didn't think I could like an album more than Gods, but it looks like Architects have hit a home run and topped it.  All these singles have been killer! Can't wait for the release!
R W T	This might be the only album this year that could potentially rival Ice Nine Kills.
Brianna Schiraldi	Obsessed 😍
rastamann20	MODERN BLEGHSERY!
I Took Your Pizza	I'M READY FOR IT I'M READY
Jeahn Dütra	Thats amazing
Collin Pizzo	they sound good, but i wish they'd experiment with more sounds. we've heard the same sound a lot from them.
Chris Bullock	THIS...this, ladies in gentlemen is how you properly transition a heavy verse with a clean chorus. Again, Architects never fails to impress.
Jaén G	You guys have definitely improved so much, this is just an eargasmic piece of art that transcends music.  Sublime.
Sam Jones	🖤
Jack Baldwin	Architects proving to be better then amity’s new album.... i never thought I’d ever say there’s a better band then amity .... but architects stay consistent with their genre and they make wicked music ... well done guys !
Sergio Pineda	another one. Hell yeah!!!!!!
Nikita Dream	Отличная работа,вы на высоте,как и ожидалось Спасибо за ваши клипы и песни,вы помогаете идти дальше. P.S. Жду ваших концертов)
Gabriel Martins	Duuuude...! Mind blown! Epic
Trool u	If you need my soul just to keep getting the message out, you can fucking take it.
samuel sanchez	Bruh this is extremely hard 🔥🔥🔥🔥
Nina st	"The hell must be empty, Cause all the devils are here" Damn man,
William Karyadi Johan	INDONESIA BLEAUGHHH MANA SUARA NYAA !!!!!!
Дмитрий Сальников	Как всегда, душевно)
Monasster	band of the year and album of the year EASILY
Raimy Winter	Yuuuush
Brandon Maciel	dat bass be heavy
Klebert Oliveira	Excelente banda
DOPING OFFICIAL	How can someone not to love Architects!? 🤘
Javier Chevory	I thought he was Shaun from Shaun of The Dead
Jon Costello	Holy Hell is an understatement
victowz	Does anyone heard the "click" sound at 2:20?
Rodrigo Colina.	NICE! <3 #Venezuela
AaronLanegan	what language is this?
Gerardo Aguilar	Wow♥
ian roca	Epitaph they're so many great bands on the record. 🤘
Cassper 302	Song is unreal. Just wow.
Stoneman180190	Parkway Drive: we’ve got the metal album of the year Architects: hold my beer
MAS PAYID	in reff like all love is lost
diemonos 28	This song, to me, is the spiritual successor of Nihilist from AOGHAU, even in how it sounds, and as the other comments have pointed out, really does feel like it can fit in that album. But so do the other singles from the album so far!!! I also tried combining both album artworks just to see if they somehow fit, and holy hell, do they fit fucking perfectly.  https://pbs.twimg.com/media/DqpA3fAUwAAcocn?format=jpg&name=medium  I swear this song is like a harmony part to Nihilist. More chillingly is how the lyrical themes really mirror each other, woooh, I shake...
Sinister818 Soul	I'm getting dreamy vibes from this...
Yeni sopiyan	Cool 😎💞💗💗💗💗
Denny FrogUgly	📂Documents   └📁Music       └📁Architects           └📁 Bad Songs                └⚠️ This folder is empty
Murder Mitten	Estos Ctm tienen q puro venir a Chile wn
Miguel	I will not live like a slave!  Architects giving me strength to make these small group of words, become real in my life... <3
Who Died Wolf	YES DAN, HIT THAT FUCKING CHINA DUDE
Iqbal nugraha	heavyer than my problem life
Allove islost	ALL LOVE IS LOST PART 2
sawtoothscream 1	Sounds like royal beggars in many parts.  Really really hoping they let Josh open up a little more.  Seems like a waste to have a guy that can play the fuck out of the guitar and not have him rip a massive solo at some point at least.
Hendro Supriyanto	Damn, Is there any band better than Architects in these metalcore scenes right now?
Fernando Mora Ortiz	No mames, que hermosa canción :')
Andrew Mazza	Fucking brilliant gentlemen!
Joe	Architects is the shit!
