Louis Frost	Merkel...what is it about German leaders destroying Europe
Leo Dlva	We the people need to protect our country  These pests want to invade our country and destroy our society just like they have done in their shit holes.  We need to go down to the border and help our military and the border patrol to stop them. Is now or never. We can not let these savages become another problem for us.
Luis P	I don't think people understand how important president Donald Trump is for America. I trust that in the near future we all learn and fully understand of the so needed miracle we know as Donald Trump not only for America but to the whole world also.
bashpr0mpt	So those words are on a plaque and for some reason no one has taken a photo of that plaque? >_> Could it be that it's not a plaque at all? And it's some shitty art exhibit that's in the art gallery section? Because according to photos I've seen of those words on a wall it's an art installation quoting some book by some guy and not a statement by the EU at all. Don't get me wrong, I loath the EU as much as I loath communists, but fuck you for lying to me.
Pastor Paul D	They are replacing the American people. They claim white men are the biggest terrorist threat to America just like Obama said about our troops returning from Iraq . They see humanity as another commodity to be bought and sold as they deem necessary . They want EVERYTHING of yours even your organs . We are dealing with Satan’s very own worshipers themselves. Be prepared to fight for your lives because that’s what they want YOUR LIFE.
colby turner	There goes are grand childerns jobs.TAKEN BY FREE LOADING BORDER BUMS.
Dot to Dot	The new (or should I say, the emerging social) phase of politics. Nationalist vs Globalist.
Ishmahin Bøhn	-At the entrance of the Visitor Center of the European Parlament, there is a plaque with these words:   "National soverignty is the root cause of the most crying evil of our times..  The only final remedy for this evis is the Federal Union of the peoples."
WJ F	let this be known Donald Trump is full of s*** we still don't have a border wall
freedom fox	PUT RED LIGHTS UP FOR THE RED WAVE
Luther Bryson	Build the wall now
Meaghan Galvin	Doitq! Dark 2 light ♡ Potus wwg1wga!♡!
Ante Kate	Pray to JESUS CHRIST for "our" country America, and pray that HE guides our President Donald Trump, to wrest control from all the minions of Satan., who want us dead "and" in Hell
Lockdown420	Throw all Democrats in jail
Gertrude Tarpeh	EEE...
Blau BayouTM	Free helicopter rides for lefties
Genus Musa	Another left wing MOB heading for America.  The left are a violent, fascist mob. The left are trying to kill freedom.
Beverly Drew	Guess what, all you America-hating, communist Leftists and you so-called world "elitists"?  You, like us, are ALL GOING TO DIE SOMEDAY.  YOU WILL NOT BE ABLE TO TAKE YOUR MILLIONS WITH YOU, AND  YOU MOST CERTAINLY WILL FACE GOD ALMIGHTY.  DON'T BELIEVE IN HIM?  WELL, HE DOESN'T BELIEVE IN YOU AND WILL RIGHTLY CONSIGN YOU TO HELL FOR AN ETERNITY WITH YOUR GOD, LUCIFER.  So, so HAPPY to not be one of you!!!
EvaLolaCookie Arellano	#SorosVanArmy https://youtu.be/pTfwSbctNTg
Must be Trippin	I love this channel.
Richard Morse	Hello Sean. Please allow me to share this letter I wrote to the President about dealing with this caravan. What do you think of this idea? Dear President Trump,  Please consider this fantastic idea I have in dealing with this caravan crises.  Many of these people in the "caravan" are claiming to want "an education."  So, let's oblige them. Give each and every one of those caravaners--babies and all-- a pocket Constitution and tell them "Your education starts here."  Perhaps add a note from the President saying   "You see, we are a nation of laws. And we are not going to break them on your account."  Then send them home.  Can you imagine the potential repercussions of  12,000 central Americans, invading their own lands, armed with the United States Constitution? It could change everything.  Some pocket Constitutions include a brief history of the document, which makes it more meaningful and educational.  Here is one that I like: https://www.constitutionfacts.com/us-pocket-constitution/?gclid=EAIaIQobChMI1JGYvvOm3gIVk8BkCh1zMAwbEAQYAyABEgLCyfD_BwE  Good Luck, Richard Morse
Mjstic Art	Trump needs to take the gloves off, Cancun beach would be the best place for the caravan
Nebadon Lanandek	Soros wrought in hell you dickless wonder piece of shit!!!! FU
hey there	let's use the military to clean up this mess get those people that have stoled George Soros all of them I think that's what most Americans want
Rosy Guerin	They keep using women and children as shields, even though they are mostly strong males!!
Elizabeth Pickerel	Soros’ army can march right back to their home!  Come here legally, be properly vetted & able to support your family.  American taxpayers paid $135 Billion last year on illegal immigrants.
Ani Murphy	George Soros, the wizard behind the curtain 😵
Myron McKinney	I have felt for some time, that the one world government proponent, are nothing but  minions of Satan . America was loosely established on Christian precipices. America for  the most part , has had the greatest influence of spread Christ's teaching to the world.  Not the US government, but American, true Christ followers.. Christ commanded believers go into all the world and preach His gospel. Mr 16:15 And he said unto them, Go ye into all the world, and preach the gospel to every creature. 16 He that believeth and is baptized shall be saved; but he that believeth not shall  be damned. Satan would have you believe that Christianity is behind world conflicts,. He knows you will not read Christs teaching about peace. if you want peace with man, and God ; read Mathew 5-7 It will open your eyes . Most religions will condone wars not so TRUE Christianity. Christianity is a doctrine of peace. and Mt 5-7 will prove this  Visit  " Christian landmark"
william deangelis	Democrats are an organized crime family they don't believe in the rule of law or the constitution
Michael Schuenemann	GEORGE SOROS THE ILLUMINATI - MARXIST AND GLOBALIST PAID FOR THE ENEMY ARMY - HE IS A CRIMINAL !
Blueman Chicago	One of your Most Powerful, and important vids ever Sean.  Americans are so dumbed down, and clueless about the evil (basically the same evil that killed 75 MILLION Christians in Russia after the Bolshevik Revolution) that now threaten our nation. Americans are DUMB.  This ignorance will enslave and kill Millions of us.  They largely never heard of the Bolshevik Revolution, the Holodomor, or realize the threat that we face.  We can only Pray and do our best to enlighten these people.
CTiemann	The symbol of America's greatest "ALLY" is seen on the trucks and some of the flags helping the caravan. https://www.youtube.com/watch?v=6uX6WySXw7M
Randav Law	Soros is the root cause of many evils. Find him, arrest him, try him, execute him, in that order.  Do it!  He is evil beyond comprehension.
Jeff Maehr	THIS IS WAR...plain and simple!!!!!!!!!  What do YOU do if you are being attacked?  We  need to take this to the level it needs to be...
Jasmin Flower	Good to see you calling it what it is, the Enemy's invasion.
guadalupe romero	F it! Call it what you want, but I stand behind the decision for THE WALL! FK SOROS, HIS STUPID PEOPLE, AND THE DEMOCRATIC PARTY!!!!
nick atanassov	Vote RED or you get all this BS under demo/commies.
Lupe Moreno	The Border Is Close. Vote Red   The Left All They Do Is. Lie Lie Lie
Nancy Koernke	All we are seeing is fake Kosher Mafia team Demican VS Kosher Mafia team Republirat  weenie fight. Dangerous and both with the same agenda.  BUY MORE AMMO. Mark Gregory,, Koernke Liberty1775
Bill Fowler	CLOSE THE BORDER AND SHOOT WHO EVER TRIES TO GET IN .
Raffaele Gaudio	lock them up.
teresa woodward	OK caravan........don't do it....don't be naughty....
James Nava	Arrest george soros now. I cant beleive that we allow this scum to live in our country. His own country wont allow him in. He is wanted there. Yet the democrats allow him to live here to use his money to destroy our freedom.
Edward Barlow	Thousands of people do not just all wake up one morning with the idea to walk a thousand miles to another country just because they are fed up with their own country. The USA is under attack and nobody wants to except the fact. What happened in South Africa will eventually happen in Europe and in the USA. Karma is a bitch when it forms part of God’s Plan to restore equality between rich and poor. REEP WHAT YOU SOW.   These people are using Emotional blackmail as a weapon to destroy your country. They are even being paid to do it. You people are being played…… again. Hoodwinked……. Again. Wake up if you are not wise to their shit yet…. Nothing is what it looks like. Your biggest enemies are your own STUPID, spineless politicians and the deceitful ones doing all this.   Hopefully we are all going to be awake one day and stop all this bs.     You do not need nuclear missiles to destroy the USA. You just have to pay South and central Americans to walk up North and do it for you cheaper than any army. Nothing will be able to stop them when they are properly mobilized or motivated. They hate Americans and this is a weapon you cannot fight because they are not “armed”. USA will fall. It is only when?   These slow-moving caravan missiles being fired now has the potential in the long run to do more harm to the USA than a nuclear missile. They also have an endless supply and they can breed like flies once they have settled in your country with endless repercussions. This is a weapon like no other and you are defenseless against it because you are too civilised. This is why all civilisations fall to barbarians and gets over-run eventually. REAP WHAT YOU SOW.
Dave Thompson	In speaking directly to the people who hate Trump and want a blue wave..you have been manipulated at on a grand scale..the left had become so much more than a party of backwards logic they are enemies to everything you love and using the media and your guilt ridden minds to further the agenda of destabilizing the US...the last thing in the way of world control. Wake up before it's to late to this act of war.
Mary Fowler	The liberals Democratic are sick sick disgusting Joe Biden is the biggest pedophile. Just Wait and see, this is nothing but a invasion by George Soros with the help from the Democratic politicians. he has side it look up the Videos yourself look up the video of Hillary glorifying George Soros. The lift is the enemy from the inside. It was our own government that was destroying our country for their own gain. Go vote kick all these SICK SICK ANIMALS OUT.
Dixie Gillette	I've seen pics of these people burning our flag while they are proudly waving theirs...I think they are planning to invade our wonderful country.
Randy Randy	Sheeps spend there whole life scared of wolfs only to be earn by the Shepard lol
Susan Merrill	This PRESIDENT DOESNT PUT UP WITH BULL💩 AND TELLS IT LIKE IT IS....THIS CARAVAN WILL BE STOPPED  UNDER THIS PRESIDENT....
Nancy Hughes	Stop the caravans at all cost, shout I. Site, Trump, Our Military/Marines/Alm Soldiers kn duty Nos, Boots in the Ground
virginia naz	dawn  of   WW3,, be prepared,, world is run by  narcissist poltcans and bankers of 1% elites,,so scary and sad
Lori Benedetto	Why is Soros not being treated like "so called" Ivan the terrible and extradited for war crimes?
Skippie James	Since we as a whole people have been betrayed by the people trusted then we must open our eyes to see  destruction of us is their plan I say together we stand no matter. If America was not a great country no one would be trying to come here. Love ya
Richard Noggin	"They" create the problem, then "they" provide the solution. It's a old trick to genocide whitey.
Rosebud	THE CARAVAN/INVADERS need to be destroyed.  It will be US or THEM.  AMERICA FIRST ALWAYS and FOREVER
Raymond Duncan	What about those Active Denial Systems?
kay manning	Stop the invaders sweet Jesus
Cousin Louie	let them invade usa....all the planet we'll ENJOY watching this...you brainwashed OBESE rats...:)
Cheryl b	George Soros always pulls this shit.
F. D. R. / F. D. R.	Could this be is something that might come from the mind of Soros?    Also the one negative person not targeted: Chuck Schumer?   He's been rather quiet except for again criticizing Donald Trump, this time for these vicious hate mail attacks. Why is he taking a background position now?
Juan Manuel Cardona	Open fire on this people on sight, this are not poor hungry people, this are invaders, most of them probably gangsters, criminals, thiefs and rapists, they need to be stopped
Jerry Harrell	As always thank you Shaun for all you do. Great analysis as usual. GB <><
Mylie Moo	This is how South Africa fell to its invaders. Dear god don't let it happen, S Africa in ruins, Europe is falling & now eyes are on the US.
ynreflect	Thanks for the update. I have to take issue with one thing you said, however. You called a deep state figure a Zionist puppet. The deep state, which supports globalism, is also a player the efforts to take Israel apart and to prevent Jewish sovereignty in Judea and Samaria. If we are in favor of nationalism, then that includes Jewish nationalism in the Land of Israel. So how is opposing Jewish sovereignty a Zionist plot?
Gramma Bear	CALL TO PRAYER FOR EVERY CHRISTIAN IN AMERICA:   In Jesus' name, turn back now, you will not come in  !
kyle skinner	Thanks man  You are a re-assuring voice as I sit here , an old man on a hill in central Oregon looking at the mountains and the Deschutes river basin }  I have all this beauty but I know their is a bunch of ugly I want to die a happy man , knowing the next generation might awaken to the reality that GODS RULE is the only rule and the only hope for a civilized  people to progress in peace  Why do people shun beauty ?  why do they shun love for each other and everyhing beautifull and wondermous upon this earth  It's nuts and I don't get it.
Gilbert Rivera	We are being Replaced!!! America is behind it! Do you actually believe they can't stop it?? These people ARE changing America! You have to change the Constitution. The first thing that goes is Civil Rights!  Remember it was America that Protested? Thousands Protested FOR immigration!! Now they want it stopped?? This will not stop. Remember these people are committing a CRIME!!!
Hasnah Abdull	Same old Story.just watch nothing will be done about this...President Trump you were elected to stop this..Soros is not even American and he has got the Power to do this.? You failed by not locking the Bastards up.You will loose because you didn't do right by America...👹
Apache White Crow	There are over 250 underground tunnels between Mexico and America boarders. You really think your going to stop the Mega Refugees Conveys - determined to cross over. Each refugee in that mass movement know death in the face, from the country they are willing to leave behind. You think after walking hundreds of miles to reach Freedom, your little boarder barriers are going to stop the mass? Some don't think so.
Barbara Kelly	aND SHE LAUGHS AT WHAT SHE DID TO GADAFFI. --------SHE IS THE MOSTB DISGUSTING PERSON  i HAVE EVERY SEEN OR READ ABOUT.!!!!
MFB	Are there tunnels for trafficking going into Texas? Very possible.
John Bergen	DO TO SOROS WHAT HE DID TO HIS OWN PEOPLE IN W W 2 .
J. Muller	We are being invaded we must get out and vote to save this country vote  red.
felix castillo	Hahahahahha this is stupid! God damn flatearthers! Sure people travel weeks on foot being subjected to be robed, rape, murdered and for what? A couple of bucks? Sure! These people are the result of the corrupt pieces of shit governments the CIA has forced into Central America. The US broke those countries decades ago with war fixed elections and never-ending debt. There is no illuminati-freemason-deepstate-anunnaki conspiracy behind this, only greed, corruption and irresponsibility.
Carolann6081	This is the effect of the original cause. The Federal Reserve and IMF which is the BIS creation of the “boys in Basle” decided this effect over a century ago. Countries throughout the world have been systematically financially targeted and destroyed by a debt money system guaranteed to cause bankruptcy of targeted countries. USA [1933] Greece, Libya, Iraq, Venezuela, Syria, and a host of other countries in the last 100 years have been systematically fleeced and destroyed. US was deliberately deindustrialized beginning in the 1970s [CFR, Bilderberg, Trilateral et al]. This was all meticulously preplanned in mason lodges, using worldwide network of oath chained “brotherhood” foot soldiers, under omerta, to the banking cartel. “Parties” and “personalities” are a stall. Strong vibrant churches and good governance have been nullified, and the populace stupefied.   America is next for collapse since we are now on the same precipice as the other countries. When the monetary system collapses, people in America are going to be very hungry too. PTB did it in 1929 and they are in process of doing it again. Hyperinflation has been a very slow “slide” over decades, but what’s coming is going to be catastrophic.  The “leak” politicians should have fixed decades ago is now a geyser. Our courts have been corrupted, our money system has been a scam for the last 100 years, and our politicians are special interest elected.   To turn this disaster around, all mason lodges [all exclusive "invite only" brotherhoods] in this country must be immediately closed. These secret societies are the root Trojan horse within both the Church and the entire social structure.  With them still open for business the Trojan horses are roaming free to do as they please with no Accountability or restraints. Concurrently, it is essential to return to our Constitutional monetary system. Money runs the world and buys the agents who push the agendas for the top tier. No law can defend against the lure and attraction of lust for lucre. It is the glue that holds the entire pyramid together.
777gailzy	GOD NEEDS TO SEND AN ARMY TO STOP THEM. I'M AFRAID FOR PEOPLE BUT I TRUST GOD. GOD NEEDS TO STOP THEM.
xlightable	It is controlled demolition and the top will profit again and regain new control  sacrificing some of their own in the name of the NWO.
Michele  Mcguire	Harmony? Not for us! But for the LUCIFERIANS & those who blindly follow!! WAKE UP!!!
Nes	The Roman empire protected their walled borders from foreign invaders..
DAVE the DUDE	No borders no private property
Royal Satan	GO DIE NATIONALIST SCUMS!
James Lee	Trump Trump Trump Trump Trump Trump Trump
Rio Thomas	These people are being led to the slaughter. Ever seen those old West movies where the cowboys chase the cattle to the edge of the cliff? The evil game is on. They want to provoke a violent event to pull at the heart-strings of Americans who will see this as an abomination. Coincidence? No i think not. But, I would keep your eyes open wide, there could be another action on the other side of this that we do not see. Stay aware and prepared.
Stephen Palmer	Arrest Soros for sedition. Force Jewish lobby AIPAC to register as foreign agent to prevent them from bribing US politicians. Hold Jewish groups ACLU, ADL, SPLC, AJC accountable for sedition and treason. Break up the Jewish monopoly of the Federal Reserve and mass media. The US, EU, Canada, Australia, New Zealand have been hijacked by the Jewish Left which is pushing for White genocide and the destruction of nation states for a single global police state with open borders and plural society. President Kennedy tried to stop the Jews but we all know his fate. Time for the Jewish Deep State to be called out and held accountable.
kfja1111	Hey SGT, great work. But why do you always focus on Soros? You have never mentioned Buffett. Why?
Jeff Simmons	Rubber Bullets baby !
paul baltuta	manhatan  Zionist cabbal  mafiea Rockeffeler
MR NPC	this video is Xenophobe....running Soros.EXE ... you are bigots, anti immigrants and racists!!! error system failure detected rational thought detected error seeking safe space.... system shutdown.... ................hack successful ...Freedom.EXE running ....DESTROY THIS CARAVAN AND ARREST SOROS
Roger Moore	So Africa is for black people only, so White people must leave. What does that make Europe?
IamPreTjenE	Stop these foreign invaders and NOW
Robin Wilkins	Lord Jesus, help stop the plans of the wicked.  Destroy their plans and let their money go to waste in Jesus name.
Mike Whitaker	should March down to Sorrows house in New York City and protest him there lots of noise
Tink123 Tink123	THE PAID/FAKE HUMAN MEXICAN CARVAN ISNT EXACTLY WINNING GLOBAL SYMPATHY BY DECLARING POTUS IS THE "ANTICHRIST AND WE COME TO FIGHT!".....THATS A DECLARATION OF WAR!!!!!.....SEND IN THE ARMY.....SET A SHOOT TO KILL POLICY RE ANYONE BREAKING THAT BOARDER...BACKED BY MILLIONS OF PATRIOTS STANDING BEHIND THEM SAYING "GO HOME YOU PAID SOROS TROLLS!"....USA HAS TO ACT FOR ALL OF HUMANITIES SAKE!!!!...THIS IS NO LONGER A JOKE!!!!!!
Neuronaut Alpha-1	Lock and load people.
Jeremy Watson	It's not time to fall to the enemies that divides us into a radical left or extremist right political party nation, it is time to meet in the middle, compromise and work together to protect our nation, restore our one of a kind Constitution to its origin before all the amendments that occurred after the civil war (America's socialist revolution) when voting rights changed to all people regardless of nationality or political position, even to non property owners and Communists, whom have no invested interest in the nation as they are able to take positions of policy making or high ranking positions in organizations of strong political influence  so to implement policies to destroy and break America global power. Civil rights and affirmative action  of the 60's also helped influence the infiltrate and destroy from within by these traitors. Time to unite and fight the enemies of freedom, liberty and right to affordable property for the American dream!!!
rtnrdny	google the Preston James VT article on DHS: "The New American Gestapo" (direct link blocked by nazi-book). DHS is supposed to enforce our borders but DHS is actually designed to do just the opposite. This is why Trump has to send in the military to do the job. here's another easier read on the subject: http://themillenniumreport.com/2018/10/even-with-obama-gone-soros-still-controls-the-dhs/?fbclid=IwAR0jFPn_KCzfGhGAGhdjPMhlE81AIAgNq7qijhxIPrUm6ACJiY_oF0enZM0
Stan Hill	Why hasn't HE BEEN TAKEN OUT....
Avery Ferreira	Ja, its not about refugees. Then Mexico would be primary destination.  Its invasion.  Keep them out at all cost. Your existence depend on it. We had the same scenario 30+years ago. The West pressurised and sanctioned us to the extent of self sustainability but because we wanted to be politically correct and peace loving we handed it over to them. They were considered "Heros". Whilst in public view they portrayed a likewise roll but we are now, 25years later paying the price.  You need to keep them out. Even if it means full confrontation.  For your children's sake. Do not take it lightly.  God protect and guide your leadership and all your friends and family.
Brook Tamu	Why are demoncrats doing such horrible acts to the American people? 😢 Open borders will cause millions of terrorist,  rapist, murderers and child traffickers to pour into the U.S.A borders.  So sad how America is Hated by the LEFT.
Laurie Darrow	Fuckin monsters. Hillary, Obama, need to be hung!
Alejandro Perales	This funny 😂😂😂
000 poco777	nothing will happen its all dialogue
Charles Anthony	You didn't show any proof that Soros is bankrolling the caravan. I saw a man passing out money but no proof for why or who's giving it. What's going on here? Are you trying to cause trouble? Is that why SGT report uses letters instead of a name. If I was putting out this junk I wouldn't put my name on it either. Oh, and please buy my bitcoin.
Tony Robinson	Vote for socialism, flee to capitalism. Vote for socialism.
la cuccaracha	When the Hondorans show up at the border there will be a showdown like there was when there was an invasion before. Citizens were blocking buses that Obama set up to take illegals deeper into America.
Maria Juarez	50,000 Illegals Coming to USA now!! http://laverdadconcristo.blogspot.com/2018/10/50000-illegals-coming-to-usa-now.html
William Schmidt	Trump, trump, Trump !
Geoff Gregory	The caravan group are plain clothes Soros, deep states army, the women only 20% looks all used to be well homed...., they are wives of some men in the caravan. Why soros need these few  women with the army? To act as human shields, like ISIS did. Once they get inside boarder, Guns and ammunition are already secretly arranged for them.... And they will start shooting, but if US army fight back, they will b accused of killing women and children... These are very sick minded women....they are part of the plan...some of them are US citizens. Or Soros army, That's why they cover their faces.....it is extremely urgent issue for US now.
Nelson Toondrawer	In Mexico age of consent is 12!! Some of those 2,000 unaccompanied minors among them don’t stand a chance. Our Beloved President Trump is fighting sex trafficking. He has an EO out on it since Dec 21, 2017. Check at whitehouse. Gov
Faith Hunter	The bible says about the enemy "They run when no one is chasing them".  "They dig a ditch for us and they fall in it". Keep praying for our President folks. These people have no place to run and no place to hide from God our father. Keep posting the truth Sean and may God Bless you for your love for the truth.
Cynthia Besson	As always...we adore you PATRIOT!!!
