Yang Dezhong	Nice try Soros and I really wonder how much money you spent you fuckin commi!!!
IAN BANNER	Break down families, break down countries, and out of the ensuing chaos?
Mickael Williams	DEMACOMIES
jfowlds	Awesome! #LockThemAllUp and throw away the key. #VoteRedToSaveAmerica  #DemocratsHateAmerica #DemocratsAreEvil
Yahya Kodesh	Third world people (below 90 IQ) make third world countries. If they are not stopped, the US will resemble the barrios of Mexico City.. the favelas of Rio...
Greg Wood	Demonrat NPC's really really really SUCK!!!  "Broken eye socket.  Another fella,  Another restaurant,  Another day."  https://youtu.be/DtdWpBXrk3Q Colin several times a day post what MSM = mossad satanic mitigators never want you to see or have any knowledge of its not a part of white genocide agenda IN JOY:!.... ColinFlaherty | Minds https://www.minds.com/ColinFlaherty In almost every major over several 100 thousands of population these are demonrats operated and controlled shitties.Defiled by globUSlust turdworlders, wailfair parasites ,((( sjw satanic Jewish women ))) jezebel control apparatchiks.White token soy goy castrated and cucked use full goy idiot tools, sold out for benefits/pensions. White plight flight impoverished ratholes turned over to Satan's mob= minions of beelzebub, poop mapped, crapped and scrapped beyond restoration:!..... Mobs = Minions Of Beelzubub are globs of U.S.lusters hell bent on destruction of the apple of His eye..Bet duh Farm,Jesus is gonna cleanse the land of America (Amari= Heaven- Rica=kIngdom ) America is where Jesus Zion/ Holy City Kingdom will descend upon the earth a city on a hill you bet.Cleansing the country from the mountains to the valleys, from sea to shining sea removing~rapturing the wicked and ALL that offends = Prov. 2-22     But the wicked shall be destroyed from the earth: and they that do unjustly shall be taken away from it. Father/ Jesus is in control His plans/will is coming to pass, because of apathy vanity and idolatry only He knows the Righteous Judgement Merka so richly warrants. No one ever suggests that National Hispanic  University in San Jose, California would benefit from  the diversity of having non-Hispanics on campus. No  one suggests that the Black Congressional Caucus or  the executive ranks of the NAACP or the Mexican-  American Legal Defense and Educational Fund suffer  from a lack of diversity.   Somehow, it is perfectly legitimate for them to  celebrate "homogeneity." And yet any all-White group,  a company, a town, a school, a club, a neighborhood,  is thought to suffer from a crippling lack of diversity  that must be remedied as quickly as possibly. Only  when Whites have been reduced to a minority has  "diversity" been achieved.   Let us put it bluntly. To "celebrate" or "embrace"  diversity, as we are so often asked to so, is no different  from "deploring an excess of Whites."   In fact, the entire nation is thought to suffer from  an excess of Whites. Our current immigration policies  are structured so that approximately 90 percent of our  annual 800,000 legal immigrants are non-White.   The several million illegal immigrants that enter  the country every year are virtually all non-White. It  would be racist not to be grateful for this laudable  contribution to "diversity."   It is, of course, only White nations that are called  upon to practice this kind of "diversity." It is almost  criminal to imagine a nation of any other race  countenancing blatant dispossession of this kind.   What if the people in the United States were  pouring its poorest, least educated and most criminal  elements across the border into Mexico? Could anyone  be fooled into thinking that Mexico was being  "culturally enriched?"   What if the state of Chihuahua were losing its  majority population to poor Whites who demanded  that schools be taught in English, who insisted on  celebrating the Fourth of July, who demanded the right  to vote even if they weren't citizens, who clamored for  "affirmative action" in jobs and schooling?   Would Mexico, or any other non-White nation  tolerate this kind of cultural and demographic  depredation? Of course not. Yet White Americans are  supposed to look upon the flood of Hispanics and  Asians entering their country as a priceless cultural gift.  They are supposed to "celebrate" their own loss of  influence, their own dwindling numbers, their own  dispossession, for to do otherwise would be hopelessly  racist.   There is another curious asymmetry about  American racism. When non-Whites advance their  own racial purposes, no one ever accuses them of  "hating" another group.   Blacks and Jews can join "civil rights" groups and  Hispanics can be activists without fear of being branded  as bigots and hate mongers. They can agitate openly for  racial preferences that can come only at the expense of  Whites. They can demand preferential treatment of all  kinds without anyone ever suggesting that they are  "anti-White."   Whites, on the other hand, need only express their  opposition to affirmative action to be called haters.  They need only subject racial policies that are clearly  prejudicial to themselves to be called racists. Should  they actually go so far as to say that they prefer the  company of their own kind, that they wish to be left  alone to enjoy the fruits of their European heritage,  they are irredeemably wicked and hateful.   Here, then is the final, baffling inconsistency about  American race relations: All non-Whites are allowed to  prefer the company of their own kind, to think of  themselves as groups with interests distinct from those  of the whole, and to work openly or group advantage.  None of this is thought to be racist. At the same time,  "Whites" must "also" champion the racial interests of  non-Whites.   They must sacrifice their own future on the altar of  "diversity" and cooperate in their own dispossession.  They are to encourage, even to subsidize, the  displacement of a European people and culture by  alien peoples and cultures. To put it in the simplest  possible terms,   White people are cheerfully to slaughter their own  society, to commit racial and cultural suicide. To  refuse to do so would be racism. Of course, the entire  non-White enterprise in the United States is perfectly  natural and healthy. Nothing could be more natural  than to love one's people and to hope that it should  flourish. Race Mixing an abomination before God http://fathersmanifesto.net/racemixing.htm.  Heathern hoards have stolen your progeny's inheritance and your heritage,WASP honkeys it really is alright to be white. Only young women and men yes males and females the only binary Truth option capable of being used in the original process of conception/life.Should be trained up according to Scriptural Commandment by their parents NOT THE STATES OF INSANITY. Females taught to keep legs closed till wedlock/ notice non state licensed marriage and boys keep pants zipped and up. When this isn't done you have the present day situation in America.This is a ( gift/present ) from your creator to repent turn from your wicked ways,and then he'll heal your land/country=America or keep hurdling headlong into defilement dis ease death and total destruction.There it is set before you this day life or death, ps bye duh bye He your creator knows ALL [ especially your supposed free will choices ] its called omniscience @ omnipotence / ALL KNOWING ALL POWERFULL,its His story start to finish even your perceived choice is VANITY Praise Him your Creator for All things ALL of creation does you'll feel mo better take a cookie NEO..... A great vid to send to lefturdelled ass o see ater's & drink a toast with libturd tears cheers:!...   "MIND BLOWING!!  Donald Trump Will NEVER Be The President - They Never Thought She Would Lose" on YouTube https://youtu.be/6XHwDsN9BzM
Harris Anne	The DNC is the party of HATE. Time to #WALKAWAY it's never too LATE. The Dem party openly supports the MOBS, While President Trump is bringing us JOBS. NO to Leftist libs on meltdown MODE, YES to the conservative right, it's the Mother Load. The damaging Dems can only Lie, cheat & STEAL while our GOP contenders are fixers they can HEAL. The Dem poster children, Fienstien,Schumer, Pelosi & Waters are OK with illegals raping our daughters.  The Republican party will bring us RED WAVES while DNC, Deep State evil slithers in their CAVES. Obama the puppet put America in the DUMP. We finally have a President, GOD BLESS TRUMP!
Rolly Hui	https://www.youtube.com/watch?v=-9msE7-ydts
Meat Potatoes	well trump himself said he was a globalist and a nationalist wtf
lukebable	I think Bestiality should be legal....the only caveat in legislation should be wild animals only....
Stijn Voorhoeve	The Nazi EU dictatorship must be utterly destroyed and politicians and lawyers who conspired to cheat us into this evil dictatorship should be dragged to court for high treason and crimes against humanity before the EU SS army  starts marching . Support from the Netherlands ! Freedom or death !
LEH50	But Soros son is just as bad - don't know how deep or wide his family is.
Dustin	We need to stop Democrats, at all costs.
Richard Mahoney	2020 victory theme https://www.youtube.com/watch?v=nBlYlSs2fIU
AE H	We need a full millitary invasion of their countries.
John Revere	(FATHER,  JEHOVAH GOD,  I PRAY AGAINST THESE EVIL MEN  AND WOMEN,  EVERY EVIL DEMON SPIRIT BEHIND THEM AND EVERYONE UNDER OR CONNECTED TO THESE PEOPLE...  GUILTY BY ASSOCIATION.)  So called elite globalist, luciferians inbreeds...   1. lord Jacob de Rothschild 2. His son, Nathaniel Rothschild 3. Baron John Rothschild 4. Sir Evelyn de Rothschild 5. David Rockefeller 6. Nathan Warburg 7. Henry Kissinger 8. George Soros 9. Paul Volcker 10. Larry Summers 11. Lloyd Blanfein 12. Ben Shalom  The 13 illuminati family’s which are luciferians: 1. Freeman 2. Reynolds 3. Bundy 4. Astor 5. Collins 6. Kennedy 7. Du Pont 8. Russel 9. Onassis 10. Rockefeller 11. LI 12. Van Duyn Also, the Merovingian family And the Rothschild family  The house of windsor, The evil agenda under the catholic leader, the ancient beast, Pope Frances and their movement, Every king,  queen  and government,  under the influence of the cabal  and luciferian occult.  The Obamas,  The Bushes, The Clintons,  And all the billionaire,  millionaires,   luciferian’s,  and every evil mob individual underneath these blind guided demons.  May they ALL lose their PEACE.  Lord JESUS,  remove and destroy ALL those who are corrupt and ungodly!    I command the Host of Heaven to go now, pull down every plot and plan of satan and his army,  pull down the strongholds get them out-of-the-way so that the people of YOUR world JEHOVAH GOD can be free to run forward and not be further delayed any longer in achieving their full destiny.   Lord JESUS,  jam the enemies radar,  and his frequencies...  I come against every level  of witch,  warlock,   satanists,   OCTOBER 20th witchy curse gathering in New York,  and everyone under these luciferian minions,  may it come to NOTHING!  But for them,  a front row seat,  right up front,  in hell.  May it be like a boomerang,  every curse throne,  every curse cast out,  come back upon every witch and warlock 100%  No one will come to harm from the enemies army...  Every evil attack,  debunked,  BUSHWHACKED!  And made a mockery of...  Every attempt,  Ruined!  Dismantled,   And made fun of.  WAHOOO!   Drug trafficking warlord,  high secret society,  high-ranking demon,  every demonic government officials, every producer,  or director working in moves,  music or the arts of any kind for satan, rather that be in,  music,  acting,  modeling,  dancing,  comedian,  news weather reporter,  news reporter,  private owned businesses,  every evil attention,  platform,  strategy,  maneuver,  any intent coming from anyone,  woman or male working underneath these devil worshippers.   I come against  the illuminati  and the cabal,  the kabbalah  and it’s Influence and power over all of hollywood and the world. I speak and take power over every corruption to purposely destroy in making America great again and the world.  To name a few... (THE ILLUMINATI FAMILY,  The LUCIFERIAN ACCULT,  THE ZIONIST, THE SO CALLED INBREED ELITES, THE CABAL, THE KABBALAH, THE UN, PLANNED PARENTHOOD, 501C3, THE JEZEBEL SPIRIT, DEEP STATE CHURCH, BAAL SPIRIT, HUMAN SCARIFIES, DRAINING THE SWOMP,  (rather draining the sewage)  THE GLOBALIST,  THE ANCIENT BROTHERHOOD, THE ONE WORLD GOVERNMENT, CLIMATE CHANGE, THE DEEP STATE, THE REAL SECRET SHADOWED GOVERNMENT, THE NEW WORLD ORDER,  (deep state crimes) THE FRATERNAL ORDER OF POLICE, H.A.A.R.P, MANIPULATING WEATHER EVENTS,  VOTER FRAUD, FRAUDULENT VOTE, EVIL INTENT PROFESSORS IN UNIVERSITIES, TREK PHONES, CHEMTRAILS, THE BOHEMIAN GROVE,  WALT DISNEY, MICKY MOUSE, VOODOO DONITS PEDOPHILIA,  CHILD TRAFFICKING, PEDOVORE TRAFFICKING, SEX TRAFFICKING, HUMAN TRAFFICKING, DRUG TRAFFICKING,  ALL ORGAN TRAFFICKING, HOMELAND SECURITY, THE PENTAGON, THE IRS, THE FBI, THE CIA, THE NRA, GOOGLE, FACEBOOK, TWITER, YOUTUBE, CNN, CBS, NBC, MSNBC, ABC, TIME WARNER, AOL, COMCAST, And any other fake news conglomerates. PIZZA GATE, WHICH IS THE WORLD NEW ORDER, PEDOPHILIA SEX MURDER SACRIFICES,  AND EVERYONE CONNECTED TO THESE EVIL SECRET SOCIETIES,  FAKE NEWS PROPAGANDA,  THE BOUGHT OUT, SOLD OUT MEDIA, AND THE NOT SO NEWS WORTHY NEWS-PAPER CONGLOMERATES.)   LORD JESUS,  may every precious soul,  every innocent souls blood crying from the grave,  be vindicated...  Thank YOU for the arrests of 3000 elite pedophiles,  LORD JESUS,  keep them coming in the mighty name of JESUS.  May everything they did to these innocent souls in the dark be exposed and heaped on them 100% ...  and cast it into the light for the whole world to see.     I’m coming against pure evil,  the strongest of them all from all sides trying to attack,  manipulate,  lie,  connive,  deceive, impeach and destroy President Trump’s administration, his agendas and they’re beautiful families.  And that of Brett Kavanaugh  and his beautiful family too  LORD JESUS!   I pray Lord Jesus that you protect the next supreme court judge that President Donald Trump pics...  put in place a hedge of protection around them and they’re beautiful families. Get them ready for a spiritual battle which will take place. And that of our police force...  I come against the spirit of lying,  out right lies making evil good and good evil... And of spirit of murder coming against Israel and  GOD’S people and  the spirit of suicide of epic proportion’s.   The murdering torture and cannibalism of babies, infants,  children,  girls,  boys,  young adults,  men and women and selling millions into sex-trafficking,  ritual sacrificing,  unborn babies, planned parenthood,  (and all who oppose this, all for the sake of piecing and upholding the appetite of their fake, deity, died baal god.)  I come against the spirit of homosexuality in Tel Aviv, Israel, being the homosexual capital of the world,  I come against that foul spirit in the United States and the world.   And the evil luciferian corruption going on in Mexico,  Canada,  China,  Iran, Honduras,  and Saudi Arabia,  We are not to separate Israel to a two state solution,  JEHOVAH  GOD won’t tolerate that.   FATHER,  I also pray for the civil unrest  in America,  Israel, and the world that may occur in the following months and years due to a “Red Tsunami Typhoon Take-Over”   And the arrests of the luciferian occult,  no matter the means of evil,  rather it be in sleeper cell hi-breed super solders,  any created demonic creatures entities the luciferians occult tries to curse  and attack us with.  Also their mind games,  women against men and men against women, pitting us all against one another,  using the lust of money in hopes to destroy everyone in the world but themselves.   ABBA PAPA protect YOUR own  and that of those who are coming into YOUR flock. OUR FARMERS  AND RANCHERS, Police force,  Firemen,  high schools,  grad schools,  elementary schools,  preschools,   day care centers,  orphanages,  boys town, churches,  hospitals,   the zoo’s, shipping loading docks imports,  all our oil rigs,  and businesses.  And everything else that I have not mentioned by the power in the blood of JESUS, we are covered in YOUR mighty name.   FATHER I ask YOU now,  to allow YOUR SON JESUS to shine brighter than ever before,  (HE is center-stage,  the center of the Cosmos.)  Let HIS destiny be made known more than ever before,  that YOUR love rules by Him and through Him and not the devils scheming ways.  You can’t say evil without saying the devil’s name.  FATHER,  nothing in this world can go unnoticed or be allowed to flourish without  YOUR consent,  YOUR knowledge,  or YOUR approval.  May YOU JEHOVAH GOD reign forever supreme...  ABBA PAPA,  DADDY,  FATHER, GOD’S NOT DEAD!   BEAUTIFUL HOLY SPIRIT,  My best friend,  have YOUR way,  do what YOU do best in bringing about this great habitation,  the great awakening.   JESUS,  may YOUR LIVING,  LOVING BLOOD sacrifice not go unnoticed...  JESUS,  YOU are the the KING Of KING’S,  and the LORD Of LORD’S,  forever and ever,   AMEN,  and AMEN!   Go Get Um Guys!                             WAHOOO!                                 <•)})><
James	The lgbt community has nothing to do with politics or the deep state. That’s just going a bit o crazy there Sean. Don’t spread that hate. Just stick to the facts of what people did to the American people, don’t attack innocent Americans just for being who they are.
Jared Caldwell	Gun them down?
Antoinette Novello	If these Savages  manage  to  get  through, many  people  will  die and hopefully  it won't  be the American  people.😕
Good Faith	Dark state arrests will happen this winter because it will be to cold outside for any public uprisings. So don't let the demons scare We the people. Any questions?
Devoted To Christ	Sad to say but the idiots don't realize it is their idiocy that leads to one genocide after another, and the cycle keeps repeating over and over because  the demonic globalists will not allow any civilization to become intelligent. Am I saying these people are not intelligent. I am saying they are lightyears away from awakening because they have been even more dumbed down than Americans.
Jean Burk	H was probably screaming at her driver to hurry or something.
redbeard	Trump rules so fucking hard. Trump for Emperor of Mankind! Fuck illegals & fuck Soros. Let em fuckin drop dead.
Everyday Joe	Isnt that what guns were invented for???
0 neven	karma is a bitch with the name HRC, that witch will get all she deserves, POTUS POTUS POTUS will put her in jail!!
Big Dog Trump Supporter	Someone Should Talk Our President Trump To Ask Him Please To Fire Sessions, Rosenstein and Mueller!!!!!!!
Peyote Pete	In real time.... I like to think I'm in my prime. I don't think I could EVER March that far in 2 weeks! I don't care WHAT YOU CALL ME! THIS STUFF AIN'T RIGHT!!!!
Radha Das333	Let's get them!
liabilitymate	Just shoot them, they would you...
john d Cramblit	I keep reminding people that Hillary committed treason on national tv during her debate against candidate Trump when she told the everybody how long it takes the U.S. to respond to a nuclear threat. People all around the world heard and saw her do commit treason, it is undeniable and can't be argued because so many people witnessed her committing treason. Yet people aren't going after her for it?? She truly is untouchable.
FrNK BLnT	Sound likes nazi propaganda
Renny Zero	Vladimir Putin?
gerry colombo	Soros  needs to be sent back to hell where that Ratt came from 🐀
t lares	Oh my lord , she is not human , nobody in world hisitory has anyone laughed at the death of an adversary ,im totaly blown away that the democratic party even fucking is still around .
Willfully Deplorable	Daang Son you're getting good at your delivery man.. Great Vid!!
marcel alfa	Hopefully Soros Family also the Clintons Bushes and Obamas will hang asap....!!
John Farley	The globalist plan is to flood the World with migrants to mix the races until we are all the same. One world order. One unelected  Government, Agenda 20/30 in full. 90% population reduction. Everyone living in mega cities travelling underground, enslaved people to slave for a few elites.  protest and you are disappeared. Oh I forgot, a vote for the Democrats and this is what you are voting for.
Keith	Well done, thank you.
Lead Pill	The USA needs to take Soros out. He's screwing with the entire planet. What he's doing and his organizations are doing is terrorism by other means. Its Satanic.
BDM	then why is 5g still rolling out, only arresting the minions no big names will go down, been hearing about these arrests for nearly 2 years, not going to happen.
Shamma Problamma	How about the American people physically stop the caravan, take this mess and its Leftist Marxist MSM fallout out of Trump's hands as it were. If the Left can organize idiots clawing at Supreme Court doors and stupid pussy hat protests, why not 1000's of Americans organize on the border to defend it... ask not what your Country (AND President) can do for you...Some of us have sworn an oath to this Country, emphasis on enemies foreign and domestic. It wouldn't be the first time that such an endeavor occurred. Sign me up.
j m	Trumps doing a fantastic job and they hate it go trump drain the blood suckers from the swamp. p.s can you out some corrupt aussie politicians theres plenty to choose from say no to 2030 agenda
M Krafts	I'm just gonna be honest with you man.. The problem isn't globalism. The problem is globalism under Lucifer. If the world wanted to unite under God.. your anti-globalist spiel wouldn't be so righteous. Lets remember the real issue.
John Connors 111	God is not mocked. What these beasts sow they will reap. Peace. Jc.
Oddvar Stallemo	What is wrong with George Soros anyways? It's like the leftists who go on and on about how bad the Koch Brothers are.
Orion Michael Guy	You want to know the real truth about what is happening on this planet? watch this video - no dog and pony show - just the real truth https://www.youtube.com/watch?v=NxC03gvq108
Roselyn Caro	Please Drain the Swamp . God bless Donald Trump our President.  May God give our President the wisdom to fight these who want to destroy America..Amen
Paris Iscalling!	Controlled perpetration at its finest! We are being attacked! There are more males then female and children in that pack ! All By Design ! U N ready to pounce yes! It doesn't get more obvious what the left is trying to do!
Tom Sapena	Put the military their Abrams tanks and Apache helicopters and is below them to shit
Daniele Lee	Vote Out Blue on November 6,2018.  Drain the BLUE VIRUS!! God Bless America! God Bless Trump! God Bless Pence!
J. A.	Look at that huge caravan of Demonkrat voters.
Doyle Trey	There will be a lot of zip ties used... And maybe we will see that sonicwave crowd disperser in use. No need for another shot heard round the world.. Keep watch.
Jackie Traverson Designs	I Thank God for the clarity of this channel.
Douglas Moomey	you guys rock. INFOWARS...COM
Ed Reynolds	Georgw Soros and everyone associated with him need to be neutralized immediately. Whats that line in Apocalypse Now,  " Terminate with extreme prejudice ". Someone needs to do it and who ever it is will be held as a world hero. This Nazi Soros is the worst type of evil. https://www.youtube.com/watch?v=zVmQ05J9tHs
Chazreal	Soros is Rothschild's NWO lackey most likely along with the Koch Brothers.  1984 wasn't an instruction manual, however, Sun Tzus "The Art of War" was some much ignored literature from these globalists.  Love, Luck, and Lollipops, cheers!
Brent Tanner	Left/right paradigm = false narrative   One either serves God the Creator or the Beast. What the "tribe" have planned for humanity is grotesquely dire.  https://www.youtube.com/watch?v=h-qzqOhDc_0    Key points of wifi affects on humans Eustace Mullins · The Neo Zionist Order (Full 1hour 38 ... minutes)  https://www.youtube.com/watch?time_continue=14&v=rVWQMG4SHzE  Bill C. explains agenda   https://www.youtube.com/watch?v=QAv5eLfEdQ4  Rothschild interview in which he says his family embraces zionism/synagogue of Satan/freemasonry is zionism fer gentiles. https://www.youtube.com/watch?v=Kj5eypBex-U
Snap Crackle Pop	Thumbs down for crypto plug
Bad Actor	Why is it no one has done anything to put "The Corpse" in the ground.?? Send "The Corpse" to the Saudi Embassy in Turkey for Processing.
John Go	90 thousand dollars is given to the Vatican for every migrant delivered to the West.
Stephen Hamer	These people are being used. It is despicable.
Goh Eng Hong Stephen	In other countries, this simple case  akready settled long ago. Marshall law activated, do like the burmese army do.Cross the bother? And shall be killed, so think 3 times before crossing.
Tony Gonzalez	🇺🇸🇺🇸🇺🇸BUILD THE WALL....  QUADRUPLE THE NUMBER OF ICE OFFICERS. NO MORE DACA OR ANCHOR BABYS,  NO MORE ILLEGAL IMMIGRANTS ALIENS.  NO MORE SANCTUARY CITIES OR STATES.  NO OPEN BORDERS  NO AMNESTY.  NO CHAIN MIGRATION.  NO DIVERSITY LOTTERY.  ONLY LEGAL MERIT IMMIGRATION. 🇺🇸🇺🇸🇺🇸🇺🇸🇺🇸I'M VOTING REPUBLICAN IN NOVEMBER AND I DON'T KNOW ANYONE WHO IS NOT VOTING REPUBLICAN. 🇺🇸🇺🇸TRUMP IN 2020.🇺🇸🇺🇸  DEMONRATS HAVE LOST THEIR SLAVES.
Bundy 4Prez	These are not immigrants. They are invading mercenaries.
ZipYour Lib	Let's send a Caravan to Honduras...full of prison axe murderers, crackheads and NPC-Libtards, see how they like it..!
SAMMI SCHINDLER	I'm praying Soros is taken down! Military defend our border!
Michael DeSilvio	George Soros real name is Guy Orgy Schwartz.
