david williams	The Low-life illuminati leftists in the Democrat Party, and their socialistic "drive-by media," have shown they no longer have any business representing "We," the American People. They are funded by the Soros/Rothschild Cabal who own or control 93% of the media in our country and the voting machines in 16 of our states. They have turned the Democrat Party and their RINO's into  nothing but  Soros/Rothschild pawns. When was the last time the Democrat Party supported or initiated a bill that would actually work for the American people to make our lives better?  Which Party moved Social Security from a private trust to a public fund so they could spend it? Which Party stopped tax deductions for Social Security Payments?  Which Party started giving your social security savings money to illegal and unvetted immigrants who have never paid into it? Which party is calling for open borders and inviting dangerous criminals freely into our country? Which party did not give those who paid into  Social Security their whole lives, a decent 'cost of living increase for 8 years, which pushed our Seniors into "unwarranted poverty?"  Which party wants to abolish funding for the wall to allow easy access for criminals and their epidemic drug trade into our country with "open borders?" .......then fire the ICE agents who protect our borders?  Which party shut down the Federal government to support their illegal voter base and ignored our Constitution and the rights of our own citizens? Which Party is riddled with corruption and sex-trafficking scandals among its members? Which party's President blew more of the taxpayers money than all the Presidents before him combined, and lowered our International status from a "first world AAA nation," to a  downgraded "second world nation?"  What party voted 100% unanimously for abortion up to 9 months?  Which party wants to steal your second amendment and any other Constitutional right they can from us? Which party is issuing  State I.D. cards, and driver licenses to illegal invaders, and encouraging them to illegally vote in our elections? (They are also  dead set against voter i.D. in other states) Which party had a candidate who received over 3 million illegal votes in the state of California alone in the last Presidential election? .Which party gave 150 billion of the American taxpayers money to Iran who is the largest supporter of terrorism in the middle east? Which party signed the U.N. Small Arms treaty in an act of treason against the American people, our Constitution  and our sovereignty as a nation?  Which Party's Liberal Judges intentionally halted our President from stopping travel from terrorist nations who mean to do us harm? It is..."The Democrat Party!". If as an American citizen, you are sick of them ripping us off, lying to get elected, committing treason against our President, and our people, threatening our Constitution, safety, and sovereignty, as a Nation with their army of socialist, llberal  judges embedded in our Judicial system, get out and vote. Otherwise you are  enabling  them to defy our Constitution,  their oaths of office, and commit corruption, treason,and acts of sedition against our Nation. . We  the people  need to discern  the truth, then get out our vote now in these mid-terms. Otherwise the "party of crime,"will steal our President with impeachment, and then turn us into another Venezuela like Hillary planned to do to us, after she finished crashing the failing economy which was Obama's only "real" legacy.  Vote for the jobs, not for the mobs!
Carrie Jones	Take BACK AMERICA BLOOD OF JESUS RED WAVE
Shingen036	It's also why they try to make "white nationalist" a "hate group". Better to be a white nationalist than a white globalist.
Jesse Souliere	I know what's actually happening through years of research and un human encounters and I'm just waiting until the world wakes up to the truth of what they are hiding from humanity and when the world does find out the people of the world will want to noose them from the street lights, we are their slaves and they don't want us to be free and strip their power from them, but I believe they are screwed. karma is a bitch
Uncle Buck	I think that the footage of the migrants is actually old footage of people entering a Selena concert.
David Rhodes	Why isn't George Soros being hunted down and taken out like bin laden??? He's just as much of a threat to our country
TIEZILAGEL	THE 1% WELCOME$ YOU , WE NEED YOUR ADRENACHROME, BLOOD , BODY PARTS , SEX $LAVE$ , FREE LABOR  SLAVES [YOUNG & OLD ] & OH YEAH  YOUR VOTE FIR$T .......THE SATANIC 1% NEED$ YOU ,,HURRY UP TO YOUR DEATH & DE$TRUCTION IN THE NAME OF $0 - CALLED FREEDUMB , NO FREEDOM , WE DON'T EVEN HAVE FREEDOM ,, YET - until WE ARE SELVES MUST BECOME FREE FROM THE FEDERAL RESERVE & FRACTIONAL RESERVE BANKING .. SWISS NAZI CONTROL THE WORLD ,,$TILL since 1291 at least ...learn & PASS IT ON..https://youtu.be/YERHIxqnfwY
Gilbert R Flores	I called an American Patriotssomebody kill George sorrows###!!!!!!now execute him with extreme prejudice for crimes against establishments America wake up American patriots its call of 1776 is calling you wake up destroy the enemy within the Communist Democratic Party  a good communists is a dead  Democrat that's a good Democrat good and Dead Communist PIGS #####!!
Brother Ed	SEE SOMETHING SAY SOMETHING   Been trying to get email through Whitehouse.gov and it won't go through.  Possible POTUS enemy is actively soliciting money through go fund me to go against and counter who he considers and calls the "madman".  Please pass this along if you would  Possible enemy of POTUS  https://www.gofundme.com/florida-maquis-resistance-cell-ops  WWG1WGA
Lance Paxman	TRUMP stopped the caravan for now  Stopped them from coming into mexico
Kirin F.	It's us against the world.
Sandy Walker	God bless you and your channel! The people of our Great Nation are awake and ready to vote. I found your channel because it was sent to me by a friend. I have shared it with my friends! This is a movement for sure!
Axis	Easy solution to ALL of our problems, banish all jews from the country. As done before more then 110 times.
Steve Larsen	I would love to see the President utilize the army to prevent entry into US then have George Soros arrested for funding this insurrection. The fact that Soros continues to instigate with no ramifications highlights the President' weakness as a leader.
Gary Chynne	WHAT A MESS
William Grayson	Let them in we need more cheap labor if I work any cheaper I will be working for free come one come all I'm losing my house
Carlos Rivera	Soros thugs w payments to healthy!....illegals...why are we not suprised :/ commie-Nobama!!! money it seems!!! N TRUMP!!♡ is correct! to utilize our military☆☆☆☆ at our borders,Amen! ;)
LegaliseIntellect LegaliseIntellect	BOMB SAUDI ARABIA!!!!
Cookie of Champion	DEMonS
NoMoreTribute 2Rome	So you have a rich philanthropist meddling in governments all over the world but all of a sudden it's not cool now that it's coming to our doorstep. And then to blame the oppressed people seizing an opportunity to come up here for a better life is just assinine. Is anyone even listening to why they are coming? They are tired of the gang violence, drug war, meddling in their own governments by us! This is all just a big play to confuse and further drive the lower classes into disarray
remnant0888	"Helel" wrote them. He's called Lucifer, but he's the darkness bringer not light bringer.
Daan Beenders	We have to pick up the guns and go to war. We have to drag the Satanic NWO criminals out of there caves, destroy there infrastructure and excecute them all. We have to do this before it’s to laten and our lives are taken over by them.
Rob Moir	LOCK GEORGE SOROS UP AND BEAT HIM TO A PULP
Bubbles	L/R Propaganda reverse psychology contradiction political religious gender race war . The citizens will wake up when it's too late human nature . Guns guns guns god god god Q Q Q Trump Trump Trump war war war . . . Keep the citizens divided maintain control .
Randy Purtteman	George  Soros, a man whose name many in this country did not know until the last election. Why should you, unless you or your country has had to deal with his demonic meddling such as Russia where he nearly bankrupted that nation after the fall of the Soviet Union. Or England, where he caused the collapse and the reconstruction of the Bank of England. This man came to America in 2004 with the stated goal of destroying us economically and culturally as we were the only western power still able to thwart his  New World Order globalist government. To understand the man you only have to go back to his political roots during World War Two where he was instrumental in finding and exposing his country's Jewish population for the Nazis. This included his father. He even took to wearing a SS uniform although he was not a formal member of the invading German Army. His financial roots go right to Rothschild was famously stated " I care not who make  it's laws, only that I control the country's money". You see his hand all over this migration, indeed if Hillary had become our President, which despite his considerable influence, she didn't, this would be seen as the culmination of "her" open border policy. Nothing would have made the liberal left  including Democrats more happy. This migration, if it isn't halted completely, has the potential to destroy our country just as the Soros funded migration from the Middle East has brought social destruction to all of those countries in Europe it has touched. It has brought political change to many of those countries already because its citizens what to keep their societies and culture free from such a change in western values. It will bring more. In this country we must, immediately, put a halt to those people who act subversively to destroy our fabric of life. They include but are not limited to Soros, the Clinton's, Obama, and those in the Democratic leadership who support this destruction. Already the illegal aliens we have in this country cost us billions of dollars each year. They are suppose to be here period and do not have ANY legal rights. But yet whole cities are taking them in, shielding them from the law, giving them food stamps, housing, and medical care, all at the cost of us, the tax payers. The Democrats don't care about them. They see them as only a potential large voting block that they can use to seize power and thus expand their control. Get educated, be aware, or be ready to loose your freedom as you know it.
SEEKING JUSTICE	Let me start by saying I keep hearing the number four thousand that's four thousand people that is a lot more than 4,000 people don't bullshit yourselves it's more in the realm of about 12000 looking at the photos I've seen
wyoprospector	Once again Soros continues to break laws with no consequences so why should he stop? He should have been executed years ago for the crimes he committed during wwii, but he will never be punished for anything, unless by some miracle he suddenly appears in front of me.
Angela Cobb	Unduly? Lol..well just erase all tbe murders n rapes n drugs n gangs and then get rid of all evidence and years of experience in law enforcement and then maybe tbe fear is uncalled for..as with muslims who want to kill everyone that doesnt convert or mexican n latin illegals just bangin on our door forcing their way in to take ur shit..lol..pls..close borders deploy military
Timmy Sixx	Hang em' high!!
The Hark	if you think trump is "different" , you are soaking up the fuckin koolaid with a straw, these criminals would have been under arrest many months ago, does geneology, history, or common sense exiu8st in your cult world, snap out of it shawn, you are furthering and promoting this terms latest priest, how in the hell can you sheeple keep believing the same godamn source of bullshit, isnt the same godamn source of bullshit. ??????????????
terryketrow	I believe Soros. is dead. In a plan crash in the Alps they're using his name as some kind of a scapegoat he'll get all the blame but he's not really alive supposably in the Alps the plane went down the tower said so. They just never went after him.  The just had a picture of him giving money to abortion. U can see the picture was dated 2006. And make avatars are clones of people's lives. This is an an attempt bring in other people that they can manipulate. Why because so many are waking up to the false information given to us are whole lives.
Victoria Francois	Anyone seen the military heading to the border ?? I they don't it's been planned all along
Geronimo	still not enough for me to get excited. Too much talk, too little action.
moviemoll.com	Soros, Soros, Soros...
Jason Swanson	How can Soros get away with undermining our country for years...wtf...paying illegals to Storm our border...this is total bullshit...I'm glad "WE" have real news to hear about this...thanks SGT for the TRUTH...🇺🇸🇺🇸🇺🇸
Connie T	I can’t wait until the fisa is release!!
Tammy Wines	Look into George Clooney he and his liberal left wing groups are helping these ppl too. Stop them Mexico we are fed up now !!
Michelke Worley	Is it not a crime to knowingly aid anybody or group that is intending to cause harm or commit crimes?
rodolfo puente jrrodolfo	Kill kill him he is a terrorist to the USA  he is Satan Sorors  kill him now !!
Luz Montalvo	Is that "army" as the CELTS when they try to tumble the Roman empire?... where they ended up VANISHED... GO AHEAD, BRING IT ON!!!?USA MUST STOP ALL TO THOSE COUNTRIES ALLOWNCES/$$$$/HELP... SOMETHING THEY DON'T DESERVE!!
WillRaj	On EU plaque the words FINAL REMEDY =  FINAL SOLUTION  for freedom in the U.S. And other countries where freedoms still exist.
Dave Geusz	Thank you
Angelo Jamaica	Its time to purge the US from Democrats
John Hare	The distance between Brownsville, TX. and Copan Ruinas, Honduras is 1400 miles. It will take 460 hours to walk that distance. At 8 hours a day, non stop, it will take 57.5 days. Some questions. Can you carry enough food and water for 58 days in a backpack? How much does it cost to feed 3K people for 58 days? Food cost at 3 dollars a day per person for 58 days is 522,000. dollars, WHO is picking up the tab?  And WHY? Sources; Google maps and arithmetic.
Jay Walker	We all need to be thankful this man is our president.
t.dezyn 24516177	And whilst all of this staged attention goes to the visual criminals the agenda continues. Why is it Amrerica has the 4th of July as independance day? For Jews Lie, thats why. Trump is not the saviour, he's a false prophit! Prophit=profit! Jewel. Jew El, el the one word for god! Diamonds are worthless bits of carbon! Fiat money is worthless. Saudi Arabia is being turned into a new financial hub! Sophie the AI is also there! Israel allowed to do as they please? Genocide is acceptable there, Sauds still chop off heads? 400 years ago the slave trade started, there was a huge eclipse across Africa at the time, USA experience the exact same eclipse in 2017! The time of collapse started way back, now coming to fruitition and if your critical in thinking, you'll see what is really going on.  Check out old maps of the 1500's to the 1800's, all historical names in the bible are in Africa, not the fake Israel you see today full of pawn fake jews! African Appartied was the point maps were altered. Coincidence with WW1! No coincident. Do the research of these events. UK empire was dismantled to give way to building USA and now USA has to give way to the Middle East-China.  Trump is fake too, although we would all like to think otherwise, history proves future. A repeat, nothing new under the sun
Du-du Matzkò	The fulfilment of the book the jews banned in the beginning of 1900s: The PROTOCOLS OF THE LEARNED ELDERS OF ZION. That is in reality the fulfilment of the: Babylonian Talmud. In other words: Jewish supremacy at its best, they want to rule the world by first creating chaos. These jews who call themselves Jews but are NOT they are the Synagogue of satan
Nancy Volker	I LOVE BP...lets get that caravan turned around
sporto100	FBI raiding san Juan was a fake news story. Sgt is controlled op
robert4you	5:22 Hillary is extremely disgusting in this clip. That woman can't have a soul. Impossible.
John McCall	they better open fire on these illegals mother fuckers
James Ryan	Thank you for this hard hitting video. I believe the sleeping giant, the Majority of Americans, has finally awoken and is at this point absorbing everything they have been ignoring. The catalyst was the Kavanaugh debacle. So every single video like this is now being witnessed by new eyes, and open minds. Thank you Sean for your hard work and time getting this info out to the people, and your guest interviews.   If we were to shut off cable news right now, there would be no one to parrot the talking points except the ones getting paid. We would at that point know who to start locking up, and arranging trials, for sentencing. Lets go arrest Hillary & Bill Clinton. We do not need the police to do so. Many of us can be temporarily deputized by sheriffs & U.S. Marshals to do so, and with a large enough group, we could bring her & Bill in UNHARMED, to a safe house with full security, for the trial date. Then bring them in by armed guard courtesy of the U.S. Marshals service. We know the crimes. Hell most of the non leftist judges know the crimes. It would not be hard to find a panel of judges to convict her of Treason, Sedition, and him of being a sexual predator, and pedophile.  They ALL of these piles of shit should be scared to death!! Judgment day is calling!!! Keep up the good work Sean!
DM Queen	I want to see everyone of them get arrested ASAP!
Time to wake 2018	There will come a time when we will need to take action. Hopefully, with luck, it won’t be too late! Stay awake, vote and be involved at all times patriots. We can’t afford not too!
bill stock	Can sometimes please explain the Freemason hand gestures by President Trump when sitting in the Oval office?
NewDisciple	If Soros disappeared permanently it wouldn't heard my feelings a bit.  He is the enemy and should be dealt with as the same.
Brazilian Lady	But the problem is Russia they say
Janet Woods	You tell them JW
Rix Pix	Never forget that if hard working taxpayers like us had done any of this we would be buried in a prison cemetery by now. We have to resist at all cost.
Wes Martyn	Whatever the leftists call others or say. They, actually are, and are doing. The most heinous evil imagined.
Ken Blake	simple solution, machine gun every 500 yds along our border. end of problem
Evan Williams	Great great videos! Great service my friend.need more qanon+deep state and trump videos.
EXTOL ZEBULON	soros army ? Send in the seals.
beablessed1	Excellent. You guys are good at this.
nick corso	Soros has to be arrested !!
J.D. Fagan Sr.	Lock them up or hang them if possible.
Don Weaver	If they settle these folks on Hillary's Hampton property and she is required to fund them then bring em on.
WhitePride WorldWide	It's the Zionists
Nelio Anderson	They are leaving because their countries are shit holes
Colin Foster	Trump talks about the vital need for sovereignty yet all his international actions are in the interest of Israel which is at the centre of the globalist agenda. Also many people he has appointed to surround him follow that agenda. What is going on????
johnny6148	Soros just a stinking YID
John Paterson	Published 21 October 2018  Queen Converts to Islam!  Hmmm, well wouldn't ya know, the Queen has been a Muslim all along as she's a direct descendant of the Prophet Muhammad the founder of Islam and on 24th Nov 2010 she officially acknowledged she was a Muslim at the Sheik Zayed Grand Mosque in Abu Dhabi by donning a Muslim headscarf. So, if you're wondering why the once great Britain is now a Muslim Caliphate there's your answer!! Yer, but, St Anthony, the Queen is supposed to be the head of the Anglican Church. Ha ha ha, she couldn't give a toss about the church as everyone knows they're all a bunch of apostate PAEDOS, especially you know who nod nod wink wink at Hampstead Christ Church, while the Muslims would throw the LGBT queers from the highest rooftops and enforce strict Islamic Law aka Sharia Law. Yer, but the Brits don't want Sharia Law. Yer, of course they don't want Sharia Law, but that's what they've got because the dumb Christians all say God's law is scrapped and we can all rock n roll our way to heaven courtesy of Aleister Crowley's adage do what thou wilt shall be the whole of the law aka dieu et mon droit. So, what's the final outcome of all this? Simple, all out CIVIL WAR!!
Darrell English	Time to Revoke Soros US Citizenship and Sez his account and Arest him
John Smith	SeekingTheTruth 22 minutes ago I'm begging everyone to sign the close border petition.  Https://www.petition2congress.com/ctas/close-border-petition  every single person has to tell our politicians that they need to protect us.  All our politicians see and hear is the media telling them everyone wants open borders so we have to do our part to tell them we want security.  Thank you.
John Lansing	How many diseases do these people carry? Which schools will have the privilege of first exposure? Which neighborhood will have the new health problems? This is why medical screenings are performed?
mom of4	😂😂😂 Now it's gonna be the concrete pillar 's fault that she lost the election
beaudaxx bear	Look if Mexico is going to let them do this then Mexico has to be viewed as an enemy. Unfortunately there is but one way for us to protect our country as harsh as it may seem. If they let one of them in I can no longer back this administration.
Charles Schindler	If you see soros kill him!!! 🇺🇸 death to swartz!!!  🇺🇸
Stephen Cockett	The ORCS of Mordor are on the move.
Sumonbilla Pani Poth	Remind me only Ancient time Hanabil attack , Wall and Decline of a Rouge Empire story called Rome . Sorry America ur time is near ,  TRUMP is also a ZIONIST puppet who is giving money to him Sheldon Adelson another Jew , usa created by Freemasson people from Moon club UK.
Frei Geist	EU = NWO ! Junker = Evil ! Stopp the Staat of EUnion  (EU)
yvette aHarrison	They MUST be kept out ! Maybe taking Soros out might be a good move ? Just sayin !
mstoneking2611	Thank you God
x Anonymous	" GROSSEN DANK "         AUS  DEUTSCHLAND  !!!                             ThanQ
thorp kal	SGT REPORTT YOU MORON __WHY ARE YOU PROMOTING AI???????!!!!
Mariola Anna	A deep strategy is needed ! it seems to me they are trying to create fights and serious problems in  US and Mexico borders, so that they can show hurt women and children and blaming the borders protectors and  Potus for that in their fake news world wide media.
ta2joe13	Yes, this is an invading army and needs to be treated as such. I believe that they should get all the darpa shit like focused microwave beams and laser weapons to act as a first line of defense. Then if that doesn't work then go to the next level of defense then if all else fails go to the lethal option and hit em with AC-130 Specters, mortar rounds and napalm!
Blue Mooney	the democrats don't give s shit about the homeless AMERICAN PEOPLE, what about the AMERICAN PEOPLE?? SOROS and the DEMOCRATIC party are responsible for all of what's wrong in AMERICA!! WE NEED TO PROTECT THE AMERICAN PEOPLE!! VOTE RED!!! Don't let these criminal take our country, our freedom!!!
LilRed M.	Stop George Soros, and all his paid puppets, deporte his ass, or just kill his ass, he's trying to harm our country, so let do something about this clown.
Deborah 888	Great video! Thank you!! This latest stunt by the Democrats has backfired! Sending a wave of migrants to storm our border? Who wants to see that? Nobody! Time to arrest those responsible for this!! I bet many of those kids in the caravan are being trafficked too.
Alasdair Macgillivray	Well they can stick that inscription where the sun don't shine! I'm keeping & fighting for my British sovereignty! #Brexit #TOMMYISFREE #IAMSOLDIERX
Amber Norton	GOD shall prevail!!   Thank you for Trump!!!👍🙏
carlos valentin	Trump, goes beyond the White House. He is planing for after office. HE IS A GLOBALIST, IN COJUTS WITH THE ZIONIST. BUILDING 666. HIS SON IN LOW OR HIS FIRM 666. ARE INTO BIG BUSINESS, WITH THE KILLER KING. PLEASE DO NOT UPSET THE KING. FOR WE NEED HIS MONEY. AND WE NEED A FRIEND IN THAT PART OF THE WORLD. BEFORE THEY GO WITH RUSSIA, OR CHINA. i HEAR THAT RUSSIA, MISSILE, 500 SYSTEM. WILL EAT BOMBERS, FOR BREAKFAST.
Israel out of Palestine	If you don't believe in your country.  Leave it. But don't come to my country if you don't believe in it either.
Laima Zick	Thank the Lord for you ! Your hard work and diligence in speaking truth doesn’t go unnoticed......God bless and keep you ....God bless and protect our President and all the righteous in the fight for our nation !  WWG1WGA❤️🇺🇸❤️🇺🇸❤️🇺🇸❤️🇺🇸
Nidal Shehadeh	I cannot comprehend youre deafening silence on Trump's plan to attack Venezuela , Venezuela a country of about 20 million took in what is equivalent of 25% of it's  population from Colombian refugees who had to flee the American back War on Drugs ,   25% of Venezuela's population is equivalent of 60 million moving into the US , if Trump attacks Venezuela this mob Caravan you all talking about will be in the Millions , I think you all have a streak of hypocrisy running parallel with all the Hypocrites out there .  Watch "10/20/18~YOU WILL BE *LIVID(!) WHEN YOU SEE THIS(!) NO EXCUSES! NO JUSTIFICATIONS(!)" on YouTube https://youtu.be/f70x93cRo6c
Tom A	huh, looks like the caravan to Europe the other year. Funny that
DEMOCRATS BLOW-EACH-OTHER	EVERY CITIZEN SHOULD HAVE THE RIGHT TO SHOOT SOROS DEAD ... HE SHOULD BE BY NOW HOPE HE DROPS DEAD ASAP
